,BasisOfRec,Binomial,CatalogNo,Citation,CollectID,Compiler,Data_sens,Dec_Lat,Dec_Long,Dist_comm,Event_Year,Origin,Presence,Seasonal,Sens_comm,SpatialRef,YrCompiled,recordedBy
1680,HUMAN_OBSERVATION,Citharexylum macradenium,20469757,GBIF,,Manuel Vargas,,9.794425,-83.973051,,2013.0,1,1,1,,WGS84,2020,Richard Olmstead
1900,PRESERVED_SPECIMEN,Citharexylum macradenium,L.2763529,GBIF,"McPherson, GD  9558 ",Manuel Vargas,,8.583333,-81.75,"Bocas del Toro: Region of Cerro Colorado, 7.2 miles above Camp Chami, forest along trail.",1986.0,1,1,1,,WGS84,2020,McPherson GD
2561,PRESERVED_SPECIMEN,Citharexylum macradenium,3218372,GBIF,4107,Manuel Vargas,,10.33,-84.83,"Monteverde, upper community, lower montane wet forest on Pacific slope.",1986.0,1,1,1,,WGS84,2020,W. A. Haber
7290,PRESERVED_SPECIMEN,Citharexylum macradenium,442947,GBIF,Jiménez Madrigal 1074,Manuel Vargas,,9.8,-83.96,"La Cangreja, junto a la Carretera Interamaericana",1992.0,1,1,1,,WGS84,2020,Quírico Jiménez|Óscar Castro|Nora Martín|Víctor H. Ramírez
7293,PRESERVED_SPECIMEN,Citharexylum macradenium,442006,GBIF,Croat 67890,Manuel Vargas,,8.733333,-82.241667,"Gualaca-Chiriquí Grande 8.0 miles beyond Los Planes de Hornito; 6.9 miles beyond road turnoff to Caldera, 1.4 miles to W of Centro de Operaciones; along trail to Río Hornito and metereological station.",1987.0,1,1,1,,WGS84,2020,Thomas B. Croat
7417,PRESERVED_SPECIMEN,Citharexylum macradenium,946681,GBIF,Boyle 2710,Manuel Vargas,,10.21,-84.1,"Parque Nacional Braulio Carrillo, Cordillera Central, Sendero del Transecto, 0.5 km south of junction at 1730 m with trail to La Legua de Barva.",1994.0,1,1,1,,WGS84,2020,Brad Boyle|Alice Boyle
7531,PRESERVED_SPECIMEN,Citharexylum macradenium,906615,GBIF,Lépiz Villalobos 38,Manuel Vargas,,9.49,-84.04,Faja Costeña del Valle de Parrita. Esquipulas de San Lorenzo. Bosquetes y cercas a orilla de camino.,1993.0,1,1,1,,WGS84,2020,Eduardo Lépiz|et al.
7880,PRESERVED_SPECIMEN,Citharexylum macradenium,891884,GBIF,Haber 10731,Manuel Vargas,,10.3,-84.8,"Cantón de Monteverde, upper community on Campbell farm. Pacific slope.",1991.0,1,1,1,,WGS84,2020,William A. Haber|Willow Zuchowski
8067,PRESERVED_SPECIMEN,Citharexylum macradenium,775907,GBIF,Boyle 970,Manuel Vargas,,10.177222,-84.113333,"Parque Nacional Braulio Carrillo, Sendero del Transecto, in abandoned pasture near refugio",1992.0,1,1,1,,WGS84,2020,Brad Boyle
8084,PRESERVED_SPECIMEN,Citharexylum macradenium,764749,GBIF,Solomon 5391,Manuel Vargas,,10.333333,-84.8,Monteverde.  Cloud forest at edge of continental divide and on Pacific side of slope.  Collected by H. Rodríguez.,1976.0,1,1,1,,WGS84,2020,James C. Solomon
9615,PRESERVED_SPECIMEN,Citharexylum macradenium,448095,GBIF,Haber 4107,Manuel Vargas,,10.33333,-84.83333,"Monteverde, upper community, lower montane wet forest on Pacific slope.",1986.0,1,1,1,,WGS84,2020,William A. Haber
9617,PRESERVED_SPECIMEN,Citharexylum macradenium,448018,GBIF,Haber 702,Manuel Vargas,,10.309444000000001,-84.804167,"Monteverde, upper community",1984.0,1,1,1,,WGS84,2020,William A. Haber
9621,PRESERVED_SPECIMEN,Citharexylum macradenium,445366,GBIF,Gentry 48738,Manuel Vargas,,10.783333,-84.833333,Monteverde.,1984.0,1,1,1,,WGS84,2020,Alwyn H. Gentry|William A. Haber
9628,PRESERVED_SPECIMEN,Citharexylum macradenium,444192,GBIF,McPherson 9558,Manuel Vargas,,8.543333,-81.803333,"Region of Cerro Colorado, 7.2 miles above Camp Chami [Chame].",1986.0,1,1,1,,WGS84,2020,Gordon McPherson
9629,PRESERVED_SPECIMEN,Citharexylum macradenium,444059,GBIF,McPherson 12852,Manuel Vargas,,8.75,-82.25,"Fortuna Dam area, along trail from road across Rio Hornito.",1988.0,1,1,1,,WGS84,2020,Gordon McPherson
9630,PRESERVED_SPECIMEN,Citharexylum macradenium,443934,GBIF,McPherson 8287,Manuel Vargas,,8.816667,-82.4,Along trail to Cerro Pate Macho.,1986.0,1,1,1,,WGS84,2020,Gordon McPherson|Mary Merello
9631,PRESERVED_SPECIMEN,Citharexylum macradenium,443602,GBIF,D'Arcy 15983,Manuel Vargas,,8.73333,-82.23333000000001,Banks of Fortuna reservoir.,1984.0,1,1,1,,WGS84,2020,William G. D'Arcy|H. W. Churchill|Carol A. Todzia
9933,PRESERVED_SPECIMEN,Citharexylum macradenium,3497446,GBIF,González Arce 1384,Manuel Vargas,,10.153333,-84.548611,No protegida. Cuenca del Barranca. Zapotal.,2002.0,1,1,1,,WGS84,2020,Luis A. González|R. Chavez
9968,PRESERVED_SPECIMEN,Citharexylum macradenium,3479330,GBIF,Araúz Servellón B2862,Manuel Vargas,,8.72222,-82.23722,Reserva Forestal de Fortuna. Estación biológica de STRI,2001.0,1,1,1,,WGS84,2020,Blanca Araúz|Nayda Flores|Rafael Aizprúa|A. Tarte
11420,PRESERVED_SPECIMEN,Citharexylum macradenium,2568956,GBIF,Smith 168,Manuel Vargas,,10.17805,-84.42166,San Luis de Zarcero,1937.0,1,1,1,,WGS84,2020,Austin Smith
13116,PRESERVED_SPECIMEN,Citharexylum macradenium,2090079,GBIF,Burger 10277,Manuel Vargas,,10.05,-84.01,"Heredia and San José Provinces, open pasture and remnants of lower montane rain forest formations on ridges and steep slopes along the Río Para Blanca (Pacific drainage), Cerros de Zurquí",1977.0,1,1,1,,WGS84,2020,"William C. Burger|Gary Visconti|Johnnie L. Gentry, Jr."
13153,PRESERVED_SPECIMEN,Citharexylum macradenium,2081450,GBIF,Tonduz 7407,Manuel Vargas,,10.05,-83.98,La Palma,1898.0,1,1,1,,WGS84,2020,Adolphe Tonduz
13223,PRESERVED_SPECIMEN,Citharexylum macradenium,2050609,GBIF,Valdespino 465,Manuel Vargas,,8.754722000000001,-82.22166700000001,"Fortuna, camino de quebrada Bonita. Hacia el este del rio Chiriquí.",1987.0,1,1,1,,WGS84,2020,Iván A. Valdespino|M. Ruíz|Clementina Chung|Guillermo Carcamo|Noris Salazar A.|Beatriz Lara|Dilia Santamaría
13224,PRESERVED_SPECIMEN,Citharexylum macradenium,2050341,GBIF,Mori 7773,Manuel Vargas,,8.531667,-81.813333,"Cerro Colorado, 50 km N of San Félix on the continental divide.",1975.0,1,1,1,,WGS84,2020,Scott A. Mori|Robert L. Dressler
13225,PRESERVED_SPECIMEN,Citharexylum macradenium,2050607,GBIF,Béliz 186,Manuel Vargas,,8.808333,-82.42666700000001,Palo Alto-Boquete cerca a la finca Arco Iris.,1977.0,1,1,1,,WGS84,2020,Tania Béliz
13226,PRESERVED_SPECIMEN,Citharexylum macradenium,2050202,GBIF,Correa A. 2803,Manuel Vargas,,8.716667,-82.283333,"S.O. del campamento de Fortuna. Sitio de presa. Desde la finca Pittí hasta el filo del Cerro Fortuna [original coordinates on label: 08º45'N, 82º15'W]",1976.0,1,1,1,,WGS84,2020,Mireya D. Correa A.|Robert L. Dressler|Noris Salazar A.|Jorge A. Mendieta M.|Francisco Farnum|Cristina Garibaldi E.|Tania Béliz
13227,PRESERVED_SPECIMEN,Citharexylum macradenium,2050460,GBIF,Haber 195,Manuel Vargas,,10.3175,-84.80666,"Monteverde, upper community",1978.0,1,1,1,,WGS84,2020,William A. Haber
13228,PRESERVED_SPECIMEN,Citharexylum macradenium,2050095,GBIF,Téllez Valdés 4316,Manuel Vargas,,10.3,-84.8,"Monteverde,",1981.0,1,1,1,,WGS84,2020,Oswaldo Téllez V.|H. Brailowski|J. Bueno|E. Barrera
13230,PRESERVED_SPECIMEN,Citharexylum macradenium,2049510,GBIF,Béliz 186,Manuel Vargas,,8.808333,-82.42666700000001,Palo Alto-Boquete cerca a la finca Arco Iris.,1977.0,1,1,1,,WGS84,2020,Tania Béliz
13232,PRESERVED_SPECIMEN,Citharexylum macradenium,2049285,GBIF,Jiménez Madrigal N=617,Manuel Vargas,,10.25,-84.31666700000001,Reserva Forestal Juan Castro Blanco. Faldas Cerros Volcán Viejo. 4 km NO de Bajas del Toro.,1988.0,1,1,1,,WGS84,2020,Quírico Jiménez|Luis H. Elizondo|Rafael Hernández Magaña
13233,PRESERVED_SPECIMEN,Citharexylum macradenium,2049367,GBIF,Gómez Pignataro 19729,Manuel Vargas,,9.74,-83.96,"La Sierra, 6 km northeast of Empalme",1983.0,1,1,1,,WGS84,2020,Luis Diego Gómez P.
13234,PRESERVED_SPECIMEN,Citharexylum macradenium,2049930,GBIF,Dwyer 7709A,Manuel Vargas,,8.823333,-82.44833299999999,Cerro Horqueta.,1967.0,1,1,1,,WGS84,2020,John D. Dwyer|Mary V. Hayden
13236,PRESERVED_SPECIMEN,Citharexylum macradenium,2049840,GBIF,Dryer 541,Manuel Vargas,,10.301110000000001,-84.79916,"Provincias de Alajuela, Puntarenas y Guanacaste, en orilla de bosque y camino a la Reserva",,1,1,1,,WGS84,2020,Valerie J. Dryer
13237,PRESERVED_SPECIMEN,Citharexylum macradenium,2049094,GBIF,Skutch 3721,Manuel Vargas,,10.17,-84.15,"Vicinity of Vara Blanca, north slope of Central Cordillera, between Poás and Barba volcanoes",1938.0,1,1,1,,WGS84,2020,Alexander F. Skutch
13238,PRESERVED_SPECIMEN,Citharexylum macradenium,2049570,GBIF,Lent 1831,Manuel Vargas,,10.18,-84.31,Woods on Atlantic side of Alto Palomo,1970.0,1,1,1,,WGS84,2020,Roy W. Lent
13239,PRESERVED_SPECIMEN,Citharexylum macradenium,2049351,GBIF,Béliz 186,Manuel Vargas,,8.808333,-82.42666700000001,Palo Alto-Boquete cerca a la finca Arco Iris.,1977.0,1,1,1,,WGS84,2020,Tania Béliz
13240,PRESERVED_SPECIMEN,Citharexylum macradenium,2048688,GBIF,Utley 3863,Manuel Vargas,,9.83,-84.04,Altos de Tablazo about 5 km southeast of Higuito on Calle Tablazo or about 12 km southeast of Desamperados,1976.0,1,1,1,,WGS84,2020,John F. Utley|K. Burt-Utley
13241,PRESERVED_SPECIMEN,Citharexylum macradenium,2049043,GBIF,Allen 2784,Manuel Vargas,,8.623330000000001,-80.10833000000001,"Region north of El Valle de Antón, vicinity of La Mesa",1941.0,1,1,1,,WGS84,2020,Paul H. Allen
13242,PRESERVED_SPECIMEN,Citharexylum macradenium,2048768,GBIF,"Kirkbride, Jr. 907",Manuel Vargas,,8.75,-82.25,"On Chiriquí Trail, between Pinola and Quebrada Hondo toward summit.",1968.0,1,1,1,,WGS84,2020,"Joseph H. Kirkbride, Jr.|James A. Duke"
13243,PRESERVED_SPECIMEN,Citharexylum macradenium,2048635,GBIF,Dwyer 7700,Manuel Vargas,,8.823333,-82.44833299999999,Cerro Horqueta.,1967.0,1,1,1,,WGS84,2020,John D. Dwyer|Mary V. Hayden
13245,PRESERVED_SPECIMEN,Citharexylum macradenium,2049246,GBIF,Him 92,Manuel Vargas,,8.63333,-82.21666,Proyecto Fortuna. Valle de Hornito,1981.0,1,1,1,,WGS84,2020,José J. Him|Ibrahim O. Gordon
13246,PRESERVED_SPECIMEN,Citharexylum macradenium,2048362,GBIF,Lallathin 276,Manuel Vargas,,8.6375,-80.106944,Cerro Pilón.,1968.0,1,1,1,,WGS84,2020,B. R. Lallathin
13247,PRESERVED_SPECIMEN,Citharexylum macradenium,2049112,GBIF,Mendoza 172,Manuel Vargas,,8.73333,-82.25,"Potrero Pitti, al sur del sitio de presa en Fortuna.",1976.0,1,1,1,,WGS84,2020,Rodolfo Mendoza|Jorge A. Mendieta M.|Enrique Mayo
13248,PRESERVED_SPECIMEN,Citharexylum macradenium,2049109,GBIF,"Kirkbride, Jr. 907",Manuel Vargas,,8.75,-82.25,"On Chiriquí Trail, between Pinola and Quebrada Hondo toward summit.",1968.0,1,1,1,,WGS84,2020,"Joseph H. Kirkbride, Jr.|James A. Duke"
13249,PRESERVED_SPECIMEN,Citharexylum macradenium,2048753,GBIF,Gómez Pignataro 18884,Manuel Vargas,,9.781111,-83.81222199999999,Reserva de Tapantí.,1982.0,1,1,1,,WGS84,2020,Luis Diego Gómez P.
13251,PRESERVED_SPECIMEN,Citharexylum macradenium,2048025,GBIF,Him 199,Manuel Vargas,,8.7,-82.25,Proyecto Fortuna. Cerro Fortuna,1981.0,1,1,1,,WGS84,2020,José J. Him|Ibrahim O. Gordon
13252,PRESERVED_SPECIMEN,Citharexylum macradenium,2048023,GBIF,Folsom 2176,Manuel Vargas,,8.783333,-82.43333299999999,"Back side of mountain, Boquete.",1977.0,1,1,1,,WGS84,2020,James P. Folsom
13253,PRESERVED_SPECIMEN,Citharexylum macradenium,2047824,GBIF,Dwyer 7077,Manuel Vargas,,8.823333,-82.44833299999999,Cerro Horqueta.,1967.0,1,1,1,,WGS84,2020,John D. Dwyer|Mary V. Hayden
13255,PRESERVED_SPECIMEN,Citharexylum macradenium,2047822,GBIF,Béliz 186,Manuel Vargas,,8.808333,-82.42666700000001,Palo Alto-Boquete cerca a la finca Arco Iris.,1977.0,1,1,1,,WGS84,2020,Tania Béliz
13256,PRESERVED_SPECIMEN,Citharexylum macradenium,2047821,GBIF,Hammel 2209,Manuel Vargas,,8.75,-82.233333,La Fortuna hydroelectric project; north side of river.,1978.0,1,1,1,,WGS84,2020,Barry E. Hammel
13263,PRESERVED_SPECIMEN,Citharexylum macradenium,2041301,GBIF,Wilbur 10181,Manuel Vargas,,9.79,-83.9,Heavily wooded slopes above and beyond Muñeco about 10 km from the turnoff at Trova near Orosi,1968.0,1,1,1,,WGS84,2020,Robert L. Wilbur|Donald E. Stone
14535,PRESERVED_SPECIMEN,Citharexylum macradenium,1450737,GBIF,Hampshire 468,Manuel Vargas,,8.666667,-82.216667,"Road from Gualaca to Chiriquí Grande. Roadside, north of Los Planes de Hornito.",1985.0,1,1,1,,WGS84,2020,Rachel J. Hampshire|Caroline Whitefoord
15752,PRESERVED_SPECIMEN,Citharexylum macradenium,100633988,GBIF,James 1975-4,Manuel Vargas,,10.3075,-84.810556,Monteverde.,1975.0,1,1,1,,WGS84,2020,Walter James
15881,PRESERVED_SPECIMEN,Citharexylum macradenium,100560041,GBIF,Soto Solís 583,Manuel Vargas,,10.255556,-84.15,"R.F. Cordillera Volcánica Central. Cuenca del Sarapiquí. Colonia Virgen del Socorro, Camino de la Finca de José Miranda hacia Refugio ALAS-1500 en Finca de Oscar Murillo.",2005.0,1,1,1,,WGS84,2020,Armando Soto|et al.
16480,PRESERVED_SPECIMEN,Citharexylum macradenium,100377218,GBIF,Mora Chavarría 607,Manuel Vargas,,9.670833,-83.855556,"R.F. Río Macho. Cordillera de Talamanca. Río Macho, Altos del Roble.",1995.0,1,1,1,,WGS84,2020,Gerardo Mora
16858,PRESERVED_SPECIMEN,Citharexylum macradenium,100159503,GBIF,Rodríguez González 5751,Manuel Vargas,,10.058611,-83.98666700000001,"P.N. Braulio Carrillo. Cuenca del Sarapiquí. Bajo La Hondura, entrando por el antiguo camino de mulas.",2000.0,1,1,1,,WGS84,2020,Alexánder Rodríguez|Víctor H. Ramírez|Luis Acosta
17191,PRESERVED_SPECIMEN,Citharexylum macradenium,4373440,GBIF,,Manuel Vargas,,9.793611,-83.97027800000001,"Cartago, San Isidro, El Guarco. Way point 33, km 36.",2013.0,1,1,1,,WGS84,2020,Barry Hammel; Richard Glenn Olmstead
17192,PRESERVED_SPECIMEN,Citharexylum macradenium,4373438,GBIF,,Manuel Vargas,,9.793611,-83.97027800000001,"Cartago, San Isidro, El Guarco. Way point 33, km 36.",2013.0,1,1,1,,WGS84,2020,Barry Hammel; Richard Glenn Olmstead
17193,PRESERVED_SPECIMEN,Citharexylum macradenium,4373443,GBIF,,Manuel Vargas,,9.745722,-83.979722,"Cartago, san Isidro, El Guarco. Way point 34.",2013.0,1,1,1,,WGS84,2020,Barry Hammel; Richard Glenn Olmstead
17194,PRESERVED_SPECIMEN,Citharexylum macradenium,4373442,GBIF,,Manuel Vargas,,9.745722,-83.979722,"Cartago, san Isidro, El Guarco. Way point 34.",2013.0,1,1,1,,WGS84,2020,Barry Hammel; Richard Glenn Olmstead
17195,PRESERVED_SPECIMEN,Citharexylum macradenium,4373444,GBIF,,Manuel Vargas,,9.745722,-83.979722,"Cartago, san Isidro, El Guarco. Way point 34.",2013.0,1,1,1,,WGS84,2020,Barry Hammel; Richard Glenn Olmstead
17196,PRESERVED_SPECIMEN,Citharexylum macradenium,4373441,GBIF,,Manuel Vargas,,9.793611,-83.97027800000001,"Cartago, San Isidro, El Guarco. Way point 33, km 36.",2013.0,1,1,1,,WGS84,2020,Barry Hammel; Richard Glenn Olmstead
17197,PRESERVED_SPECIMEN,Citharexylum macradenium,4373437,GBIF,,Manuel Vargas,,9.793611,-83.97027800000001,"Cartago, San Isidro, El Guarco. Way point 33, km 36.",2013.0,1,1,1,,WGS84,2020,Barry Hammel; Richard Glenn Olmstead
17198,PRESERVED_SPECIMEN,Citharexylum macradenium,4373445,GBIF,,Manuel Vargas,,9.745722,-83.979722,"Cartago, san Isidro, El Guarco. Way point 34.",2013.0,1,1,1,,WGS84,2020,Barry Hammel; Richard Glenn Olmstead
17200,PRESERVED_SPECIMEN,Citharexylum macradenium,4373446,GBIF,,Manuel Vargas,,9.745722,-83.979722,"Cartago, san Isidro, El Guarco. Way point 34.",2013.0,1,1,1,,WGS84,2020,Barry Hammel; Richard Glenn Olmstead
17201,PRESERVED_SPECIMEN,Citharexylum macradenium,4373439,GBIF,,Manuel Vargas,,9.793611,-83.97027800000001,"Cartago, San Isidro, El Guarco. Way point 33, km 36.",2013.0,1,1,1,,WGS84,2020,Barry Hammel; Richard Glenn Olmstead
17330,PRESERVED_SPECIMEN,Citharexylum macradenium,4314441,GBIF,,Manuel Vargas,,10.058516000000001,-83.986681,Bajo la Hondura,2005.0,1,1,1,,WGS84,2020,L. Acosta; Luis Diego Vargas ; Guillermo Villalobos
17331,PRESERVED_SPECIMEN,Citharexylum macradenium,4314443,GBIF,,Manuel Vargas,,10.058516000000001,-83.986681,Bajo la Hondura,2005.0,1,1,1,,WGS84,2020,L. Acosta; Luis Diego Vargas ; Guillermo Villalobos
17332,PRESERVED_SPECIMEN,Citharexylum macradenium,4314442,GBIF,,Manuel Vargas,,10.058516000000001,-83.986681,Bajo la Hondura,2005.0,1,1,1,,WGS84,2020,L. Acosta; Luis Diego Vargas ; Guillermo Villalobos
17394,PRESERVED_SPECIMEN,Citharexylum macradenium,4302162,GBIF,,Manuel Vargas,,10.323111,-84.76675,"Monteverde, refugio El Valle.",2011.0,1,1,1,,WGS84,2020,Nelson A. Zamora Villalobos; Daniel Santamaría
17401,PRESERVED_SPECIMEN,Citharexylum macradenium,4302161,GBIF,,Manuel Vargas,,10.323111,-84.76675,"Monteverde, refugio El Valle.",2011.0,1,1,1,,WGS84,2020,Nelson A. Zamora Villalobos; Daniel Santamaría
17402,PRESERVED_SPECIMEN,Citharexylum macradenium,4302163,GBIF,,Manuel Vargas,,10.323111,-84.76675,"Monteverde, refugio El Valle.",2011.0,1,1,1,,WGS84,2020,Nelson A. Zamora Villalobos; Daniel Santamaría
17403,PRESERVED_SPECIMEN,Citharexylum macradenium,4302164,GBIF,,Manuel Vargas,,10.323111,-84.76675,"Monteverde, refugio El Valle.",2011.0,1,1,1,,WGS84,2020,Nelson A. Zamora Villalobos; Daniel Santamaría
17404,PRESERVED_SPECIMEN,Citharexylum macradenium,4302160,GBIF,,Manuel Vargas,,10.323111,-84.76675,"Monteverde, refugio El Valle.",2011.0,1,1,1,,WGS84,2020,Nelson A. Zamora Villalobos; Daniel Santamaría
17407,PRESERVED_SPECIMEN,Citharexylum macradenium,4302165,GBIF,,Manuel Vargas,,10.323111,-84.76675,"Monteverde, refugio El Valle.",2011.0,1,1,1,,WGS84,2020,Nelson A. Zamora Villalobos; Daniel Santamaría
17638,PRESERVED_SPECIMEN,Citharexylum macradenium,4235989,GBIF,,Manuel Vargas,,10.253333,-84.371111,P. N. Juan Castro Blanco. Albergue Ecológico Monterreal.,2010.0,1,1,1,,WGS84,2020,Barry Hammel; Isabel Pérez
17640,PRESERVED_SPECIMEN,Citharexylum macradenium,4235988,GBIF,,Manuel Vargas,,10.253333,-84.371111,P. N. Juan Castro Blanco. Albergue Ecológico Monterreal.,2010.0,1,1,1,,WGS84,2020,Barry Hammel; Isabel Pérez
17642,PRESERVED_SPECIMEN,Citharexylum macradenium,4235987,GBIF,,Manuel Vargas,,10.253333,-84.371111,P. N. Juan Castro Blanco. Albergue Ecológico Monterreal.,2010.0,1,1,1,,WGS84,2020,Barry Hammel; Isabel Pérez
17665,PRESERVED_SPECIMEN,Citharexylum macradenium,4235765,GBIF,,Manuel Vargas,,10.059448,-84.01222299999999,"A.C.C.V.C, Vázquez de Coronado, Cascajal, Pque Nal Braulio Carrillo, Estación Zurquí, 500 m antes del Tunel Zurquí.",2010.0,1,1,1,,WGS84,2020,Luis Diego Vargas; Guillermo Villalobos
17666,PRESERVED_SPECIMEN,Citharexylum macradenium,4235768,GBIF,,Manuel Vargas,,10.059448,-84.01222299999999,"A.C.C.V.C, Vázquez de Coronado, Cascajal, Pque Nal Braulio Carrillo, Estación Zurquí, 500 m antes del Tunel Zurquí.",2010.0,1,1,1,,WGS84,2020,Luis Diego Vargas; Guillermo Villalobos
17669,PRESERVED_SPECIMEN,Citharexylum macradenium,4235764,GBIF,,Manuel Vargas,,10.059448,-84.01222299999999,"A.C.C.V.C, Vázquez de Coronado, Cascajal, Pque Nal Braulio Carrillo, Estación Zurquí, 500 m antes del Tunel Zurquí.",2010.0,1,1,1,,WGS84,2020,Luis Diego Vargas; Guillermo Villalobos
17670,PRESERVED_SPECIMEN,Citharexylum macradenium,4235766,GBIF,,Manuel Vargas,,10.059448,-84.01222299999999,"A.C.C.V.C, Vázquez de Coronado, Cascajal, Pque Nal Braulio Carrillo, Estación Zurquí, 500 m antes del Tunel Zurquí.",2010.0,1,1,1,,WGS84,2020,Luis Diego Vargas; Guillermo Villalobos
17675,PRESERVED_SPECIMEN,Citharexylum macradenium,4235767,GBIF,,Manuel Vargas,,10.059448,-84.01222299999999,"A.C.C.V.C, Vázquez de Coronado, Cascajal, Pque Nal Braulio Carrillo, Estación Zurquí, 500 m antes del Tunel Zurquí.",2010.0,1,1,1,,WGS84,2020,Luis Diego Vargas; Guillermo Villalobos
18025,PRESERVED_SPECIMEN,Citharexylum macradenium,4158287,GBIF,,Manuel Vargas,,9.799002999999999,-83.966004,La Cangreja,2002.0,1,1,1,,WGS84,2020,Luis González; Alfonso Garita
18026,PRESERVED_SPECIMEN,Citharexylum macradenium,4158286,GBIF,,Manuel Vargas,,9.799002999999999,-83.966004,La Cangreja,2002.0,1,1,1,,WGS84,2020,Luis González; Alfonso Garita
18030,PRESERVED_SPECIMEN,Citharexylum macradenium,4156268,GBIF,,Manuel Vargas,,10.052194,-84.023472,Entrando por Santa Elena.,2008.0,1,1,1,,WGS84,2020,Luis Diego Vargas; Diego Castillo
18035,PRESERVED_SPECIMEN,Citharexylum macradenium,4156270,GBIF,,Manuel Vargas,,10.052194,-84.023472,Entrando por Santa Elena.,2008.0,1,1,1,,WGS84,2020,Luis Diego Vargas; Diego Castillo
18038,PRESERVED_SPECIMEN,Citharexylum macradenium,4156269,GBIF,,Manuel Vargas,,10.052194,-84.023472,Entrando por Santa Elena.,2008.0,1,1,1,,WGS84,2020,Luis Diego Vargas; Diego Castillo
18039,PRESERVED_SPECIMEN,Citharexylum macradenium,4156271,GBIF,,Manuel Vargas,,10.052194,-84.023472,Entrando por Santa Elena.,2008.0,1,1,1,,WGS84,2020,Luis Diego Vargas; Diego Castillo
18962,PRESERVED_SPECIMEN,Citharexylum macradenium,4062813,GBIF,,Manuel Vargas,,10.044444,-84.04083299999999,Concepción Calle Leones.,2003.0,1,1,1,,WGS84,2020,Jose González; Evelio Alfaro
18963,PRESERVED_SPECIMEN,Citharexylum macradenium,4062811,GBIF,,Manuel Vargas,,10.044444,-84.04083299999999,Concepción Calle Leones.,2003.0,1,1,1,,WGS84,2020,Jose González; Evelio Alfaro
18964,PRESERVED_SPECIMEN,Citharexylum macradenium,4062812,GBIF,,Manuel Vargas,,10.044444,-84.04083299999999,Concepción Calle Leones.,2003.0,1,1,1,,WGS84,2020,Jose González; Evelio Alfaro
19202,PRESERVED_SPECIMEN,Citharexylum macradenium,4026909,GBIF,,Manuel Vargas,,10.236388999999999,-84.117778,"9km NE de Vara Blanca, Finca Murillo, Transecto INBio-OET-ALAS.",2005.0,1,1,1,,WGS84,2020,Daniel Santamaría; Jose González
19203,PRESERVED_SPECIMEN,Citharexylum macradenium,4026910,GBIF,,Manuel Vargas,,10.236388999999999,-84.117778,"9km NE de Vara Blanca, Finca Murillo, Transecto INBio-OET-ALAS.",2005.0,1,1,1,,WGS84,2020,Daniel Santamaría; Jose González
19406,PRESERVED_SPECIMEN,Citharexylum macradenium,3940572,GBIF,,Manuel Vargas,,10.255556,-84.15,Colonia Virgen del Socorro.,2005.0,1,1,1,,WGS84,2020,Armando Soto; Frank  Alonso González Brenes
19407,PRESERVED_SPECIMEN,Citharexylum macradenium,3940571,GBIF,,Manuel Vargas,,10.255556,-84.15,Colonia Virgen del Socorro.,2005.0,1,1,1,,WGS84,2020,Armando Soto; Frank  Alonso González Brenes
19408,PRESERVED_SPECIMEN,Citharexylum macradenium,3940570,GBIF,,Manuel Vargas,,10.255556,-84.15,Colonia Virgen del Socorro.,2005.0,1,1,1,,WGS84,2020,Armando Soto; Frank  Alonso González Brenes
19465,PRESERVED_SPECIMEN,Citharexylum macradenium,3964259,GBIF,,Manuel Vargas,,10.174392,-84.169464,Vara Blanca.,2003.0,1,1,1,,WGS84,2020,Ricardo Kriebel; Daniel Solano
19471,PRESERVED_SPECIMEN,Citharexylum macradenium,3964258,GBIF,,Manuel Vargas,,10.174392,-84.169464,Vara Blanca.,2003.0,1,1,1,,WGS84,2020,Ricardo Kriebel; Daniel Solano
19493,PRESERVED_SPECIMEN,Citharexylum macradenium,3912633,GBIF,,Manuel Vargas,,10.152778,-84.097222,Sendero Laguna Danta y Laguna Danta,2002.0,1,1,1,,WGS84,2020,Ricardo Kriebel
19494,PRESERVED_SPECIMEN,Citharexylum macradenium,3912632,GBIF,,Manuel Vargas,,10.152778,-84.097222,Sendero Laguna Danta y Laguna Danta,2002.0,1,1,1,,WGS84,2020,Ricardo Kriebel
19495,PRESERVED_SPECIMEN,Citharexylum macradenium,3912631,GBIF,,Manuel Vargas,,10.152778,-84.097222,Sendero Laguna Danta y Laguna Danta,2002.0,1,1,1,,WGS84,2020,Ricardo Kriebel
19522,PRESERVED_SPECIMEN,Citharexylum macradenium,3911561,GBIF,,Manuel Vargas,,10.174392,-84.169464,Vara Blanca.,2003.0,1,1,1,,WGS84,2020,Ricardo Kriebel; Daniel Solano
19544,PRESERVED_SPECIMEN,Citharexylum macradenium,3910945,GBIF,,Manuel Vargas,,10.086944,-84.07305600000001,Cerro Chompipe.,2003.0,1,1,1,,WGS84,2020,Ricardo Kriebel
19545,PRESERVED_SPECIMEN,Citharexylum macradenium,3910946,GBIF,,Manuel Vargas,,10.086944,-84.07305600000001,Cerro Chompipe.,2003.0,1,1,1,,WGS84,2020,Ricardo Kriebel
19972,PRESERVED_SPECIMEN,Citharexylum macradenium,3790233,GBIF,,Manuel Vargas,,10.044444,-84.04083299999999,Concepción Calle Leones.,2003.0,1,1,1,,WGS84,2020,Evelio Alfaro; Jose González
19973,PRESERVED_SPECIMEN,Citharexylum macradenium,3790231,GBIF,,Manuel Vargas,,10.044444,-84.04083299999999,Concepción Calle Leones.,2003.0,1,1,1,,WGS84,2020,Evelio Alfaro; Jose González
19974,PRESERVED_SPECIMEN,Citharexylum macradenium,3790232,GBIF,,Manuel Vargas,,10.044444,-84.04083299999999,Concepción Calle Leones.,2003.0,1,1,1,,WGS84,2020,Evelio Alfaro; Jose González
19975,PRESERVED_SPECIMEN,Citharexylum macradenium,3790234,GBIF,,Manuel Vargas,,10.044444,-84.04083299999999,Concepción Calle Leones.,2003.0,1,1,1,,WGS84,2020,Evelio Alfaro; Jose González
20181,PRESERVED_SPECIMEN,Citharexylum macradenium,3524721,GBIF,,Manuel Vargas,,10.153333,-84.548611,Zapotal.,2002.0,1,1,1,,WGS84,2020,Luis González; R. Chavez
20182,PRESERVED_SPECIMEN,Citharexylum macradenium,3524722,GBIF,,Manuel Vargas,,10.153333,-84.548611,Zapotal.,2002.0,1,1,1,,WGS84,2020,Luis González; R. Chavez
20183,PRESERVED_SPECIMEN,Citharexylum macradenium,3524720,GBIF,,Manuel Vargas,,10.153333,-84.548611,Zapotal.,2002.0,1,1,1,,WGS84,2020,Luis González; R. Chavez
20674,PRESERVED_SPECIMEN,Citharexylum macradenium,3402567,GBIF,,Manuel Vargas,,10.058516000000001,-83.986681,Bajo la Hondura,2000.0,1,1,1,,WGS84,2020,Alexánder Francisco Rodríguez González; Victor Ramírez ; L. Acosta
20675,PRESERVED_SPECIMEN,Citharexylum macradenium,3402569,GBIF,,Manuel Vargas,,10.058516000000001,-83.986681,Bajo la Hondura,2000.0,1,1,1,,WGS84,2020,Alexánder Francisco Rodríguez González; Victor Ramírez ; L. Acosta
20676,PRESERVED_SPECIMEN,Citharexylum macradenium,3402568,GBIF,,Manuel Vargas,,10.058516000000001,-83.986681,Bajo la Hondura,2000.0,1,1,1,,WGS84,2020,Alexánder Francisco Rodríguez González; Victor Ramírez ; L. Acosta
20677,PRESERVED_SPECIMEN,Citharexylum macradenium,3402566,GBIF,,Manuel Vargas,,10.058516000000001,-83.986681,Bajo la Hondura,2000.0,1,1,1,,WGS84,2020,Alexánder Francisco Rodríguez González; Victor Ramírez ; L. Acosta
20891,PRESERVED_SPECIMEN,Citharexylum macradenium,3368089,GBIF,,Manuel Vargas,,10.061111,-83.986111,"Zurqui Station, around Bajo La Hondura.",2000.0,1,1,1,,WGS84,2020,L. Acosta; Victor Ramírez
20892,PRESERVED_SPECIMEN,Citharexylum macradenium,3368090,GBIF,,Manuel Vargas,,10.061111,-83.986111,"Zurqui Station, around Bajo La Hondura.",2000.0,1,1,1,,WGS84,2020,L. Acosta; Victor Ramírez
20893,PRESERVED_SPECIMEN,Citharexylum macradenium,3368088,GBIF,,Manuel Vargas,,10.061111,-83.986111,"Zurqui Station, around Bajo La Hondura.",2000.0,1,1,1,,WGS84,2020,L. Acosta; Victor Ramírez
