,BasisOfRec,Binomial,CatalogNo,Citation,CollectID,Compiler,Data_sens,Dec_Lat,Dec_Long,Dist_comm,Event_Year,Origin,Presence,Seasonal,Sens_comm,SpatialRef,YrCompiled,recordedBy
8077,PRESERVED_SPECIMEN,Meliosma oligantha,768398,GBIF,McPherson 12609,Manuel Vargas,,9.25,-79.416667,"Near Cerro Jefe, 3 miles along road past Alto Pacora toward Cerro Brewster.",1988.0,1,1,1,,WGS84,2020,Gordon McPherson
10627,PRESERVED_SPECIMEN,Meliosma oligantha,2910408,GBIF,Correa A. 7918,Manuel Vargas,,8.666667,-79.916667,"Sendero de Interpretación, 1 km al este del Campamento de los guardabosque de INRENARE.",1991.0,1,1,1,,WGS84,2020,Mireya D. Correa A.|E. Montenegro|Álex Espinosa|M. Sánchez
10628,PRESERVED_SPECIMEN,Meliosma oligantha,2910407,GBIF,Correa A. 9458,Manuel Vargas,,8.666667,-79.916667,Sendero hacia el Cerro de la Cruz.,1993.0,1,1,1,,WGS84,2020,Mireya D. Correa A.|Eduardo Montenegro
10629,PRESERVED_SPECIMEN,Meliosma oligantha,2910406,GBIF,Correa A. 9517,Manuel Vargas,,8.666667,-79.916667,"Sendero de Interpretación, 1 km al este del Campamento de los guardabosques de INRENARE.  Sendero al Cerro de la Cruz.",1993.0,1,1,1,,WGS84,2020,Mireya D. Correa A.|Eduardo Montenegro
19875,PRESERVED_SPECIMEN,Meliosma oligantha,3865768,GBIF,,Manuel Vargas,,9.563333,-84.12472199999999,Bajo de la virgen.,2003.0,1,1,1,,WGS84,2020,Jose González
24540,PRESERVED_SPECIMEN,Meliosma oligantha,,GBIF,9044,Manuel Vargas,,8.4833,-78.5,,1992.0,1,1,1,,WGS84,2020,M. D. Corrêa A.
24985,PRESERVED_SPECIMEN,Meliosma oligantha,V0360553F,GBIF,9517,Manuel Vargas,,8.4833,-78.5,,1993.0,1,1,1,,WGS84,2020,M. D. Corrêa A. & E. Montenegro
