,BasisOfRec,Binomial,CatalogNo,Citation,CollectID,Compiler,Data_sens,Dec_Lat,Dec_Long,Dist_comm,Event_Year,Origin,Presence,Seasonal,Sens_comm,SpatialRef,YrCompiled,recordedBy
28257,PRESERVED_SPECIMEN,Monteverdia recondita,150056,GBIF,,Manuel Vargas,,10.35,-84.81,"Río Negro, Finca Hermanos Bello.",1987.0,1,1,1,,WGS84,2020,"Haber, William"
28258,PRESERVED_SPECIMEN,Monteverdia recondita,150055,GBIF,,Manuel Vargas,,10.28,-84.76,"Ojo deAgua, Finca Méndez, Río Aranjuez.",1987.0,1,1,1,,WGS84,2020,"Haber, William"
28260,PRESERVED_SPECIMEN,Monteverdia recondita,142300,GBIF,,Manuel Vargas,,10.76,-85.81,"P.N. Rincón de la Vieja Cabeceras de Quebrada Rancho Grande, bosque circundante a Meseta Aguacatales.",,1,1,1,,WGS84,2020,"Herrera, Gerardo"
28262,PRESERVED_SPECIMEN,Monteverdia recondita,136690,GBIF,,Manuel Vargas,,10.33,-84.83,"R.B. Monteverde Pacific slope, lower montane wet  forest.",1986.0,1,1,1,,WGS84,2020,"Haber, William"
28263,PRESERVED_SPECIMEN,Monteverdia recondita,130325,GBIF,,Manuel Vargas,,10.33,-84.83,"Three km N Sta. elena, atlantic exposure near continental divide on Bello Farm, lower montane  wet forest.",,1,1,1,,WGS84,2020,"Haber, William"
28264,PRESERVED_SPECIMEN,Monteverdia recondita,130279,GBIF,,Manuel Vargas,,10.33,-84.83,R.B. Monteverde Lower montane wet forest on Pacific slope.,,1,1,1,,WGS84,2020,"Haber, William"
28265,PRESERVED_SPECIMEN,Monteverdia recondita,129247,GBIF,,Manuel Vargas,,10.33,-84.83,"Monteverde community, Pacific slope, lower montane wet forest.",1985.0,1,1,1,,WGS84,2020,"Haber, William"
28266,PRESERVED_SPECIMEN,Monteverdia recondita,129242,GBIF,,Manuel Vargas,,10.33,-84.83,"Peñas Blancas River Valley. Atlantic slope, rain forest.",1985.0,1,1,1,,WGS84,2020,"Haber, William"
28267,PRESERVED_SPECIMEN,Monteverdia recondita,129072,GBIF,,Manuel Vargas,,10.33,-84.83,"Three km N Sta. elena, atlantic exposure near continental divide on Bello Farm, lower montane  wet forest.",,1,1,1,,WGS84,2020,"Haber, William"
28268,PRESERVED_SPECIMEN,Monteverdia recondita,129069,GBIF,,Manuel Vargas,,10.33,-84.83,"Three km N Sta. elena, atlantic exposure near continental divide on Bello Farm, lower montane  wet forest.",,1,1,1,,WGS84,2020,"Haber, William"
28269,PRESERVED_SPECIMEN,Monteverdia recondita,129037,GBIF,,Manuel Vargas,,10.33,-84.83,Upper San Luis River valley  on Pacific slope. Premontane moist  forest.,1985.0,1,1,1,,WGS84,2020,"Haber, William"
28276,PRESERVED_SPECIMEN,Monteverdia recondita,107907,GBIF,,Manuel Vargas,,10.3,-84.76,"Evergreen cloud forest and wet wind-gap formations (lower montane and premontane rain forest life zone) on and near the Continental Divide about 2 to 5 km, east and southeast of Monteverde at elevations of 1580 to 1700 m. Puntarenas and Alajuela.",1973.0,1,1,1,,WGS84,2020,"Burger, William"
