,BasisOfRec,Binomial,CatalogNo,Citation,CollectID,Compiler,Data_sens,Dec_Lat,Dec_Long,Dist_comm,Event_Year,Origin,Presence,Seasonal,Sens_comm,SpatialRef,YrCompiled,recordedBy
280,HUMAN_OBSERVATION,Monteverdia recondita,50788468,GBIF,,Manuel Vargas,,8.681632,-83.574304,,2015.0,1,1,1,,WGS84,2020,Eduardo Chacón-Madrigal
315,HUMAN_OBSERVATION,Monteverdia recondita,,GBIF,,Manuel Vargas,,10.924444,-85.4675,,2019.0,1,1,1,,WGS84,2020,
3980,PRESERVED_SPECIMEN,Monteverdia recondita,01096050,GBIF,11745,Manuel Vargas,,8.6528,-83.5717,"Distrito: Sierpe; Reserva Forestal Golfo Dulce; Rancho Quemado, camino a Chiqueron luego desviandose por un camino que lleva a y luego un lindero hasta llegar a la parte mas elevada",2009.0,1,1,1,,WGS84,2020,R. Aguilar
7358,PRESERVED_SPECIMEN,Monteverdia recondita,982391,GBIF,Haber 11544,Manuel Vargas,,10.4,-84.65,"Bosque Eterno De Los Niños, Cordillera de Tilarán, 5 km W of Chachagua, Quebrada Chachaguita drainage, Premontane rain forest, Zona Monteverde",1993.0,1,1,1,,WGS84,2020,William A. Haber|Jason C. Bradford|G. Céspedes
7608,PRESERVED_SPECIMEN,Monteverdia recondita,903297,GBIF,Herrera Chacón 4397,Manuel Vargas,,8.71,-83.53,"R.F. Golfo Dulce; Península de Osa. Rincón. Fila Casa Loma, por el antiguo camino a Rancho Quemado.",1990.0,1,1,1,,WGS84,2020,Gerardo Herrera Ch.
7717,PRESERVED_SPECIMEN,Monteverdia recondita,898494,GBIF,Fuentes Alvarado 583,Manuel Vargas,,10.275833,-84.795833,"Cordillera de Tilarán. San Luis, Cerro Amapola, Monteverde",1993.0,1,1,1,,WGS84,2020,Zobeida Fuentes|E. Fuentes
7728,PRESERVED_SPECIMEN,Monteverdia recondita,898046,GBIF,Bello Carranza 4164,Manuel Vargas,,10.35,-84.83,R.B. Monteverde; Cordillera de Tilarán. Hacienda Ira Rosa.,1991.0,1,1,1,,WGS84,2020,Erick Bello C.
7779,PRESERVED_SPECIMEN,Monteverdia recondita,895794,GBIF,Bello Carranza 2403,Manuel Vargas,,10.41,-84.71,"Parque Nacional Arenal, Río Aguas Gatas, Alto del Castillo.",1990.0,1,1,1,,WGS84,2020,Erick Bello C.
7805,PRESERVED_SPECIMEN,Monteverdia recondita,895092,GBIF,Bello Carranza 2156,Manuel Vargas,,10.38,-84.7,"Reserva Forestale Monteverde, Bosque Eterno De Los Niños, Cordillera de Tilarán, Río Peñas Blancas, Quebrada Gata, riachuelo de Fernando Villalobos.",1990.0,1,1,1,,WGS84,2020,Erick Bello C.|William A. Haber|Willow Zuchowski
7969,PRESERVED_SPECIMEN,Monteverdia recondita,887388,GBIF,Jiménez Madrigal 1327,Manuel Vargas,,10.258333,-84.258333,"Bajos del Toro, 3 km NW del Pueblo, en potrero cercano al bosque, Parque Nacional Juan Castro Blanco",1993.0,1,1,1,,WGS84,2020,Quírico Jiménez
13093,PRESERVED_SPECIMEN,Monteverdia recondita,2093055,GBIF,Stone 3261,Manuel Vargas,,10.16,-84.074167,"Northeast slopes of Volcán Barba, trees in open pasture and fringes of forest on upper slopes",1972.0,1,1,1,,WGS84,2020,Donald E. Stone
13095,PRESERVED_SPECIMEN,Monteverdia recondita,2092641,GBIF,Hartshorn 1895,Manuel Vargas,,10.3,-84.8,"In Mata's pasture, Monteverde",1977.0,1,1,1,,WGS84,2020,Gary S. Hartshorn
13098,PRESERVED_SPECIMEN,Monteverdia recondita,2092019,GBIF,Hartshorn 1470,Manuel Vargas,,10.3,-84.79,"In Mata's pasture, Monteverde",1974.0,1,1,1,,WGS84,2020,Gary S. Hartshorn
13099,PRESERVED_SPECIMEN,Monteverdia recondita,2092020,GBIF,Poveda Álvarez 1110,Manuel Vargas,,10.3,-84.8,Monteverde,1975.0,1,1,1,,WGS84,2020,Luis J. Poveda Álvarez
14180,PRESERVED_SPECIMEN,Monteverdia recondita,162919,GBIF,Bello Carranza 922,Manuel Vargas,,10.26,-84.7,Reserva Biológica Monteverde Cabeceras del Río Aranjuez.,1989.0,1,1,1,,WGS84,2020,Erick Bello C.
14183,PRESERVED_SPECIMEN,Monteverdia recondita,162910,GBIF,Bello Carranza 1376,Manuel Vargas,,10.35,-84.8,"Reserva Biológica Monteverde San Gerardo, altos del Río Caño Negro. Finca de Lolo Chuta.",1989.0,1,1,1,,WGS84,2020,Erick Bello C.
14186,PRESERVED_SPECIMEN,Monteverdia recondita,162776,GBIF,Haber 8737,Manuel Vargas,,10.366667,-84.81666700000001,"Monteverde 5 km N Santa Elena on road to Las Nubes, Finca San Bosco road, Río Negro. Atlantic slope.",1988.0,1,1,1,,WGS84,2020,William A. Haber|Willow Zuchowski
14187,PRESERVED_SPECIMEN,Monteverdia recondita,162766,GBIF,Gentry 48761,Manuel Vargas,,10.783333,-84.833333,Monteverde.,1984.0,1,1,1,,WGS84,2020,Alwyn H. Gentry|William A. Haber
14189,PRESERVED_SPECIMEN,Monteverdia recondita,162713,GBIF,Haber 692,Manuel Vargas,,10.309444000000001,-84.804167,"Monteverde, upper community",1984.0,1,1,1,,WGS84,2020,William A. Haber
14191,PRESERVED_SPECIMEN,Monteverdia recondita,162639,GBIF,Haber 5813,Manuel Vargas,,10.333333,-84.75,"Monteverde Cloud Forest Reserve, Peñas Blancas river valley on Atlantic slope.",1986.0,1,1,1,,WGS84,2020,William A. Haber|Erick Bello C.
14194,PRESERVED_SPECIMEN,Monteverdia recondita,162584,GBIF,Haber 3863,Manuel Vargas,,10.333333,-84.833333,"Three km N Santa Elena, Atlantic exposure near continental divide on Bello farm, lower montane wet forest",1985.0,1,1,1,,WGS84,2020,William A. Haber|Erick Bello C.
14195,PRESERVED_SPECIMEN,Monteverdia recondita,162579,GBIF,Haber 3673,Manuel Vargas,,10.333333,-84.833333,"Monteverde Cloud Forest Reserve, lower montane wet forest on Pacific slope.",1985.0,1,1,1,,WGS84,2020,William A. Haber|Erick Bello C.
14196,PRESERVED_SPECIMEN,Monteverdia recondita,162566,GBIF,Haber 3117,Manuel Vargas,,10.333333,-84.833333,"Monteverde, upper San Luis valley on Pacific slope, moist forest.",1985.0,1,1,1,,WGS84,2020,William A. Haber|Erick Bello C.
14197,PRESERVED_SPECIMEN,Monteverdia recondita,162559,GBIF,Haber 3100,Manuel Vargas,,10.333333,-84.833333,"Peñas Blancas River Valley, Atlantic slope, rain forest",1985.0,1,1,1,,WGS84,2020,William A. Haber|Erick Bello C.
14198,PRESERVED_SPECIMEN,Monteverdia recondita,162462,GBIF,Herrera Chacón 1474,Manuel Vargas,,10.79,-85.32,"Parque Rincón de La Vieja. Cabeceras de Quebrada Rancho Grande, bosque circundante a Meseta Aguacatales. [original label coordinates: 10º46'N, 85º49'W]",1987.0,1,1,1,,WGS84,2020,Gerardo Herrera Ch.
14199,PRESERVED_SPECIMEN,Monteverdia recondita,162412,GBIF,Herrera Chacón 2278,Manuel Vargas,,10.0,-83.43,"Cordillera de Talamanca. Frente a confluencia entre Río Caño Seco y Río Dantas. Margen derecha, subiendo por la fila.",1988.0,1,1,1,,WGS84,2020,Gerardo Herrera Ch.
14200,PRESERVED_SPECIMEN,Monteverdia recondita,162406,GBIF,Herrera Chacón 2008,Manuel Vargas,,10.72,-85.005556,"Bijagua El Pilón, Cerro La Carmela, entre Río Celeste y cabeceras del Río Chimurria.",1988.0,1,1,1,,WGS84,2020,Gerardo Herrera Ch.
14203,PRESERVED_SPECIMEN,Monteverdia recondita,162241,GBIF,Haber 9286,Manuel Vargas,,10.3,-84.8,"Monteverde community, Pacific slope, moist forest along cliff edge, Stuckey farm.  Pacific slope, moist forest along cliff edge, Stuckey farm.     10.18N 84.48W      1350 m 11 July 1989 William Haber & Willow Zuchowski",1989.0,1,1,1,,WGS84,2020,William A. Haber|Willow Zuchowski
14204,PRESERVED_SPECIMEN,Monteverdia recondita,162235,GBIF,Haber 7125,Manuel Vargas,,10.35,-84.81666700000001,"Río Negro, Tilarán. Finca Hermanos Bello.",1987.0,1,1,1,,WGS84,2020,William A. Haber|Erick Bello C.
14205,PRESERVED_SPECIMEN,Monteverdia recondita,162228,GBIF,Haber 693,Manuel Vargas,,10.309444000000001,-84.804167,"Monteverde, upper community",1984.0,1,1,1,,WGS84,2020,William A. Haber
14207,PRESERVED_SPECIMEN,Monteverdia recondita,162220,GBIF,Haber 4266,Manuel Vargas,,10.333333,-84.833333,"Monteverde Cloud Forest Reserve, Pacific slope, lower montane wet forest.",1986.0,1,1,1,,WGS84,2020,William A. Haber|Erick Bello C.
14208,PRESERVED_SPECIMEN,Monteverdia recondita,162213,GBIF,Haber 3831,Manuel Vargas,,10.333333,-84.833333,"Three km N Santa Elena, Atlantic exposure near continental divide on Bello farm, lower montane wet forest",1985.0,1,1,1,,WGS84,2020,William A. Haber|Erick Bello C.
14209,PRESERVED_SPECIMEN,Monteverdia recondita,162207,GBIF,Haber 3824,Manuel Vargas,,10.333333,-84.833333,"Three km N Santa Elena, Atlantic exposure near continental divide on Bello farm, lower montane wet forest",1985.0,1,1,1,,WGS84,2020,William A. Haber|Erick Bello C.
14210,PRESERVED_SPECIMEN,Monteverdia recondita,162200,GBIF,Haber 3108,Manuel Vargas,,10.333333,-84.833333,"Monteverde community, Pacific slope, lower montane wet forest. 10º20'N, 84º50'W",1985.0,1,1,1,,WGS84,2020,William A. Haber|Erick Bello C.
14211,PRESERVED_SPECIMEN,Monteverdia recondita,162193,GBIF,Haber 2989,Manuel Vargas,,10.350278,-84.806944,"Río Negro de Tilarán, quebrada San Bosco.",1985.0,1,1,1,,WGS84,2020,William A. Haber|Erick Bello C.
14220,PRESERVED_SPECIMEN,Monteverdia recondita,161765,GBIF,Haber 7738,Manuel Vargas,,10.283333,-84.766667,"Ojo de Agua, Monteverde Finca Méndez, Río Aranjuez.",1987.0,1,1,1,,WGS84,2020,William A. Haber|Erick Bello C.
14717,PRESERVED_SPECIMEN,Monteverdia recondita,1411077,GBIF,Haber 446,Manuel Vargas,,10.3,-84.8,Monteverde. Pasture tree in community.,1981.0,1,1,1,,WGS84,2020,William A. Haber
14718,PRESERVED_SPECIMEN,Monteverdia recondita,1411072,GBIF,Skutch 3765,Manuel Vargas,,10.17,-84.15,"Vicinity of Vara Blanca, north slope of Central Cordillera, between Poás and Barba volcanoes",1938.0,1,1,1,,WGS84,2020,Alexander F. Skutch
14817,PRESERVED_SPECIMEN,Monteverdia recondita,1369133,GBIF,González Ramírez 1749,Manuel Vargas,,9.63,-82.89,"R.I. Talamanca. Cuenca del Sixaola. San Miguel Cabecar, Lomas Tsipubeta. En bosque.",1997.0,1,1,1,,WGS84,2020,José Á. González R.|Isidro A. Chacón G.|Manuel Á. Zumbado|R. Canet|Ernesto Salazar
14818,PRESERVED_SPECIMEN,Monteverdia recondita,1369097,GBIF,Penneys 683,Manuel Vargas,,10.3,-84.8,Cordillera de Tilarán. Monteverde. Sendero Tranquito. 1.5 km SE of Cerro Amigos. Disturbed primary forest. Premontane wet forest.,1995.0,1,1,1,,WGS84,2020,Darin S. Penneys|Willow Zuchowski
15106,PRESERVED_SPECIMEN,Monteverdia recondita,1258159,GBIF,Aguilar Fernández 4524,Manuel Vargas,,8.7,-83.525,R.F. Golfo Dulce. Península de Osa. Aguabuena. Oeste Finca Don Beto,1996.0,1,1,1,,WGS84,2020,Reinaldo Aguilar
15692,PRESERVED_SPECIMEN,Monteverdia recondita,100702143,GBIF,Allen 4844,Manuel Vargas,,8.838333,-82.461667,"Bajo Mono- Robalo Trail, western slopes of Cerro Horqueta.",1947.0,1,1,1,,WGS84,2020,Paul H. Allen
15863,PRESERVED_SPECIMEN,Monteverdia recondita,100566018,GBIF,Kriebel Haehner 3398,Manuel Vargas,,10.033333,-84.116667,No protegida. Cuenca de Tarcoles. Rio Sto. Domingo.,2003.0,1,1,1,,WGS84,2020,Ricardo Kriebel|Daniel Solano
15972,PRESERVED_SPECIMEN,Monteverdia recondita,100521788,GBIF,Solano Peralta 2698,Manuel Vargas,,10.252778,-84.36944,P. N. Juan Castro Blanco. Cuenca alta del rio La Vieja. A orillas del rio.,2005.0,1,1,1,,WGS84,2020,Daniel Solano
16046,PRESERVED_SPECIMEN,Monteverdia recondita,100516836,GBIF,Soto Solís 1737,Manuel Vargas,,10.928056,-85.46389,"""Cacao, Fila detras de la estacion. """,2007.0,1,1,1,,WGS84,2020,Armando Soto
16270,PRESERVED_SPECIMEN,Monteverdia recondita,100487818,GBIF,Rodríguez González 5977,Manuel Vargas,,10.288056,-84.38278000000001,"Entrando por San Vicente, faldas del Cerro Platanar.",2000.0,1,1,1,,WGS84,2020,Alexánder Rodríguez
16326,PRESERVED_SPECIMEN,Monteverdia recondita,100472084,GBIF,Rodríguez González 5977,Manuel Vargas,,10.288056,-84.382778,P.N. Juan Castro Blanco. Cuenca del San Carlos. Entrando por San Vicente. Faltas del Cerro Platanar.,2000.0,1,1,1,,WGS84,2020,Alexánder Rodríguez|Víctor H. Ramírez|Geovanny Sancho|Gerardo Soto
16349,PRESERVED_SPECIMEN,Monteverdia recondita,100464768,GBIF,Aguilar Fernández 11745,Manuel Vargas,,8.652778,-83.571667,"Distrito: Sierpe; Reserva Forestal Golfo Dulce; Rancho Quemado, camino a Chiqueron luego desviandose por un camino qu lleva a y luego un lindero hasta llegar a la parte mas elevada.",2009.0,1,1,1,,WGS84,2020,Reinaldo Aguilar
17108,PRESERVED_SPECIMEN,Monteverdia recondita,4438801,GBIF,,Manuel Vargas,,10.924444,-85.4675,"Liberia. Área de Conservación Guanacaste, Estación Cacao, Sendero Arenales.",2014.0,1,1,1,,WGS84,2020,Nelson A. Zamora Villalobos; Jie Cai ; Yu Min Shui ; G. Lianming ; M. Pengfei ; Roberto Espinoza ; Enia Navarro
17109,PRESERVED_SPECIMEN,Monteverdia recondita,4438802,GBIF,,Manuel Vargas,,10.924444,-85.4675,"Liberia. Área de Conservación Guanacaste, Estación Cacao, Sendero Arenales.",2014.0,1,1,1,,WGS84,2020,Nelson A. Zamora Villalobos; Jie Cai ; Yu Min Shui ; G. Lianming ; M. Pengfei ; Roberto Espinoza ; Enia Navarro
17110,PRESERVED_SPECIMEN,Monteverdia recondita,4438803,GBIF,,Manuel Vargas,,10.924444,-85.4675,"Liberia. Área de Conservación Guanacaste, Estación Cacao, Sendero Arenales.",2014.0,1,1,1,,WGS84,2020,Nelson A. Zamora Villalobos; Jie Cai ; Yu Min Shui ; G. Lianming ; M. Pengfei ; Roberto Espinoza ; Enia Navarro
17254,PRESERVED_SPECIMEN,Monteverdia recondita,4325429,GBIF,,Manuel Vargas,,10.702528,-85.014972,"Guatuso.  Bijagua. P. N. Tenorio, Alto Brenes, Sendero Acueducto de Bijagua, parte alta, por la fila.",2012.0,1,1,1,,WGS84,2020,Nelson A. Zamora Villalobos; Alejandro Azofeifa Zúñiga ; O. Jarquin
17258,PRESERVED_SPECIMEN,Monteverdia recondita,4325428,GBIF,,Manuel Vargas,,10.702528,-85.014972,"Guatuso.  Bijagua. P. N. Tenorio, Alto Brenes, Sendero Acueducto de Bijagua, parte alta, por la fila.",2012.0,1,1,1,,WGS84,2020,Nelson A. Zamora Villalobos; Alejandro Azofeifa Zúñiga ; O. Jarquin
17259,PRESERVED_SPECIMEN,Monteverdia recondita,4325426,GBIF,,Manuel Vargas,,10.702528,-85.014972,"Guatuso.  Bijagua. P. N. Tenorio, Alto Brenes, Sendero Acueducto de Bijagua, parte alta, por la fila.",2012.0,1,1,1,,WGS84,2020,Nelson A. Zamora Villalobos; Alejandro Azofeifa Zúñiga ; O. Jarquin
17261,PRESERVED_SPECIMEN,Monteverdia recondita,4325427,GBIF,,Manuel Vargas,,10.702528,-85.014972,"Guatuso.  Bijagua. P. N. Tenorio, Alto Brenes, Sendero Acueducto de Bijagua, parte alta, por la fila.",2012.0,1,1,1,,WGS84,2020,Nelson A. Zamora Villalobos; Alejandro Azofeifa Zúñiga ; O. Jarquin
18405,PRESERVED_SPECIMEN,Monteverdia recondita,4105262,GBIF,,Manuel Vargas,,10.928056,-85.463889,"Cacao, Fila detrás de la estación.",2007.0,1,1,1,,WGS84,2020,Armando Soto; Adrián Guadamuz
18406,PRESERVED_SPECIMEN,Monteverdia recondita,4105263,GBIF,,Manuel Vargas,,10.928056,-85.463889,"Cacao, Fila detrás de la estación.",2007.0,1,1,1,,WGS84,2020,Armando Soto; Adrián Guadamuz
18410,PRESERVED_SPECIMEN,Monteverdia recondita,4105261,GBIF,,Manuel Vargas,,10.928056,-85.463889,"Cacao, Fila detrás de la estación.",2007.0,1,1,1,,WGS84,2020,Armando Soto; Adrián Guadamuz
18411,PRESERVED_SPECIMEN,Monteverdia recondita,4105260,GBIF,,Manuel Vargas,,10.928056,-85.463889,"Cacao, Fila detrás de la estación.",2007.0,1,1,1,,WGS84,2020,Armando Soto; Adrián Guadamuz
18412,PRESERVED_SPECIMEN,Monteverdia recondita,4105259,GBIF,,Manuel Vargas,,10.928056,-85.463889,"Cacao, Fila detrás de la estación.",2007.0,1,1,1,,WGS84,2020,Armando Soto; Adrián Guadamuz
18729,PRESERVED_SPECIMEN,Monteverdia recondita,4093332,GBIF,,Manuel Vargas,,10.252778,-84.369444,"P.N. Juan Castro Blanco, cuenca alta del Rio La Vieja",2005.0,1,1,1,,WGS84,2020,Daniel Solano; Clare Cerling
18730,PRESERVED_SPECIMEN,Monteverdia recondita,4093331,GBIF,,Manuel Vargas,,10.252778,-84.369444,"P.N. Juan Castro Blanco, cuenca alta del Rio La Vieja",2005.0,1,1,1,,WGS84,2020,Daniel Solano; Clare Cerling
18731,PRESERVED_SPECIMEN,Monteverdia recondita,4093333,GBIF,,Manuel Vargas,,10.252778,-84.369444,"P.N. Juan Castro Blanco, cuenca alta del Rio La Vieja",2005.0,1,1,1,,WGS84,2020,Daniel Solano; Clare Cerling
19391,PRESERVED_SPECIMEN,Monteverdia recondita,3941004,GBIF,,Manuel Vargas,,10.240278,-84.12472199999999,"Virgen del Socorro, Finca Oscar Murillo.",2005.0,1,1,1,,WGS84,2020,Armando Soto; Frank  Alonso González Brenes
19392,PRESERVED_SPECIMEN,Monteverdia recondita,3941003,GBIF,,Manuel Vargas,,10.240278,-84.12472199999999,"Virgen del Socorro, Finca Oscar Murillo.",2005.0,1,1,1,,WGS84,2020,Armando Soto; Frank  Alonso González Brenes
19393,PRESERVED_SPECIMEN,Monteverdia recondita,3941001,GBIF,,Manuel Vargas,,10.240278,-84.12472199999999,"Virgen del Socorro, Finca Oscar Murillo.",2005.0,1,1,1,,WGS84,2020,Armando Soto; Frank  Alonso González Brenes
19394,PRESERVED_SPECIMEN,Monteverdia recondita,3941002,GBIF,,Manuel Vargas,,10.240278,-84.12472199999999,"Virgen del Socorro, Finca Oscar Murillo.",2005.0,1,1,1,,WGS84,2020,Armando Soto; Frank  Alonso González Brenes
19746,PRESERVED_SPECIMEN,Monteverdia recondita,3925543,GBIF,,Manuel Vargas,,10.033333,-84.116667,"Headwaters of Rio Santo Domingo, ca. 3 km NE of San Rafael de Vara Blanca.",2003.0,1,1,1,,WGS84,2020,Ricardo Kriebel; Daniel Solano
19747,PRESERVED_SPECIMEN,Monteverdia recondita,3925547,GBIF,,Manuel Vargas,,10.033333,-84.116667,"Headwaters of Rio Santo Domingo, ca. 3 km NE of San Rafael de Vara Blanca.",2003.0,1,1,1,,WGS84,2020,Ricardo Kriebel; Daniel Solano
19750,PRESERVED_SPECIMEN,Monteverdia recondita,3925545,GBIF,,Manuel Vargas,,10.033333,-84.116667,"Headwaters of Rio Santo Domingo, ca. 3 km NE of San Rafael de Vara Blanca.",2003.0,1,1,1,,WGS84,2020,Ricardo Kriebel; Daniel Solano
19751,PRESERVED_SPECIMEN,Monteverdia recondita,3925540,GBIF,,Manuel Vargas,,10.033333,-84.116667,"Headwaters of Rio Santo Domingo, ca. 3 km NE of San Rafael de Vara Blanca.",2003.0,1,1,1,,WGS84,2020,Ricardo Kriebel; Daniel Solano
19752,PRESERVED_SPECIMEN,Monteverdia recondita,3925542,GBIF,,Manuel Vargas,,10.033333,-84.116667,"Headwaters of Rio Santo Domingo, ca. 3 km NE of San Rafael de Vara Blanca.",2003.0,1,1,1,,WGS84,2020,Ricardo Kriebel; Daniel Solano
19753,PRESERVED_SPECIMEN,Monteverdia recondita,3925548,GBIF,,Manuel Vargas,,10.033333,-84.116667,"Headwaters of Rio Santo Domingo, ca. 3 km NE of San Rafael de Vara Blanca.",2003.0,1,1,1,,WGS84,2020,Ricardo Kriebel; Daniel Solano
19754,PRESERVED_SPECIMEN,Monteverdia recondita,3925541,GBIF,,Manuel Vargas,,10.033333,-84.116667,"Headwaters of Rio Santo Domingo, ca. 3 km NE of San Rafael de Vara Blanca.",2003.0,1,1,1,,WGS84,2020,Ricardo Kriebel; Daniel Solano
19755,PRESERVED_SPECIMEN,Monteverdia recondita,3925546,GBIF,,Manuel Vargas,,10.033333,-84.116667,"Headwaters of Rio Santo Domingo, ca. 3 km NE of San Rafael de Vara Blanca.",2003.0,1,1,1,,WGS84,2020,Ricardo Kriebel; Daniel Solano
19756,PRESERVED_SPECIMEN,Monteverdia recondita,3925544,GBIF,,Manuel Vargas,,10.033333,-84.116667,"Headwaters of Rio Santo Domingo, ca. 3 km NE of San Rafael de Vara Blanca.",2003.0,1,1,1,,WGS84,2020,Ricardo Kriebel; Daniel Solano
20568,PRESERVED_SPECIMEN,Monteverdia recondita,3427175,GBIF,,Manuel Vargas,,10.288056,-84.382778,"San Vicente, a orilla del camino ruta al Parque Nacional Juan Castro Blanco.",2000.0,1,1,1,,WGS84,2020,Alexánder Francisco Rodríguez González; Victor Ramírez ; Geovanny Sancho ; Gerardo Soto
20569,PRESERVED_SPECIMEN,Monteverdia recondita,3427172,GBIF,,Manuel Vargas,,10.288056,-84.382778,"San Vicente, a orilla del camino ruta al Parque Nacional Juan Castro Blanco.",2000.0,1,1,1,,WGS84,2020,Alexánder Francisco Rodríguez González; Victor Ramírez ; Geovanny Sancho ; Gerardo Soto
20570,PRESERVED_SPECIMEN,Monteverdia recondita,3427176,GBIF,,Manuel Vargas,,10.288056,-84.382778,"San Vicente, a orilla del camino ruta al Parque Nacional Juan Castro Blanco.",2000.0,1,1,1,,WGS84,2020,Alexánder Francisco Rodríguez González; Victor Ramírez ; Geovanny Sancho ; Gerardo Soto
20571,PRESERVED_SPECIMEN,Monteverdia recondita,3427173,GBIF,,Manuel Vargas,,10.288056,-84.382778,"San Vicente, a orilla del camino ruta al Parque Nacional Juan Castro Blanco.",2000.0,1,1,1,,WGS84,2020,Alexánder Francisco Rodríguez González; Victor Ramírez ; Geovanny Sancho ; Gerardo Soto
20572,PRESERVED_SPECIMEN,Monteverdia recondita,3427174,GBIF,,Manuel Vargas,,10.288056,-84.382778,"San Vicente, a orilla del camino ruta al Parque Nacional Juan Castro Blanco.",2000.0,1,1,1,,WGS84,2020,Alexánder Francisco Rodríguez González; Victor Ramírez ; Geovanny Sancho ; Gerardo Soto
20762,PRESERVED_SPECIMEN,Monteverdia recondita,3390234,GBIF,,Manuel Vargas,,10.712528,-85.04089,"Upala, Bijagua, P.N. Volcán Tenorio, Albergue Heliconias, Sendero Heliconias",2001.0,1,1,1,,WGS84,2020,Jose Luis Chaves; Reinaldo Aguilar
20763,PRESERVED_SPECIMEN,Monteverdia recondita,3390235,GBIF,,Manuel Vargas,,10.712528,-85.04089,"Upala, Bijagua, P.N. Volcán Tenorio, Albergue Heliconias, Sendero Heliconias",2001.0,1,1,1,,WGS84,2020,Jose Luis Chaves; Reinaldo Aguilar
20764,PRESERVED_SPECIMEN,Monteverdia recondita,3390236,GBIF,,Manuel Vargas,,10.712528,-85.04089,"Upala, Bijagua, P.N. Volcán Tenorio, Albergue Heliconias, Sendero Heliconias",2001.0,1,1,1,,WGS84,2020,Jose Luis Chaves; Reinaldo Aguilar
20953,PRESERVED_SPECIMEN,Monteverdia recondita,3172761,GBIF,,Manuel Vargas,,10.990278,-85.427778,"Estacion Pitilla, Senderos Los Memos.",1998.0,1,1,1,,WGS84,2020,Calixto Moraga
20954,PRESERVED_SPECIMEN,Monteverdia recondita,3172760,GBIF,,Manuel Vargas,,10.990278,-85.427778,"Estacion Pitilla, Senderos Los Memos.",1998.0,1,1,1,,WGS84,2020,Calixto Moraga
21335,PRESERVED_SPECIMEN,Monteverdia recondita,2916752,GBIF,,Manuel Vargas,,10.283333,-84.766667,"Ojo de Agua, Monteverde. Finca Mendez, Rio Aranjuez.",1987.0,1,1,1,,WGS84,2020,William Haber
21346,PRESERVED_SPECIMEN,Monteverdia recondita,2916315,GBIF,,Manuel Vargas,,10.35,-84.81666700000001,"Rio Negro, Tilaran. Finca Hermanos Bello.",1987.0,1,1,1,,WGS84,2020,William Haber
21452,PRESERVED_SPECIMEN,Monteverdia recondita,2907264,GBIF,,Manuel Vargas,,10.416667,-84.716667,Rio Aguas Gatas. Alto del Castillo.,1990.0,1,1,1,,WGS84,2020,Erick Bello
21625,PRESERVED_SPECIMEN,Monteverdia recondita,2921135,GBIF,,Manuel Vargas,,10.0,-83.43333299999999,"Frente a confluencia entre Rio Cano Seco y Rio Dantas; margen derecha, subiendo por la fila.",1988.0,1,1,1,,WGS84,2020,Gerardo Herrera
21641,PRESERVED_SPECIMEN,Monteverdia recondita,2920483,GBIF,,Manuel Vargas,,10.766667,-85.31666700000001,"Cabeceras de Quebrada Rancho Grande, bosque circundante a Meseta Aguacatales.",1987.0,1,1,1,,WGS84,2020,Gerardo Herrera
23172,PRESERVED_SPECIMEN,Monteverdia recondita,1577895,GBIF,,Manuel Vargas,,10.275833,-84.795834,San Luis; Cerro Amapola. Monteverde.,1993.0,1,1,1,,WGS84,2020,Zobeida Fuentes
23206,PRESERVED_SPECIMEN,Monteverdia recondita,1575618,GBIF,,Manuel Vargas,,10.35,-84.830556,Hacienda Ira Rosa.,1991.0,1,1,1,,WGS84,2020,Erick Bello
23339,PRESERVED_SPECIMEN,Monteverdia recondita,1569534,GBIF,,Manuel Vargas,,10.383333,-84.7,"Rio Penas Blancas, Quebrada Gata, riachuelo de Fernando Villalobos.",1990.0,1,1,1,,WGS84,2020,Erick Bello
23341,PRESERVED_SPECIMEN,Monteverdia recondita,1569535,GBIF,,Manuel Vargas,,10.266667,-84.7,Cabeceras del Rio Aranjuez.,1989.0,1,1,1,,WGS84,2020,Erick Bello
23344,PRESERVED_SPECIMEN,Monteverdia recondita,1569532,GBIF,,Manuel Vargas,,10.366667,-84.81666700000001,"Monteverde. 5 km N Santa Elena on road to Las Nubes, Finca San Bosco road, Rio Negro.",1988.0,1,1,1,,WGS84,2020,William Haber
23347,PRESERVED_SPECIMEN,Monteverdia recondita,1569533,GBIF,,Manuel Vargas,,10.3,-84.800002,"Monteverde community, moist forest along cliff edge, Stuckey farm. Pacific slope.",1989.0,1,1,1,,WGS84,2020,William Haber
23352,PRESERVED_SPECIMEN,Monteverdia recondita,1569536,GBIF,,Manuel Vargas,,10.35,-84.8,"San Gerardo, altos del Rio Cano Negro. Finca de Lolo Chuta.",1989.0,1,1,1,,WGS84,2020,Erick Bello
23578,PRESERVED_SPECIMEN,Monteverdia recondita,1561464,GBIF,,Manuel Vargas,,10.720833,-85.005556,"El Pilon, Cerro La Carmela, entre Rio Celeste y cabeceras del Rio Chimurria. Bijagua.",1988.0,1,1,1,,WGS84,2020,Gerardo Herrera
23836,PRESERVED_SPECIMEN,Monteverdia recondita,1513594,GBIF,,Manuel Vargas,,10.3,-84.800004,Monteverde. Sendero Tranquilo. 1.5 km SE of Cerro Amigos. Disturbed primary forest. Premontane wet forest.,1995.0,1,1,1,,WGS84,2020,Darin Penneys
23837,PRESERVED_SPECIMEN,Monteverdia recondita,1513593,GBIF,,Manuel Vargas,,10.258333,-84.258333,Bajos del Toro; 3 Km NO del pueblo.,1993.0,1,1,1,,WGS84,2020,Quirico Jiménez
23838,PRESERVED_SPECIMEN,Monteverdia recondita,1513592,GBIF,,Manuel Vargas,,10.4,-84.65,"5 km W of Chachagua, Queb. Chachaguita drainage. Premontane rain forest. Zona Monteverde.",1993.0,1,1,1,,WGS84,2020,William Haber
23863,PRESERVED_SPECIMEN,Monteverdia recondita,1511891,GBIF,,Manuel Vargas,,8.7,-83.525001,Aguabuena. Oeste Finca Don Beto,1996.0,1,1,1,,WGS84,2020,Reinaldo Aguilar
25236,PRESERVED_SPECIMEN,Monteverdia recondita,G-G-162857/1,GBIF,,Manuel Vargas,,10.03333,-84.11667,Barva - Heredia: Barva. No protegida. Cuenca del Tárcoles. Río Sto Domingo/Provincia de Heredia,2003.0,1,1,1,,WGS84,2020,"Kriebel, R. & D. Solano"
28228,PRESERVED_SPECIMEN,Monteverdia recondita,212619,GBIF,,Manuel Vargas,,10.4,-84.65,"R.B. Bosque Eterno De Los Niños Cordillera de tilar´na. 5 km W of Cachagua, Queb. Cachaguita drainage. Premontane Rainforest.. Zona Monteverde.",1993.0,1,1,1,,WGS84,2020,"Haber, William"
28229,PRESERVED_SPECIMEN,Monteverdia recondita,212616,GBIF,,Manuel Vargas,,10.25,-84.25,P.N. Juan Castro Blanco Bajos del Toro; 3 km noroeste del pueblo.,1993.0,1,1,1,,WGS84,2020,"Jiménez, Quírico"
28245,PRESERVED_SPECIMEN,Monteverdia recondita,180137,GBIF,,Manuel Vargas,,10.35,-84.8,"R.B. Monteverde San Gerardo, altos del Río Caño Negro. Finca de Lolo Chuta.",1989.0,1,1,1,,WGS84,2020,"Bello, Erick"
28246,PRESERVED_SPECIMEN,Monteverdia recondita,180136,GBIF,,Manuel Vargas,,10.26,-84.7,R.B. Monteverde Cabeceras del Río Aranjuez.,1989.0,1,1,1,,WGS84,2020,"Bello, Erick"
28247,PRESERVED_SPECIMEN,Monteverdia recondita,180135,GBIF,,Manuel Vargas,,10.41,-84.71,R.F. Arenal Río Aguas Gatas. Alto del Castillo.,1990.0,1,1,1,,WGS84,2020,"Bello, Erick"
28248,PRESERVED_SPECIMEN,Monteverdia recondita,177724,GBIF,,Manuel Vargas,,10.28,-84.6,R.B. Alberto Manuel Brenes R.B. San Ramón. Las Rocas. 2 Km al Oeste de Finca de Carlos González.,1994.0,1,1,1,,WGS84,2020,"Herrera, Gerardo"
28255,PRESERVED_SPECIMEN,Monteverdia recondita,174196,GBIF,,Manuel Vargas,,10.92,-85.47,P.N. Guanacaste Estación Cacao.,1990.0,1,1,1,,WGS84,2020,"Chávez, Carlos"
