,BasisOfRec,Binomial,CatalogNo,Citation,CollectID,Compiler,Data_sens,Dec_Lat,Dec_Long,Dist_comm,Event_Year,Origin,Presence,Seasonal,Sens_comm,SpatialRef,YrCompiled,recordedBy
275,HUMAN_OBSERVATION,Myrcia paulii-jonesii,49915570,GBIF,,Manuel Vargas,,8.725141,-83.485302,,2015.0,1,1,1,,WGS84,2020,Eduardo Chacón-Madrigal
7772,PRESERVED_SPECIMEN,Myrcia paulii-jonesii,895912,GBIF,Aguilar Fernández 2016,Manuel Vargas,,8.722222,-83.44166700000001,"R.F. Golfo Dulce; Península de Osa. Bahía Chal, Los Mogos.",1993.0,1,1,1,,WGS84,2020,Reinaldo Aguilar
15089,PRESERVED_SPECIMEN,Myrcia paulii-jonesii,1259198,GBIF,Aguilar Fernández 3582,Manuel Vargas,,8.766667,-83.366667,Los Mogos. Bahia Chal. Entrada Chacuaco.,1994.0,1,1,1,,WGS84,2020,Reinaldo Aguilar
15571,PRESERVED_SPECIMEN,Myrcia paulii-jonesii,100890342,GBIF,Santamaría-Aguilar 9355,Manuel Vargas,,8.729167,-83.456944,"R.F. Golfo Dulce. Bahia Chal. A 35 km de Chacarita. Entrada a Chocuaco, entre el cruce de Chocuaco y el bajo Quebrada Lagunas.",2012.0,1,1,1,,WGS84,2020,Daniel Santamaría|Reinaldo Aguilar
15572,PRESERVED_SPECIMEN,Myrcia paulii-jonesii,100890330,GBIF,Aguilar Fernández 12300,Manuel Vargas,,8.729167,-83.456944,"Reserva Forestal Golfo Dulce, Rincón, Bahia Chal, a 35 km de Chacarita, entrada Chocuaco, entre curce de Bajo Chocuaco y el bajo Quebrada Lagunas.",2009.0,1,1,1,,WGS84,2020,Reinaldo Aguilar
15573,PRESERVED_SPECIMEN,Myrcia paulii-jonesii,100890340,GBIF,Santamaría-Aguilar 9357,Manuel Vargas,,8.729167,-83.456944,"Bahia Chal. A 35 km de Chacarita. Entrada a Chocuaco, entre el cruce de Chocuaco y el bajo Quebrada Lagunas.",2012.0,1,1,1,,WGS84,2020,Daniel Santamaría|Reinaldo Aguilar
