,BasisOfRec,Binomial,CatalogNo,Citation,CollectID,Compiler,Data_sens,Dec_Lat,Dec_Long,Dist_comm,Event_Year,Origin,Presence,Seasonal,Sens_comm,SpatialRef,YrCompiled,recordedBy
14688,PRESERVED_SPECIMEN,Palicourea triphylla,1415516,GBIF,Foster 10248,Manuel Vargas,,-10.44,-75.15,Selva Central-Peru,1985.0,1,1,1,,WGS84,2020,Robin B. Foster
14689,PRESERVED_SPECIMEN,Palicourea triphylla,1415517,GBIF,Killip 26401,Manuel Vargas,,-10.183333,-74.966667,Selva Central-Peru. Puerto Bermudez; dense forest.,1929.0,1,1,1,,WGS84,2020,Ellsworth P. Killip
14691,PRESERVED_SPECIMEN,Palicourea triphylla,1415521,GBIF,Foster 13868,Manuel Vargas,,-14.633329999999999,-62.616659999999996,Cerrado Complex,1991.0,1,1,1,,WGS84,2020,Robin B. Foster
14692,PRESERVED_SPECIMEN,Palicourea triphylla,1415512,GBIF,Steyermark 45708,Manuel Vargas,,15.908889000000002,-90.175833,Between base of Cerro Chinajá at Sachaj and Sacacao.,1942.0,1,1,1,,WGS84,2020,Julian A. Steyermark
14694,PRESERVED_SPECIMEN,Palicourea triphylla,1415518,GBIF,Wachter 165,Manuel Vargas,,-11.885,-71.403,Southeast Peru,1985.0,1,1,1,,WGS84,2020,Tatyana S. Wachter
14696,PRESERVED_SPECIMEN,Palicourea triphylla,1415515,GBIF,Lundell 6567,Manuel Vargas,,16.966667,-88.983333,Mountain Pine Ridge.,1936.0,1,1,1,,WGS84,2020,Cyrus L. Lundell
14698,PRESERVED_SPECIMEN,Palicourea triphylla,1415519,GBIF,Foster 13149,Manuel Vargas,,-11.885,-71.403,Southeast Peru,1989.0,1,1,1,,WGS84,2020,Robin B. Foster
14766,PRESERVED_SPECIMEN,Palicourea triphylla,1387719,GBIF,Gentry 31032,Manuel Vargas,,-8.66666,-75.0,"Bosque Nacional Alexander von Humboldt, Km. 86, Pucallpa-Pingo Maria Road.",1981.0,1,1,1,,WGS84,2020,Alwyn H. Gentry|et al.
14952,PRESERVED_SPECIMEN,Palicourea triphylla,1310547,GBIF,Liesner 13088,Manuel Vargas,,9.6,-72.9,Ca. 55 km SW of Machiques by air.  Aricuaisa (Ariguaisa) -pie de Monte on Río Aricuaisa (Ariguaisa).,1982.0,1,1,1,,WGS84,2020,Ronald L. Liesner|Ángel C. González
14960,PRESERVED_SPECIMEN,Palicourea triphylla,1302929,GBIF,Díaz Santibáñez 9455,Manuel Vargas,,-13.483332999999998,-69.366667,"Parque Nacional ""Bahuaja-Sonere."" Ex Santuario Nacional ""Pampa de Heath"" Río Heath - Pampa ""remantada"" entre San Antonio y Juliaca.",1997.0,1,1,1,,WGS84,2020,Camilo Díaz S.|Henry Ramirez|D. Cruz
14969,PRESERVED_SPECIMEN,Palicourea triphylla,1297915,GBIF,Díaz Santibáñez 8993,Manuel Vargas,,-13.266667000000002,-69.45,"Parque Nacional ""Bahuaja-Sonere."" Ex Santuario Nacional ""Pampa de Heath"" Quebrada ""El Shuyo"".",1997.0,1,1,1,,WGS84,2020,Camilo Díaz S.|J. Fontella Pereira
14970,PRESERVED_SPECIMEN,Palicourea triphylla,1297635,GBIF,Díaz Santibáñez 8927,Manuel Vargas,,-12.588333,-68.688889,"Parque Nacional ""Bahuaja-Sonere."" Ex Santuario Nacional ""Pampas del Heath"". Estación Guarda Parques: ""Juliaca"", Quebrada ""Shuyo"".",1997.0,1,1,1,,WGS84,2020,Camilo Díaz S.|J. Fontella Pereira
15008,PRESERVED_SPECIMEN,Palicourea triphylla,1289432,GBIF,Stevens 12799,Manuel Vargas,,13.533332999999999,-84.5,Vicinity of junction of road to Alamikamba with road between El Empalme and Limbaika; pine savanna and gallery forest.,1979.0,1,1,1,,WGS84,2020,W. D. Stevens
15022,PRESERVED_SPECIMEN,Palicourea triphylla,1277417,GBIF,Gentry 12765,Manuel Vargas,,-4.078611,-69.998611,"Vicinity of Leticia; 18-22 km N of Leticia, near Los Alpes.",1974.0,1,1,1,,WGS84,2020,Alwyn H. Gentry
15023,PRESERVED_SPECIMEN,Palicourea triphylla,1277411,GBIF,Schultes 26044,Manuel Vargas,,1.266667,-70.18333299999999,"Rio Vaupes, Urania.",1970.0,1,1,1,,WGS84,2020,Richard E. Schultes
15024,PRESERVED_SPECIMEN,Palicourea triphylla,1277412,GBIF,Hoyos Marin 489,Manuel Vargas,,5.955,-74.934167,"Autopista Medellin-Bogota, vereda La Josefina, camino a Palmira.",1983.0,1,1,1,,WGS84,2020,Saulo Hoyos|Juan José Hernández
15025,PRESERVED_SPECIMEN,Palicourea triphylla,1277415,GBIF,Schultes 24430,Manuel Vargas,,1.0,-70.08333,"Rio Vaupes, Mitu and vicinity.",1966.0,1,1,1,,WGS84,2020,Richard E. Schultes|et al.
15026,PRESERVED_SPECIMEN,Palicourea triphylla,1277416,GBIF,Killip 14917,Manuel Vargas,,7.325556,-73.84,"Puerto Wilches and vicinity. Edge of woods, Polonia.",1926.0,1,1,1,,WGS84,2020,Ellsworth P. Killip|Albert C. Smith
15027,PRESERVED_SPECIMEN,Palicourea triphylla,1277410,GBIF,Duke 11627,Manuel Vargas,,7.15,-77.8,Punta Ardita.,1967.0,1,1,1,,WGS84,2020,James A. Duke
15028,PRESERVED_SPECIMEN,Palicourea triphylla,1277414,GBIF,Davidse 5290,Manuel Vargas,,4.517778,-69.58,Ca. 25 km E of Cumaribo along the unimproved dirt road between Las Gaviotas and Santa Rita.,1973.0,1,1,1,,WGS84,2020,Gerrit Davidse|Fany Llanos
15029,PRESERVED_SPECIMEN,Palicourea triphylla,1277406,GBIF,Betancur B. 1563,Manuel Vargas,,1.85,-73.81666700000001,"Sabanas del Yari, vereda Yaguara, Hato Montecarlo.",1990.0,1,1,1,,WGS84,2020,Julio C. Betancur B.|M.P. Velásquez S.
15030,PRESERVED_SPECIMEN,Palicourea triphylla,1277407,GBIF,Allen 3402,Manuel Vargas,,1.15,-69.95,"Bacuraba Cachoeira, Rio Vaupes, region E of Mitu.",1945.0,1,1,1,,WGS84,2020,Paul H. Allen
15031,PRESERVED_SPECIMEN,Palicourea triphylla,1277405,GBIF,Betancur B. 1569,Manuel Vargas,,1.85,-73.81666700000001,"Sabanas del Yari, vereda Yaguara, Hato Montecarlo.",1990.0,1,1,1,,WGS84,2020,Julio C. Betancur B.|M.P. Velásquez S.
15032,PRESERVED_SPECIMEN,Palicourea triphylla,1277408,GBIF,Blydenstein 911,Manuel Vargas,,2.680278,-72.75694399999999,Llanos Orientales: Hato Aguas Claras.,1963.0,1,1,1,,WGS84,2020,J. Blydenstein|Carlos Saravia T.
15152,PRESERVED_SPECIMEN,Palicourea triphylla,1241271,GBIF,van der Werff 15464,Manuel Vargas,,-5.73583,-77.47027,"Naranjillo.  Along road Rioja-Pedro Ruiz, in low forest on white sand soil, partially swampy.",1998.0,1,1,1,,WGS84,2020,H. van der Werff|Bruce Gray|Rodolfo Vásquez|Rocío Rojas
15155,PRESERVED_SPECIMEN,Palicourea triphylla,1236845,GBIF,Cornejo Valverde 3240,Manuel Vargas,,-13.4,-69.93333,Ligeramente colinoso.,1997.0,1,1,1,,WGS84,2020,F. Cornejo|A. Balarezo
15161,PRESERVED_SPECIMEN,Palicourea triphylla,1234082,GBIF,Cornejo Valverde 2789,Manuel Vargas,,-13.55,-69.66666,Cabeceras del Río Candamo.  Colinoso.,1996.0,1,1,1,,WGS84,2020,F. Cornejo|A. Balarezo
15166,PRESERVED_SPECIMEN,Palicourea triphylla,1227845,GBIF,Cornejo Valverde 2684,Manuel Vargas,,-13.3,-70.11666,Cabeceras del Río Candamo.  Colinoso.  Bosque montano en la cima de colina.,1996.0,1,1,1,,WGS84,2020,F. Cornejo|A. Balarezo
15208,PRESERVED_SPECIMEN,Palicourea triphylla,1210039,GBIF,Schunke Vigo 8637,Manuel Vargas,,-8.18416,-76.5125,Distrito Tocache Nuevo.  Vicinity around Tocache.  [Fieldbook information lost].,1975.0,1,1,1,,WGS84,2020,José Schunke V.
15213,PRESERVED_SPECIMEN,Palicourea triphylla,1208575,GBIF,Stevens 19415,Manuel Vargas,,13.55,-84.283333,"Along road from El Empalme to Limbaika, 3.4 km NW of Alamikamba road; wet savanna along Caño Alamikamba.",1981.0,1,1,1,,WGS84,2020,W. D. Stevens|P. P. Moreno
15225,PRESERVED_SPECIMEN,Palicourea triphylla,1195764,GBIF,Thomson 17,Manuel Vargas,,-14.57944,-60.9125,inundated pampa,1997.0,1,1,1,,WGS84,2020,G. Thomson|Timothy J. Killeen|A. Barker
15226,PRESERVED_SPECIMEN,Palicourea triphylla,1193496,GBIF,Madriñán R. 1108,Manuel Vargas,,1.25,-70.85,Caño Cubiyú. Comunidad Indígena La Sabana. Sandstone savanah. Galery forest.,1993.0,1,1,1,,WGS84,2020,Santiago Madriñán|Goya Ngan|et al.
15394,PRESERVED_SPECIMEN,Palicourea triphylla,1158109,GBIF,Aguilar R. 790,Manuel Vargas,,-12.65638,-68.73694,"Santuario Nacional Pampas del Heath, Rio Heath. Bosque de rivera.",1996.0,1,1,1,,WGS84,2020,M. Aguilar R.|D. Castro
15397,PRESERVED_SPECIMEN,Palicourea triphylla,1157750,GBIF,Aguilar R. 466,Manuel Vargas,,-12.95305,-68.91333,"Santuario Nacional Pampas del Heath, Quebrada Patuyacu. Bosque de terraza.",1996.0,1,1,1,,WGS84,2020,M. Aguilar R.|D. Castro
15399,PRESERVED_SPECIMEN,Palicourea triphylla,1155734,GBIF,Soto 352,Manuel Vargas,,-13.894720000000001,-60.81276999999999,Parque Nacional Noel Kempff Mercado colectas generales de Huanchaca I.,1997.0,1,1,1,,WGS84,2020,Ademar Soto|S.N. Panfil|Moore|Soliz
15400,PRESERVED_SPECIMEN,Palicourea triphylla,1154450,GBIF,Guardia 167,Manuel Vargas,,-14.804720000000001,-60.38721999999999,"Parque Noel Kempff Mercado, Campamento LAS GAMAS, con ecotonos de bosque de galería, cerrado y pampa",1997.0,1,1,1,,WGS84,2020,C. Guardia|Y. Uslar|Juan Surubí
15401,PRESERVED_SPECIMEN,Palicourea triphylla,1153959,GBIF,Garvizu 205,Manuel Vargas,,-14.3625,-60.7425,Parque Nacional Noel Kempff Mercado. A 50 m del campamento. Al borde del bosque de galeria o isla de bosque; orilla del arroyo.,1997.0,1,1,1,,WGS84,2020,Marisol Garvizu|A.M. Carrión
15402,PRESERVED_SPECIMEN,Palicourea triphylla,1151358,GBIF,Sánchez Acebo 273,Manuel Vargas,,-14.58694,-60.84027,Parque Nacional Noel Kempff Mercado. Campamento Los Fierros. Bosque de Cerradao con estrato graminoide bajo y con árboles de cobertura casi abierta de hasta 10 m.,1997.0,1,1,1,,WGS84,2020,Lupita Sánchez A.|E. Gutiérrez|Juan Surubí
15406,PRESERVED_SPECIMEN,Palicourea triphylla,1147590,GBIF,López Camacho 591,Manuel Vargas,,2.77527,-72.2925,"Mpio. San José del Guaviare. Inspección de La Fuga, carretera que conduce de la inspección de La Fuga a la Hacienda Filo de Hambre y de ésta a Morro Pelado y Tienda Nueva. Sabanas dominadas por gramíneas y Dilleniaceae.",1995.0,1,1,1,,WGS84,2020,René López C.|et al.
15407,PRESERVED_SPECIMEN,Palicourea triphylla,1147593,GBIF,López Camacho 647,Manuel Vargas,,2.47222,-72.69166,"Mpio. de San José del Guaviare. Resguardo indígena de la comunidad de Tucano de Panoré a 5 min. del Centro SINCHI en cananguchal, con alta presencia de Mauritia flexuosa, altamente intervenido.",1995.0,1,1,1,,WGS84,2020,René López C.|et al.
15473,PRESERVED_SPECIMEN,Palicourea triphylla,1097547,GBIF,Gentry 79701,Manuel Vargas,,13.333332999999998,-81.366667,Isla de Providencia.  Scrub near summit of island.,1993.0,1,1,1,,WGS84,2020,Alwyn H. Gentry|Hermes Cuadros V.|Rosa Ortiz
15476,PRESERVED_SPECIMEN,Palicourea triphylla,1096974,GBIF,Stevens 8581,Manuel Vargas,,14.1,-83.583333,"At ca. Km 47 on road from Puerto Cabezas to Rosita, ca. 5.3 km W of Río Wawa ferry.",1978.0,1,1,1,,WGS84,2020,W. D. Stevens
15482,PRESERVED_SPECIMEN,Palicourea triphylla,1095987,GBIF,Stevens 8168,Manuel Vargas,,13.5,-84.233333,Ca. 1.3 km NW of Alamikamba; open pine savanna and broadleaf forest along small dry watercourse.,1978.0,1,1,1,,WGS84,2020,W. D. Stevens
15485,PRESERVED_SPECIMEN,Palicourea triphylla,1094935,GBIF,Cárdenas López 6943,Manuel Vargas,,0.71472,-75.24861,"Serranía de Chiribiquete, sector nororiental Río Cuñaré, raudal El Tubo, Bh-T. Vegetación sobre afloramiento rocoso.",1995.0,1,1,1,,WGS84,2020,Dairon Cárdenas L.|et al.
15486,PRESERVED_SPECIMEN,Palicourea triphylla,1094921,GBIF,Cárdenas López 5686,Manuel Vargas,,5.88333,-76.98333000000001,"Corregimiento La Pedrera, Río Caquetá, chorros de Córdoba, 45 min. arriba, Bh-T. Bosque maduro, vega media. Llanura de inundación, aguas barrosas. En llanura aluvial de ríos andinos.",1994.0,1,1,1,,WGS84,2020,Dairon Cárdenas L.|Diego Giraldo-Cañas|et al.
15489,PRESERVED_SPECIMEN,Palicourea triphylla,1093997,GBIF,Stevens 7773,Manuel Vargas,,14.3,-83.68333299999999,"Along road to Panua (entrance ca. 7.6 km NW of Santa Marta), ca. 1.6 km NW of Panua and 5.7 km from main road; low ""island"" of broadleaf forest in pine savanna.",1978.0,1,1,1,,WGS84,2020,W. D. Stevens
15490,PRESERVED_SPECIMEN,Palicourea triphylla,1093744,GBIF,Stevens 7647,Manuel Vargas,,14.683333,-84.05,Near Tala Has and Puente Mango (over Río Kisalaya).,1978.0,1,1,1,,WGS84,2020,W. D. Stevens
15512,PRESERVED_SPECIMEN,Palicourea triphylla,1070412,GBIF,Aymard C. 10988,Manuel Vargas,,2.89416,-67.46583000000001,"""Bana alta"" over white sand, ca. 5 km west of Yavita, along Yavita-Maroa road.  GPS unit used.",1996.0,1,1,1,,WGS84,2020,Gerardo Aymard|Carlos Gómez
15574,PRESERVED_SPECIMEN,Palicourea triphylla,100890091,GBIF,Berger 1738,Manuel Vargas,,8.699444,-83.188055,"Vicinity of La Gamba Field Station, surroundings of oil palm plantation opposite of junction of road to field station and road to Golfito.",2015.0,1,1,1,,WGS84,2020,A. Berger
15585,PRESERVED_SPECIMEN,Palicourea triphylla,100889721,GBIF,Berger 1526,Manuel Vargas,,9.338333,-83.6275,"In vicinity of Quizarrá near General Viejo, Refugio de Aves Alexander Skutch: Los Cusingos. Vicinity of gardens of Dr. Skutch's House.",2013.0,1,1,1,,WGS84,2020,A. Berger|J. Schinnerl
15620,PRESERVED_SPECIMEN,Palicourea triphylla,100860544,GBIF,Stevens 36461,Manuel Vargas,,12.188556,-85.230389,8.3 km SW of La Libertad (park) along road to Juigalpa;,2015.0,1,1,1,,WGS84,2020,W. D. Stevens
15640,PRESERVED_SPECIMEN,Palicourea triphylla,100811020,GBIF,Michelangeli 2312,Manuel Vargas,,5.013889,-59.650833,left margin on portage trail on second set of rapids above Chenapau,2014.0,1,1,1,,WGS84,2020,Fabián A. Michelangeli|Z. Narine|J. Isaacs|N. Carter|P. Lewis
15661,PRESERVED_SPECIMEN,Palicourea triphylla,100797385,GBIF,Valenzuela Gamarra 22607,Manuel Vargas,,-10.413611,-75.0825,"Distrito Palcazú. Comunidad Nativa Santa Rosa de Pichanaz, Sector Santo Domingo.",2013.0,1,1,1,,WGS84,2020,Luis Valenzuela G.|Carlos Mogollón|Gerry Shareva M.|Jaime Flores|A. Fernandez|E. Jiménez|K. Huancho
15667,PRESERVED_SPECIMEN,Palicourea triphylla,100771917,GBIF,Michel 2083,Manuel Vargas,,-12.792222,-66.56916700000001,"157 kms de El Mirador hacia Riberalta, 4 kms después del desvio a Cobija.",1993.0,1,1,1,,WGS84,2020,R. Chávez de Michel|Stephan G. Beck
15764,PRESERVED_SPECIMEN,Palicourea triphylla,100621250,GBIF,Coronado González 7062,Manuel Vargas,,12.0,-83.8,"Ciudad de Bluefields, Río Sconfra",2013.0,1,1,1,,WGS84,2020,I. Coronado G.
15765,PRESERVED_SPECIMEN,Palicourea triphylla,100621351,GBIF,Coronado González 7093,Manuel Vargas,,11.983333,-83.8,"Bluefields, Puente Jackson, Río Sconfra",2013.0,1,1,1,,WGS84,2020,I. Coronado G.
15774,PRESERVED_SPECIMEN,Palicourea triphylla,100608707,GBIF,Linneo Foronda 880,Manuel Vargas,,-16.987222,-63.746111,"Municipio de Santa Rosa del Sara, Laguna Juan Chulo, 8 km al NO sobre el camino que va al río.",2006.0,1,1,1,,WGS84,2020,Ivan Linneo
16006,PRESERVED_SPECIMEN,Palicourea triphylla,100518302,GBIF,Rodríguez González 9980,Manuel Vargas,,9.084722,-83.06860999999999,"Puntarenas: Buenos Aires. No protegida. Cuenca Terraba-Sierpe. Portreo Grande, Tres Colinas, ca. 1.5 km bajando hacia Finca Helechales.",2006.0,1,1,1,,WGS84,2020,Alexánder Rodríguez|Luis A. González
16132,PRESERVED_SPECIMEN,Palicourea triphylla,100500703,GBIF,Solano Peralta 3113,Manuel Vargas,,9.073611,-83.08889,"No protegida. Cuenca Térraba-Sierpe. Tres Colinas, Sabanas Helechales.",2006.0,1,1,1,,WGS84,2020,Daniel Solano|Daniel Santamaría|Alexánder Rodríguez
16149,PRESERVED_SPECIMEN,Palicourea triphylla,100500192,GBIF,Santamaría-Aguilar 4527,Manuel Vargas,,9.083333,-83.06944,"No protegida. Cuenca Térraba-Sierpe. Buenos Aires, Potrero Grande, Límite entre Helechales y Tres Colinas, cercanías de la casa del señor Marcial Vidal.",2006.0,1,1,1,,WGS84,2020,Daniel Santamaría|Alexánder Rodríguez|Frank González
16162,PRESERVED_SPECIMEN,Palicourea triphylla,100498885,GBIF,Terán Aguilar 4337,Manuel Vargas,,-16.800556,-64.810278,Laguna puerto Villarroel.,2009.0,1,1,1,,WGS84,2020,Jehizon Terán|D. Soux|M. Aliaga|E. Rodríguez|Eric Feltz|Huber Villca
16164,PRESERVED_SPECIMEN,Palicourea triphylla,100498567,GBIF,Terán Aguilar 4214,Manuel Vargas,,-16.895,-64.803333,Chasqui porvenir.,2009.0,1,1,1,,WGS84,2020,Jehizon Terán|D. Soux|M. Aliaga|E. Rodríguez|Eric Feltz|Huber Villca
16165,PRESERVED_SPECIMEN,Palicourea triphylla,100498527,GBIF,Terán Aguilar 4199,Manuel Vargas,,-17.098333,-64.73066700000001,Sajta propiedad de la Universidad.,2009.0,1,1,1,,WGS84,2020,Jehizon Terán|D. Soux|M. Aliaga|E. Rodríguez|Eric Feltz|Huber Villca
16381,PRESERVED_SPECIMEN,Palicourea triphylla,100435944,GBIF,Hicks 46,Manuel Vargas,,16.685,-88.97166700000001,"San Pastor Savanna, Chiquibul Forest Reserve.",2007.0,1,1,1,,WGS84,2020,J.R. Hicks
16508,PRESERVED_SPECIMEN,Palicourea triphylla,100355353,GBIF,Cayola Pérez 4229A,Manuel Vargas,,-14.760157999999999,-68.726422,"Parque Nacional Madidi, Santa Rosa-Amantala, Charopampa.",2010.0,1,1,1,,WGS84,2020,L. Cayola|R. Villanueva|A. Rojas|I. Loza|L. Samo|R. Villegas|M. Cruz|F. Cruz|A. Cruz|R. Delgado
16521,PRESERVED_SPECIMEN,Palicourea triphylla,100346184,GBIF,Steinbach G. 7276,Manuel Vargas,,-17.583333,-63.75,Buenavista,1925.0,1,1,1,,WGS84,2020,José Steinbach
16531,PRESERVED_SPECIMEN,Palicourea triphylla,100336884,GBIF,Steinbach G. 7216,Manuel Vargas,,-17.583333,-63.766667000000005,Buenavista,,1,1,1,,WGS84,2020,José Steinbach
16532,PRESERVED_SPECIMEN,Palicourea triphylla,100335631,GBIF,Steinbach G. 7216b,Manuel Vargas,,-17.583333,-63.75,Buenavista,,1,1,1,,WGS84,2020,José Steinbach
16533,PRESERVED_SPECIMEN,Palicourea triphylla,100335629,GBIF,Steinbach G. 3093,Manuel Vargas,,-17.583333,-63.75,Buenavista,1916.0,1,1,1,,WGS84,2020,José Steinbach
16538,PRESERVED_SPECIMEN,Palicourea triphylla,100324279,GBIF,Vásquez Martínez 34399,Manuel Vargas,,-9.947222,-75.315833,Dist. Palcazu. San Cristobal.,2008.0,1,1,1,,WGS84,2020,Rodolfo Vásquez|Abel Monteagudo|Hitler Quijano
16539,PRESERVED_SPECIMEN,Palicourea triphylla,100323210,GBIF,Vásquez Martínez 34098,Manuel Vargas,,-10.084722,-75.295833,Dist. Palcazu. Carretera Chuchurras a Río Lagarto.,2008.0,1,1,1,,WGS84,2020,Rodolfo Vásquez|Abel Monteagudo|Hitler Quijano
16574,PRESERVED_SPECIMEN,Palicourea triphylla,100308264,GBIF,Cárdenas Hermosa 1977,Manuel Vargas,,-14.132778,-67.890833,Tumapasa,,1,1,1,,WGS84,2020,Martín Cárdenas
16579,PRESERVED_SPECIMEN,Palicourea triphylla,100304090,GBIF,Buchtien 5597,Manuel Vargas,,-15.613889000000002,-68.00361099999999,Hacienda Simaco,,1,1,1,,WGS84,2020,Otto Buchtien
16582,PRESERVED_SPECIMEN,Palicourea triphylla,100302462,GBIF,Buchtien 1612,Manuel Vargas,,-15.331667000000001,-68.00361099999999,"San Antonio, near Mapiri",1907.0,1,1,1,,WGS84,2020,Otto Buchtien
16605,PRESERVED_SPECIMEN,Palicourea triphylla,100301341,GBIF,Buchtien 1612,Manuel Vargas,,-15.331667000000001,-68.00361099999999,"San Antonio, near Mapiri",1907.0,1,1,1,,WGS84,2020,Otto Buchtien
16653,PRESERVED_SPECIMEN,Palicourea triphylla,100299771,GBIF,Buchtien 1506,Manuel Vargas,,-15.405278,-68.178611,"San Carlos, Mapiri",,1,1,1,,WGS84,2020,Otto Buchtien
16696,PRESERVED_SPECIMEN,Palicourea triphylla,100293603,GBIF,Buchtien 1480,Manuel Vargas,,-15.409167000000002,-68.17611099999999,San Carlos; Mapiri Region;,1926.0,1,1,1,,WGS84,2020,Otto Buchtien
16714,PRESERVED_SPECIMEN,Palicourea triphylla,100268673,GBIF,Becerra González 1533,Manuel Vargas,,-10.176389,-75.27,"Dist. Palcazú. Caserío Villa América, centro Chispa.",2007.0,1,1,1,,WGS84,2020,Edwin Becerra González
16733,PRESERVED_SPECIMEN,Palicourea triphylla,100253169,GBIF,Jones 3264,Manuel Vargas,,15.533889000000002,-89.391389,"Lago Izabal, EXMIBAL Camp 2 (La Gloria), NW of Lake Izabal",1966.0,1,1,1,,WGS84,2020,Gayle C. Jones|Lynden Facey
16783,PRESERVED_SPECIMEN,Palicourea triphylla,100200461,GBIF,Stevens 28664,Manuel Vargas,,12.315278,-83.68083299999999,"Along road 2 km S of Laguna de Perlas; inundated and partially inundated savanna, with scattered islands of Acoelorraphe and shrubs, open savanna of fine white sand or sometimes covered with a thin layer of peat",2009.0,1,1,1,,WGS84,2020,W. D. Stevens|O. M. Montiel J.|E. Duarte M.
16785,PRESERVED_SPECIMEN,Palicourea triphylla,100199397,GBIF,Stevens 28314,Manuel Vargas,,12.315278,-83.68083299999999,"Along road 2 km S of Laguna de Perlas; inundated and partially inundated savanna, with scattered islands of Acoelorraphe and shrubs, open savanna of fine white sand or sometimes covered with a thin layer of peat",2009.0,1,1,1,,WGS84,2020,W. D. Stevens|E. Duarte M.
16813,PRESERVED_SPECIMEN,Palicourea triphylla,100171325,GBIF,Santamaría-Aguilar S-939,Manuel Vargas,,8.535,-83.278611,"Osa Peninsula, road Puerto Jiménez-Piro, growing by river",2005.0,1,1,1,,WGS84,2020,Daniel Santamaría
16814,PRESERVED_SPECIMEN,Palicourea triphylla,100171321,GBIF,Aguilar Fernández 5940,Manuel Vargas,,9.137777999999999,-83.317778,No protegida. Cuenca Térraba-Sierpe. Quebrada Sebror 2 km SE del centro de Buenos Aires.,2000.0,1,1,1,,WGS84,2020,Reinaldo Aguilar
16996,PRESERVED_SPECIMEN,Palicourea triphylla,4446749,GBIF,,Manuel Vargas,,9.211389,-83.422139,"De carretera  Interamericana, cruce a Llano bonito ca. 9 km arriba, hacia Cordillera de Talamanca.",2015.0,1,1,1,,WGS84,2020,Barry Hammel; Isabel Pérez ; Miguel Ángel Cruz Espindola
16997,PRESERVED_SPECIMEN,Palicourea triphylla,4446751,GBIF,,Manuel Vargas,,9.211389,-83.422139,"De carretera  Interamericana, cruce a Llano bonito ca. 9 km arriba, hacia Cordillera de Talamanca.",2015.0,1,1,1,,WGS84,2020,Barry Hammel; Isabel Pérez ; Miguel Ángel Cruz Espindola
16998,PRESERVED_SPECIMEN,Palicourea triphylla,4446750,GBIF,,Manuel Vargas,,9.211389,-83.422139,"De carretera  Interamericana, cruce a Llano bonito ca. 9 km arriba, hacia Cordillera de Talamanca.",2015.0,1,1,1,,WGS84,2020,Barry Hammel; Isabel Pérez ; Miguel Ángel Cruz Espindola
17537,PRESERVED_SPECIMEN,Palicourea triphylla,4267801,GBIF,,Manuel Vargas,,9.126549,-83.325498,Buenos Aires. Alrededores de quebrada Queque (Cacaito).,2010.0,1,1,1,,WGS84,2020,Frank  Alonso González Brenes; Daniel Santamaría ; Juan Francisco Morales Quirós
17538,PRESERVED_SPECIMEN,Palicourea triphylla,4267803,GBIF,,Manuel Vargas,,9.126549,-83.325498,Buenos Aires. Alrededores de quebrada Queque (Cacaito).,2010.0,1,1,1,,WGS84,2020,Frank  Alonso González Brenes; Daniel Santamaría ; Juan Francisco Morales Quirós
17539,PRESERVED_SPECIMEN,Palicourea triphylla,4267802,GBIF,,Manuel Vargas,,9.126549,-83.325498,Buenos Aires. Alrededores de quebrada Queque (Cacaito).,2010.0,1,1,1,,WGS84,2020,Frank  Alonso González Brenes; Daniel Santamaría ; Juan Francisco Morales Quirós
17540,PRESERVED_SPECIMEN,Palicourea triphylla,4267800,GBIF,,Manuel Vargas,,9.126549,-83.325498,Buenos Aires. Alrededores de quebrada Queque (Cacaito).,2010.0,1,1,1,,WGS84,2020,Frank  Alonso González Brenes; Daniel Santamaría ; Juan Francisco Morales Quirós
18287,PRESERVED_SPECIMEN,Palicourea triphylla,4119515,GBIF,,Manuel Vargas,,8.402042,-83.341838,Río Piro.,2005.0,1,1,1,,WGS84,2020,Claes Persson; Daniel Santamaría
19056,PRESERVED_SPECIMEN,Palicourea triphylla,4018805,GBIF,,Manuel Vargas,,9.084722,-83.068611,Tres Colinas.,2006.0,1,1,1,,WGS84,2020,Alexánder Francisco Rodríguez González; Luis González
19057,PRESERVED_SPECIMEN,Palicourea triphylla,4018807,GBIF,,Manuel Vargas,,9.084722,-83.068611,Tres Colinas.,2006.0,1,1,1,,WGS84,2020,Alexánder Francisco Rodríguez González; Luis González
19058,PRESERVED_SPECIMEN,Palicourea triphylla,4018806,GBIF,,Manuel Vargas,,9.084722,-83.068611,Tres Colinas.,2006.0,1,1,1,,WGS84,2020,Alexánder Francisco Rodríguez González; Luis González
19059,PRESERVED_SPECIMEN,Palicourea triphylla,4018803,GBIF,,Manuel Vargas,,9.084722,-83.068611,Tres Colinas.,2006.0,1,1,1,,WGS84,2020,Alexánder Francisco Rodríguez González; Luis González
19060,PRESERVED_SPECIMEN,Palicourea triphylla,4018804,GBIF,,Manuel Vargas,,9.084722,-83.068611,Tres Colinas.,2006.0,1,1,1,,WGS84,2020,Alexánder Francisco Rodríguez González; Luis González
19061,PRESERVED_SPECIMEN,Palicourea triphylla,4018597,GBIF,,Manuel Vargas,,9.08332,-83.06034100000001,Sabanas Helechales parte intermedia.,2006.0,1,1,1,,WGS84,2020,Frank  Alonso González Brenes; Alexánder Francisco Rodríguez González ; Daniel Santamaría
19062,PRESERVED_SPECIMEN,Palicourea triphylla,4018596,GBIF,,Manuel Vargas,,9.08332,-83.06034100000001,Sabanas Helechales parte intermedia.,2006.0,1,1,1,,WGS84,2020,Frank  Alonso González Brenes; Alexánder Francisco Rodríguez González ; Daniel Santamaría
19063,PRESERVED_SPECIMEN,Palicourea triphylla,4018593,GBIF,,Manuel Vargas,,9.08332,-83.06034100000001,Sabanas Helechales parte intermedia.,2006.0,1,1,1,,WGS84,2020,Frank  Alonso González Brenes; Alexánder Francisco Rodríguez González ; Daniel Santamaría
19065,PRESERVED_SPECIMEN,Palicourea triphylla,4018592,GBIF,,Manuel Vargas,,9.08332,-83.06034100000001,Sabanas Helechales parte intermedia.,2006.0,1,1,1,,WGS84,2020,Frank  Alonso González Brenes; Alexánder Francisco Rodríguez González ; Daniel Santamaría
19098,PRESERVED_SPECIMEN,Palicourea triphylla,4013335,GBIF,,Manuel Vargas,,9.225,-83.295833,Sabanas Palmital.,2004.0,1,1,1,,WGS84,2020,Juan Francisco Morales Quirós
19099,PRESERVED_SPECIMEN,Palicourea triphylla,4013337,GBIF,,Manuel Vargas,,9.225,-83.295833,Sabanas Palmital.,2004.0,1,1,1,,WGS84,2020,Juan Francisco Morales Quirós
19100,PRESERVED_SPECIMEN,Palicourea triphylla,4013336,GBIF,,Manuel Vargas,,9.225,-83.295833,Sabanas Palmital.,2004.0,1,1,1,,WGS84,2020,Juan Francisco Morales Quirós
19218,PRESERVED_SPECIMEN,Palicourea triphylla,4024470,GBIF,,Manuel Vargas,,9.073611,-83.088889,Hacienda Helechales.,2006.0,1,1,1,,WGS84,2020,Daniel Solano; Daniel Santamaría ; Alexánder Francisco Rodríguez González
19219,PRESERVED_SPECIMEN,Palicourea triphylla,4024471,GBIF,,Manuel Vargas,,9.073611,-83.088889,Hacienda Helechales.,2006.0,1,1,1,,WGS84,2020,Daniel Solano; Daniel Santamaría ; Alexánder Francisco Rodríguez González
19220,PRESERVED_SPECIMEN,Palicourea triphylla,4024469,GBIF,,Manuel Vargas,,9.073611,-83.088889,Hacienda Helechales.,2006.0,1,1,1,,WGS84,2020,Daniel Solano; Daniel Santamaría ; Alexánder Francisco Rodríguez González
19228,PRESERVED_SPECIMEN,Palicourea triphylla,4021616,GBIF,,Manuel Vargas,,9.083333,-83.06944399999999,Entre Tres Colinas y Helechales.,2006.0,1,1,1,,WGS84,2020,Daniel Santamaría; Alexánder Francisco Rodríguez González ; Frank  Alonso González Brenes
19229,PRESERVED_SPECIMEN,Palicourea triphylla,4021617,GBIF,,Manuel Vargas,,9.083333,-83.06944399999999,Entre Tres Colinas y Helechales.,2006.0,1,1,1,,WGS84,2020,Daniel Santamaría; Alexánder Francisco Rodríguez González ; Frank  Alonso González Brenes
