,BasisOfRec,Binomial,CatalogNo,Citation,CollectID,Compiler,Data_sens,Dec_Lat,Dec_Long,Dist_comm,Event_Year,Origin,Presence,Seasonal,Sens_comm,SpatialRef,YrCompiled,recordedBy
7399,PRESERVED_SPECIMEN,Posoqueria grandifructa,957337,GBIF,Hammel 17827,Manuel Vargas,,10.38,-84.05,P.N. Braulio Carrillo; Llanura de San Carlos. Estación Magsasay.,1990.0,1,1,1,,WGS84,2020,Barry E. Hammel|Alwyn H. Gentry|Helen Kennedy
7413,PRESERVED_SPECIMEN,Posoqueria grandifructa,947116,GBIF,Rueda 3658,Manuel Vargas,,11.5,-84.21666,"Río Punta Gorda, al sur de San José.",1994.0,1,1,1,,WGS84,2020,R. M. Rueda|B. Hernández|I. Coronado G.
7420,PRESERVED_SPECIMEN,Posoqueria grandifructa,946518,GBIF,Rueda 3280,Manuel Vargas,,11.583333,-84.0,Este del poblado de Nueva Atlanta.,1994.0,1,1,1,,WGS84,2020,R. M. Rueda|B. Hernández|I. Coronado G.
7443,PRESERVED_SPECIMEN,Posoqueria grandifructa,931923,GBIF,Rueda 1982,Manuel Vargas,,10.95,-84.25,"Sobre el Río San Juan, en el caño el Sarnoso, ubicado a una hora río abajo del puesto de MARENA, Bartola.",1994.0,1,1,1,,WGS84,2020,R. M. Rueda|B. Hernández|E. Palma
7736,PRESERVED_SPECIMEN,Posoqueria grandifructa,897747,GBIF,Bello Carranza 4060,Manuel Vargas,,10.29,-84.75,"Reserva Biológica Monteverde, Cordille de Tilarán, Estación Aleman's.",1991.0,1,1,1,,WGS84,2020,Erick Bello C.|Eladio Cruz L.|Roy Cruz
7815,PRESERVED_SPECIMEN,Posoqueria grandifructa,894774,GBIF,Bello Carranza 2049,Manuel Vargas,,10.33,-84.7,"Reserva Biológica Monteverde, Río Peñas Blancas, División Reserva Bosque Eterno de Los Niños y Finca I.Q.P.S.A.",1990.0,1,1,1,,WGS84,2020,Erick Bello C.
7826,PRESERVED_SPECIMEN,Posoqueria grandifructa,894278,GBIF,Bello Carranza 1878,Manuel Vargas,,10.35,-84.66,"\Parque Nacional de Arenal, Cordillera de Tilarán, Río Aguas Gatas, Finca Ulate",1990.0,1,1,1,,WGS84,2020,Erick Bello C.
7996,PRESERVED_SPECIMEN,Posoqueria grandifructa,809507,GBIF,Herrera Chacón 444,Manuel Vargas,,10.21472,-84.60777,"Reserva Forestal de San Ramón, En bosque alterado, finca de Bolivar Ruíz entrando a La Reserva",1987.0,1,1,1,,WGS84,2020,Gerardo Herrera Ch.|Ángel Solís
8008,PRESERVED_SPECIMEN,Posoqueria grandifructa,804037,GBIF,Aguilar Fernández 43,Manuel Vargas,,10.374722,-84.036111,"Parque Nacional Braulio Carrillo, Estación El Ceibo",1989.0,1,1,1,,WGS84,2020,Reinaldo Aguilar
8040,PRESERVED_SPECIMEN,Posoqueria grandifructa,786045,GBIF,Moreno 12267,Manuel Vargas,,11.59861,-83.6625,Monkey Point,1981.0,1,1,1,,WGS84,2020,P. P. Moreno|J. C. Sandino
8676,PRESERVED_SPECIMEN,Posoqueria grandifructa,544382,GBIF,Boyle 1354,Manuel Vargas,,10.332778,-84.078889,"Parque Nacional Braulio Carrillo, Puesto El Ceibo, gently sloping area just above the steep rim of the Río Peje gorge on the west side, along side path that goes from guard house to water supply intake, about 15 minutes uphill.",1992.0,1,1,1,,WGS84,2020,Brad Boyle
8677,PRESERVED_SPECIMEN,Posoqueria grandifructa,544342,GBIF,Robles González 1658,Manuel Vargas,,10.4,-83.56,Parque Nacional Tortuguero Margen oriental del Río Sierpe. Bosque primario.,1988.0,1,1,1,,WGS84,2020,Rafael Robles
8687,PRESERVED_SPECIMEN,Posoqueria grandifructa,544210,GBIF,Robles González 2029,Manuel Vargas,,10.4,-83.55,"Parque Nacional Tortuguero Lomas de Sierpe, 3 Km al O del puesto del P.N. en el Río Sierpe. Topografía quebrada con pendientes medianamente pronunciadas. Suelo bien drenado.",1988.0,1,1,1,,WGS84,2020,Rafael Robles|Gerardo Herrera Ch.|Luis Flores
8691,PRESERVED_SPECIMEN,Posoqueria grandifructa,544062,GBIF,Robles González 1235,Manuel Vargas,,10.41,-83.56,"Parque Tortuguero Estación Agua Fría, de la casa-estación, 600 m sobre el Sendero Real, 1 Km al Este,aproximadamente, por otro Sendero. Bosque primario.",1987.0,1,1,1,,WGS84,2020,Rafael Robles
8729,PRESERVED_SPECIMEN,Posoqueria grandifructa,541597,GBIF,Vargas Ramírez 264,Manuel Vargas,,10.28,-84.03,"Rara Avis, ca. 15 km al suroeste de Horquetas. Camino Cañón, cerca de Río Atelopus.",1989.0,1,1,1,,WGS84,2020,Orlando Vargas
8775,PRESERVED_SPECIMEN,Posoqueria grandifructa,539349,GBIF,Solano Marín 58,Manuel Vargas,,10.44,-83.57,"Parque Nacional Tortuguero Estación Agua Fría. Sendero El Aguacate, a 500 m de la entrada.",1990.0,1,1,1,,WGS84,2020,José Solano
8777,PRESERVED_SPECIMEN,Posoqueria grandifructa,539231,GBIF,Solano Marín 246,Manuel Vargas,,10.45,-83.583333,Parque Nacional Tortuguero Estación Aguas Frías. Colecta en Sendero Aguas Frías hasta entrada sendero Agua- cate.,1990.0,1,1,1,,WGS84,2020,José Solano
8791,PRESERVED_SPECIMEN,Posoqueria grandifructa,538800,GBIF,Chacón Gamboa 224,Manuel Vargas,,9.42,-82.98,"Parque Internac. La Amistad Sunidii (Agua de Venado), Croriña.",1989.0,1,1,1,,WGS84,2020,Abelardo Chacón
8839,PRESERVED_SPECIMEN,Posoqueria grandifructa,537670,GBIF,Robles González 2663,Manuel Vargas,,9.78,-83.09,"Cantón de Limón Cerro Muchilla, Fila Matama. CORDILLERA DE TALAMANCA",1989.0,1,1,1,,WGS84,2020,Rafael Robles|Abelardo Chacón
8867,PRESERVED_SPECIMEN,Posoqueria grandifructa,537143,GBIF,Bello Carranza 1071,Manuel Vargas,,10.35,-84.66,Reserva Biológica Monteverde Río Peñas Blancas. Laguna Poco Sol. Sendero al río.,1989.0,1,1,1,,WGS84,2020,Erick Bello C.
9006,PRESERVED_SPECIMEN,Posoqueria grandifructa,527298,GBIF,Stevens 24827,Manuel Vargas,,10.683333,-83.633333,"Cerro Coronel, E of Laguna Danto.",1987.0,1,1,1,,WGS84,2020,W. D. Stevens|Gerardo Herrera Ch.|O. M. Montiel J.
9013,PRESERVED_SPECIMEN,Posoqueria grandifructa,527006,GBIF,Stevens 24763,Manuel Vargas,,10.666667,-83.666667,"Cerro Coronel, E of Río Zapote, E of new road, higher parts of hill ca 1.5 km from Río Colorado.",1987.0,1,1,1,,WGS84,2020,W. D. Stevens|Gerardo Herrera Ch.|O. M. Montiel J.
9024,PRESERVED_SPECIMEN,Posoqueria grandifructa,526450,GBIF,Araquistain 3117,Manuel Vargas,,11.63333,-84.35,"Nueva Guinea, cerro cerca de Colonia Yolaina",1982.0,1,1,1,,WGS84,2020,M. Araquistain
9035,PRESERVED_SPECIMEN,Posoqueria grandifructa,526047,GBIF,Stevens 23665,Manuel Vargas,,10.683333,-83.633333,"Cerro Coronel, E of Laguna Danto.",1986.0,1,1,1,,WGS84,2020,W. D. Stevens
9086,PRESERVED_SPECIMEN,Posoqueria grandifructa,523285,GBIF,Herrera Chacón 509,Manuel Vargas,,10.21472,-84.60777,"camino entre la estación de la Reserva Forestal de San Ramón y el camino a la colonia Palmareña, finca de Don Bolivar Ruíz, margen derecha Río San Lorenzito",1987.0,1,1,1,,WGS84,2020,Gerardo Herrera Ch.
9115,PRESERVED_SPECIMEN,Posoqueria grandifructa,522674,GBIF,Herrera Chacón 2711,Manuel Vargas,,9.788611,-83.141667,Cantón de Limón El Progreso. Fila Matama. Valle de La Estrella.,1989.0,1,1,1,,WGS84,2020,Gerardo Herrera Ch.|Abelardo Chacón
9347,PRESERVED_SPECIMEN,Posoqueria grandifructa,515015,GBIF,Herrera Chacón 3216,Manuel Vargas,,9.4,-82.96,"Sukut. De las juntas de Río Urén y Río Sukut 1.5 Km aguas arriba sobre éste, margen derecha siguiendo el sendero hacia Boca de Río Buruy.",1989.0,1,1,1,,WGS84,2020,Gerardo Herrera Ch.
9471,PRESERVED_SPECIMEN,Posoqueria grandifructa,512593,GBIF,Sandino 3388,Manuel Vargas,,11.566667,-84.366667,"Cerro El Escobín, 4 km de Colonia Serrano.",1982.0,1,1,1,,WGS84,2020,J. C. Sandino
9474,PRESERVED_SPECIMEN,Posoqueria grandifructa,512487,GBIF,Haber 8004,Manuel Vargas,,10.33333,-84.68333,"Reserva Biológica Monteverde Río Peñas Blancas, hacia San Miguel",1988.0,1,1,1,,WGS84,2020,William A. Haber|Eladio Cruz L.
9478,PRESERVED_SPECIMEN,Posoqueria grandifructa,512400,GBIF,Haber 7987,Manuel Vargas,,10.3,-84.73333000000001,Reserva Biológica Monteverde Río Peñas Blancas,1988.0,1,1,1,,WGS84,2020,William A. Haber|Eladio Cruz L.
9543,PRESERVED_SPECIMEN,Posoqueria grandifructa,510504,GBIF,Fernández Zúñiga 82,Manuel Vargas,,10.234722,-84.052778,Parque Nac. Braulio Carrillo Estación Magsasay. Detrás de la Estación entre bosque y potreros.,1990.0,1,1,1,,WGS84,2020,Álvaro Fernández
9974,PRESERVED_SPECIMEN,Posoqueria grandifructa,3471774,GBIF,Araya Mena 597,Manuel Vargas,,10.643880000000001,-83.73611,R.N.F.S. Barra del Colorado. Llanura de Tortuguero. Sardinas.,1994.0,1,1,1,,WGS84,2020,Flor Araya
11199,PRESERVED_SPECIMEN,Posoqueria grandifructa,2750380,GBIF,Stevens 6455,Manuel Vargas,,11.6,-84.366667,Ca. 6.3 km S of bridge at Colonia Yolaina and ca. 0.8 km S of ridge of Serranías de Yolaina on road to Colonia Manantiales (Colonia Somoza).,1978.0,1,1,1,,WGS84,2020,W. D. Stevens
11251,PRESERVED_SPECIMEN,Posoqueria grandifructa,2706909,GBIF,Rueda 17837,Manuel Vargas,,10.966660000000001,-84.33333,"Municipio de El Castillo, Refugio Bartola.",2005.0,1,1,1,,WGS84,2020,R. M. Rueda|L.D. Paguaga|H. Mendoza|Nelson Zamora|Daniel Solano
11534,PRESERVED_SPECIMEN,Posoqueria grandifructa,2418529,GBIF,Vargas Salazar 41,Manuel Vargas,,10.402778,-84.05833299999999,Cuenca del Sarapiquí. Entre Bijagual y Magsasay. Bosques riparios sobre el río Mojon.,1998.0,1,1,1,,WGS84,2020,Luis Diego Vargas|Alexánder Rodríguez|E. Ureña
11786,PRESERVED_SPECIMEN,Posoqueria grandifructa,2378281,GBIF,Folsom 9100,Manuel Vargas,,10.431389,-84.00361099999999,"La Selva Biological Station. Finca La Selva, the OTS Field Station on the Río Puerto Viejo just E of its junction with the Río Sarapiquí.",1981.0,1,1,1,,WGS84,2020,James P. Folsom
12216,PRESERVED_SPECIMEN,Posoqueria grandifructa,2311199,GBIF,Opler 41,Manuel Vargas,,10.431389,-84.00361099999999,"La Selva, 45 m. 3 km. S.E. of Puerto Viejo.",1997.0,1,1,1,,WGS84,2020,Paul A. Opler
12256,PRESERVED_SPECIMEN,Posoqueria grandifructa,2310530,GBIF,Burger 4255,Manuel Vargas,,10.41666,-83.98333000000001,"Original wet forest and Cocoa plantation on the property of Dr. L. Holdridge, about 2 km. Upstream on the Rio Puerto Viejo.",1967.0,1,1,1,,WGS84,2020,William C. Burger|G. Mata U.
12264,PRESERVED_SPECIMEN,Posoqueria grandifructa,2310316,GBIF,Thomsen 1552,Manuel Vargas,,10.5,-83.58333,"Palacios, ca 13 km W of Tortuguero village. On farm of Marvin Jiménez. One-ha sample plot in all forest dominated by Carapa ( 25% of basal area), Pentaclethra macroloba ( 22%) and Pterocarpus officinalis (13%). Understorey dominated by Astrocaryum alatum and Simira maxonii",1998.0,1,1,1,,WGS84,2020,Karsten Thomsen
12300,PRESERVED_SPECIMEN,Posoqueria grandifructa,2309431,GBIF,Thomsen 1554,Manuel Vargas,,10.5,-83.58333,"Palacios, ca 13 km W of Tortuguero village. On farm of Marvin Jiménez. One-ha sample plot in all forest dominated by Carapa ( 25% of basal area), Pentaclethra macroloba ( 22%) and Pterocarpus officinalis (13%). Understorey dominated by Astrocaryum alatum and Simira maxonii",1998.0,1,1,1,,WGS84,2020,Karsten Thomsen
12304,PRESERVED_SPECIMEN,Posoqueria grandifructa,2309320,GBIF,Herrera Chacón 1668,Manuel Vargas,,10.14444,-83.95083000000001,"Estación Carrillo de la Fila al Cañon del Río Sucio, bosque muy húedo tropical-transición a premontano",1983.0,1,1,1,,WGS84,2020,Gerardo Herrera Ch.|Isidro A. Chacón G.
12339,PRESERVED_SPECIMEN,Posoqueria grandifructa,2308446,GBIF,Hartshorn 900,Manuel Vargas,,10.43333,-84.01666,"Vincinity of Rio Frio Finca La Selva, W Puerto Viejo,",1970.0,1,1,1,,WGS84,2020,Gary S. Hartshorn
12422,PRESERVED_SPECIMEN,Posoqueria grandifructa,2306272,GBIF,Gómez Pignataro 21148,Manuel Vargas,,10.13,-83.94,"Fila Carrillo, Parque Nacional Braulio Carrillo, bosque muy húmedo tropical transición premontano",1984.0,1,1,1,,WGS84,2020,Luis Diego Gómez P.|Isidro A. Chacón G.|Gerardo Herrera Ch.
14537,PRESERVED_SPECIMEN,Posoqueria grandifructa,1450371,GBIF,Ramírez Alvarado 458,Manuel Vargas,,10.31,-83.93,Quebrada Gonzalez; Guapiles; Sendero Las Palmas.,1996.0,1,1,1,,WGS84,2020,Marvin Ramírez
14679,PRESERVED_SPECIMEN,Posoqueria grandifructa,1415620,GBIF,McDowell 726,Manuel Vargas,,10.43138,-84.00361,"Finca La Selva, the OTS field station on the Río Puerto Viejo just E of its junction with the Río Sarapiquí.",1982.0,1,1,1,,WGS84,2020,Tim McDowell
14680,PRESERVED_SPECIMEN,Posoqueria grandifructa,1415619,GBIF,Folsom 8888,Manuel Vargas,,10.43138,-84.00361,La Selva Biological Station.,1981.0,1,1,1,,WGS84,2020,James P. Folsom
15261,PRESERVED_SPECIMEN,Posoqueria grandifructa,1182426,GBIF,Rueda 6151,Manuel Vargas,,11.15,-84.18333,"Reserva Indio-Maíz, Municipio de el Castillo, a lo largo del Caño Chontaleño.",1997.0,1,1,1,,WGS84,2020,R. M. Rueda|I. Coronado G.|O. Aráuz|F. Flores
15268,PRESERVED_SPECIMEN,Posoqueria grandifructa,1181966,GBIF,Rueda 6018,Manuel Vargas,,11.15,-84.18333,"Reserva Indio-Maíz, Municipio de el Castillo, a lo largo del Caño Chontaleño.",1997.0,1,1,1,,WGS84,2020,R. M. Rueda|I. Coronado G.|O. Aráuz|F. Flores
15311,PRESERVED_SPECIMEN,Posoqueria grandifructa,1180088,GBIF,Rueda 5886,Manuel Vargas,,11.116660000000001,-84.21666,"Reserva Indio-Maíz, Municipio de el Castillo, a lo largo del Caño Chontaleño.",1997.0,1,1,1,,WGS84,2020,R. M. Rueda|I. Coronado G.|O. Aráuz|F. Flores
19370,PRESERVED_SPECIMEN,Posoqueria grandifructa,3944880,GBIF,,Manuel Vargas,,10.433333,-84.01666800000001,"At confluence of Rio Sarapiqui and Rio Puerto Viejo, Atlantic Slope. Sendero Circular Cercano m 150 de los postes.",2003.0,1,1,1,,WGS84,2020,Ricardo Kriebel; Nelson A. Zamora Villalobos ; Reinaldo Aguilar
19371,PRESERVED_SPECIMEN,Posoqueria grandifructa,3944879,GBIF,,Manuel Vargas,,10.433333,-84.01666800000001,"At confluence of Rio Sarapiqui and Rio Puerto Viejo, Atlantic Slope. Sendero Circular Cercano m 150 de los postes.",2003.0,1,1,1,,WGS84,2020,Ricardo Kriebel; Nelson A. Zamora Villalobos ; Reinaldo Aguilar
19505,PRESERVED_SPECIMEN,Posoqueria grandifructa,3912480,GBIF,,Manuel Vargas,,10.441667,-83.788889,Finca La Suerte.,2002.0,1,1,1,,WGS84,2020,Ricardo Kriebel
20113,PRESERVED_SPECIMEN,Posoqueria grandifructa,3561982,GBIF,,Manuel Vargas,,10.556944,-84.052778,"Por el Cano Negro del Sur, rumbo a Lomas Sardinal; ca.  12 km linea recta N de Puerto Viejo.",1998.0,1,1,1,,WGS84,2020,Barry Hammel; Alexánder Francisco Rodríguez González ; Victor Ramírez
20490,PRESERVED_SPECIMEN,Posoqueria grandifructa,3437071,GBIF,,Manuel Vargas,,10.441868,-84.69137099999999,Cerro Chato,2000.0,1,1,1,,WGS84,2020,Alexánder Francisco Rodríguez González; Victor Ramírez ; Gerardo Soto
20491,PRESERVED_SPECIMEN,Posoqueria grandifructa,3437072,GBIF,,Manuel Vargas,,10.441868,-84.69137099999999,Cerro Chato,2000.0,1,1,1,,WGS84,2020,Alexánder Francisco Rodríguez González; Victor Ramírez ; Gerardo Soto
20495,PRESERVED_SPECIMEN,Posoqueria grandifructa,3437069,GBIF,,Manuel Vargas,,10.441868,-84.69137099999999,Cerro Chato,2000.0,1,1,1,,WGS84,2020,Alexánder Francisco Rodríguez González; Victor Ramírez ; Gerardo Soto
20499,PRESERVED_SPECIMEN,Posoqueria grandifructa,3437070,GBIF,,Manuel Vargas,,10.441868,-84.69137099999999,Cerro Chato,2000.0,1,1,1,,WGS84,2020,Alexánder Francisco Rodríguez González; Victor Ramírez ; Gerardo Soto
21618,PRESERVED_SPECIMEN,Posoqueria grandifructa,2921446,GBIF,,Manuel Vargas,,9.788611,-83.141667,El Progreso. Bosque transicional entre los 1200 m y 1500 m. Fila Matama.,1989.0,1,1,1,,WGS84,2020,Gerardo Herrera
21677,PRESERVED_SPECIMEN,Posoqueria grandifructa,2919026,GBIF,,Manuel Vargas,,10.384167,-84.05,Estacion Magsasay.,1990.0,1,1,1,,WGS84,2020,Barry Hammel
21777,PRESERVED_SPECIMEN,Posoqueria grandifructa,2842211,GBIF,,Manuel Vargas,,10.402778,-84.05833299999999,Estacion Magsasay.,1998.0,1,1,1,,WGS84,2020,Luis Diego Vargas; Alexánder Francisco Rodríguez González ; Esteban Uren~a
21778,PRESERVED_SPECIMEN,Posoqueria grandifructa,2842209,GBIF,,Manuel Vargas,,10.402778,-84.05833299999999,Estacion Magsasay.,1998.0,1,1,1,,WGS84,2020,Luis Diego Vargas; Alexánder Francisco Rodríguez González ; Esteban Uren~a
21779,PRESERVED_SPECIMEN,Posoqueria grandifructa,2842210,GBIF,,Manuel Vargas,,10.402778,-84.05833299999999,Estacion Magsasay.,1998.0,1,1,1,,WGS84,2020,Luis Diego Vargas; Alexánder Francisco Rodríguez González ; Esteban Uren~a
22483,PRESERVED_SPECIMEN,Posoqueria grandifructa,1583419,GBIF,,Manuel Vargas,,10.643889,-83.736112,Sardinas.,1994.0,1,1,1,,WGS84,2020,F. Araya
23174,PRESERVED_SPECIMEN,Posoqueria grandifructa,1577706,GBIF,,Manuel Vargas,,10.333333,-84.7,Rio Penas Blancas. Division Bosque Eterno de Los Ninos y Finca I.Q.P.S.A.,1990.0,1,1,1,,WGS84,2020,Erick Bello
23256,PRESERVED_SPECIMEN,Posoqueria grandifructa,1572754,GBIF,,Manuel Vargas,,10.294444,-84.75,Estacion Aleman s.,1991.0,1,1,1,,WGS84,2020,Erick Bello
23277,PRESERVED_SPECIMEN,Posoqueria grandifructa,1571786,GBIF,,Manuel Vargas,,10.444444,-83.57777800000001,Estacion Agua Fria. Sendero Agua Fria hasta entrada Sendero Aguacate.,1990.0,1,1,1,,WGS84,2020,Jose Solano
23459,PRESERVED_SPECIMEN,Posoqueria grandifructa,1565939,GBIF,,Manuel Vargas,,10.234722,-84.052778,Estacion Magsasay. Detras de la Estacion entre bosque y potreros.,1990.0,1,1,1,,WGS84,2020,Alvaro Fernandez
23489,PRESERVED_SPECIMEN,Posoqueria grandifructa,1565154,GBIF,,Manuel Vargas,,10.35,-84.666667,Rio Aguas Gatas. Finca Ulate.,1990.0,1,1,1,,WGS84,2020,Erick Bello
23587,PRESERVED_SPECIMEN,Posoqueria grandifructa,1561043,GBIF,,Manuel Vargas,,9.402778,-82.961111,"De las juntas de Rio Uren y Rio Sukut 1.5 Km aguas arriba sobre este, margen derecha siguiendo el sendero hacia Boca de Rio Buruy.",1989.0,1,1,1,,WGS84,2020,Gerardo Herrera
23957,PRESERVED_SPECIMEN,Posoqueria grandifructa,1531505,GBIF,,Manuel Vargas,,10.319167,-83.936111,Quebrada Gonzalez; Guapiles; Sendero La Garrapata.,1996.0,1,1,1,,WGS84,2020,Victor Ramírez
23958,PRESERVED_SPECIMEN,Posoqueria grandifructa,1531503,GBIF,,Manuel Vargas,,10.319167,-83.936111,Quebrada Gonzalez; Guapiles; Sendero La Garrapata.,1996.0,1,1,1,,WGS84,2020,Victor Ramírez
23959,PRESERVED_SPECIMEN,Posoqueria grandifructa,1531504,GBIF,,Manuel Vargas,,10.319167,-83.936111,Quebrada Gonzalez; Guapiles; Sendero La Garrapata.,1996.0,1,1,1,,WGS84,2020,Victor Ramírez
23961,PRESERVED_SPECIMEN,Posoqueria grandifructa,1531502,GBIF,,Manuel Vargas,,10.319167,-83.936111,Quebrada Gonzalez; Guapiles; Sendero La Garrapata.,1996.0,1,1,1,,WGS84,2020,Victor Ramírez
24436,PRESERVED_SPECIMEN,Posoqueria grandifructa,,GBIF,8888,Manuel Vargas,,10.5,-84.0,,1981.0,1,1,1,,WGS84,2020,J. P. Folsom
25007,PRESERVED_SPECIMEN,Posoqueria grandifructa,,GBIF,726,Manuel Vargas,,10.5,-84.0,,1982.0,1,1,1,,WGS84,2020,T. McDowell
