,BasisOfRec,Binomial,CatalogNo,Citation,CollectID,Compiler,Data_sens,Dec_Lat,Dec_Long,Dist_comm,Event_Year,Origin,Presence,Seasonal,Sens_comm,SpatialRef,YrCompiled,recordedBy
3231,PRESERVED_SPECIMEN,Randia brenesii,461633,GBIF,504,Manuel Vargas,,5.566667,-77.5,"Región Cabo Corriente, zona de río Arusi.",1997.0,1,1,1,,WGS84,2020,D. Tuberquia
4079,PRESERVED_SPECIMEN,Randia brenesii,133032,GBIF,15048,Manuel Vargas,,10.501664,-84.692045,La Palma de San Ramón,1932.0,1,1,1,,WGS84,2020,A. M. Brenes
7568,PRESERVED_SPECIMEN,Randia brenesii,904820,GBIF,Rodríguez González 449,Manuel Vargas,,10.65,-84.18,"Llanura de San Carlos, Pital, Yucatán, Finca de Carlos Loría Murillo",1994.0,1,1,1,,WGS84,2020,Alexánder Rodríguez
7584,PRESERVED_SPECIMEN,Randia brenesii,904187,GBIF,Herrera Chacón 4928,Manuel Vargas,,10.2,-84.6,"Reserva Forestal San Ramón, Los Angeles, Colonia Palmareña, cuenca media de Río San Lorenzo, camino a la mina de Los Perdidos",1991.0,1,1,1,,WGS84,2020,Gerardo Herrera Ch.|Francisco Castro R.|Asdrúbal Castro R.
7753,PRESERVED_SPECIMEN,Randia brenesii,896883,GBIF,Bello Carranza 2772,Manuel Vargas,,10.34,-84.72,R.B. Monteverde; Cordillera de Tilarán. Río Veracruz.,1991.0,1,1,1,,WGS84,2020,Erick Bello C.|Eladio Cruz L.|Roy Cruz
7769,PRESERVED_SPECIMEN,Randia brenesii,896026,GBIF,Aguilar Fernández 2054,Manuel Vargas,,8.82,-83.19,"Fila Costeña. Río Piedras Blancas, 2 Km al Norte, alrededores de Cerro Anguciana.",1993.0,1,1,1,,WGS84,2020,Reinaldo Aguilar|Marianela Segura|F. J. Quesada
7796,PRESERVED_SPECIMEN,Randia brenesii,895270,GBIF,Aguilar Fernández 1793,Manuel Vargas,,8.7,-83.51,R.F. Golfo Dulce; Península de Osa. Aguabuena Oeste.,1993.0,1,1,1,,WGS84,2020,Reinaldo Aguilar
7798,PRESERVED_SPECIMEN,Randia brenesii,895200,GBIF,Bello Carranza 2192,Manuel Vargas,,10.38,-84.7,"Bosque Eterno de Los Niños Río Peñas Blancas, Quebrada Gata, Los Pérez.",1990.0,1,1,1,,WGS84,2020,Erick Bello C.|William A. Haber|Willow Zuchowski|J. Sibaja
7892,PRESERVED_SPECIMEN,Randia brenesii,891519,GBIF,Haber 10543,Manuel Vargas,,10.38,-84.7,"Bosque Eterno De Los Niños, Cordillera de Tilarán, Valley of Río Agua Gata, Atlantic slope, Road from Lagarto at Inter-American",1991.0,1,1,1,,WGS84,2020,William A. Haber|Willow Zuchowski
8657,PRESERVED_SPECIMEN,Randia brenesii,544602,GBIF,Grayum 9002,Manuel Vargas,,10.633333,-83.75,"Refugio Barra de Colorado.  Forests and pastures between Río Chirripocito and Río Sardina (""Sardinal"" on Chirripó Atlántico quadrangle).",1988.0,1,1,1,,WGS84,2020,Michael H. Grayum|F. G. Stiles|Isidro A. Chacón G.|E. Hernández|Reinaldo Aguilar|F. Bolaños
8666,PRESERVED_SPECIMEN,Randia brenesii,544466,GBIF,Boyle 1400,Manuel Vargas,,10.332778,-84.078889,"Parque Nacional Braulio Carrillo, Puesto El Ceibo, gently sloping area just above the steep rim of the Río Peje gorge on the west side, along side path that goes from guard house to water supply intake, about 15 minutes uphill.",1992.0,1,1,1,,WGS84,2020,Brad Boyle
8688,PRESERVED_SPECIMEN,Randia brenesii,544203,GBIF,Grayum 4059,Manuel Vargas,,8.7,-83.55,"Ridge between Quebrada Aguabuena and Quebrada Banegas, ca. 5 km W of Rincón de Osa. Elev. 300-400 m. 8º42'N, 83º33'W. Collected with G. Herrera, G. Schatz, C. Valerín & F. Chavarría",1984.0,1,1,1,,WGS84,2020,Michael H. Grayum
8723,PRESERVED_SPECIMEN,Randia brenesii,541985,GBIF,Pounds 258,Manuel Vargas,,10.26,-84.77,"Monteverde, Cloud Forest Reserve, Cordillera de Tilarán. Lower montane Rain Forest. (Holdridge Classification). Pacific slope of Continental Divide.",1984.0,1,1,1,,WGS84,2020,Willow Z. Pounds
8913,PRESERVED_SPECIMEN,Randia brenesii,533619,GBIF,Gentry 78720,Manuel Vargas,,8.7,-83.55,"Fila before Rancho Quemada, near Rincon, Osa Peninsula. Transect 5.",1993.0,1,1,1,,WGS84,2020,Alwyn H. Gentry|Rosa Ortiz|Irene Shonle|Jason C. Bradford|P. Anderson
9007,PRESERVED_SPECIMEN,Randia brenesii,527293,GBIF,Araquistain 3281,Manuel Vargas,,10.966667,-84.333333,"Río Bartolo, Dos Bocas; bosque tropical húmedo",1982.0,1,1,1,,WGS84,2020,M. Araquistain
9054,PRESERVED_SPECIMEN,Randia brenesii,524959,GBIF,Davidse 23169,Manuel Vargas,,10.066667,-83.966667,"Bajo de Hondura, Parque Nacional Braulio Carrillo.",1983.0,1,1,1,,WGS84,2020,Gerrit Davidse|Luis Diego Gómez P.|Mario Sousa S.|Christopher J. Humphries|Nancy C. Garwood|Rachel J. Hampshire|Mary Gibby
9101,PRESERVED_SPECIMEN,Randia brenesii,523009,GBIF,Herrera Chacón 2035,Manuel Vargas,,10.68,-85.0,"Bijagua El Pilón, subiendo por la margen derecha del Río El Roble hasta el Volcán Tenorio",1988.0,1,1,1,,WGS84,2020,Gerardo Herrera Ch.|José Luis Jiménez|L. Chacón|O. Chacón
9184,PRESERVED_SPECIMEN,Randia brenesii,520075,GBIF,Hammel 15207,Manuel Vargas,,8.65,-83.53,Osa Peninsula; in forest west of Rincon; ca. 9 km west of Rincon on road to Rancho Quemado.,1986.0,1,1,1,,WGS84,2020,Barry E. Hammel|Michael H. Grayum|Greg C. de Nevers
9185,PRESERVED_SPECIMEN,Randia brenesii,520061,GBIF,Hammel 15206,Manuel Vargas,,8.65,-83.53,Osa Peninsula; in forest west of Rincon; ca. 9 km west of Rincon on road to Rancho Quemado.,1986.0,1,1,1,,WGS84,2020,Barry E. Hammel|Michael H. Grayum|Greg C. de Nevers
9193,PRESERVED_SPECIMEN,Randia brenesii,519558,GBIF,Hammel 16913,Manuel Vargas,,8.7,-83.55,"Reserva Forestal Golfo Dulce Osa Península, Rancho Quemado, ca. 15 km W of Rincón; in bottom of valley along Río Riyito near bridge and in forest along road on ridge above valley.",1988.0,1,1,1,,WGS84,2020,Barry E. Hammel|Gerardo Herrera Ch.|María Marta Chavarría|Ángel Solís
9328,PRESERVED_SPECIMEN,Randia brenesii,515383,GBIF,Haber 9130,Manuel Vargas,,10.28333,-84.78333,"Reserva Biológica Monteverde Sendero Brillante, división continental.",1989.0,1,1,1,,WGS84,2020,William A. Haber|Willow Zuchowski
9439,PRESERVED_SPECIMEN,Randia brenesii,512886,GBIF,Haber 1318,Manuel Vargas,,10.299719999999999,-84.75083000000001,"Monteverde Reserve, Atlantic slope, Río Peñas Blancas valley, Dos Aces",1985.0,1,1,1,,WGS84,2020,William A. Haber
9443,PRESERVED_SPECIMEN,Randia brenesii,512838,GBIF,Haber 8042,Manuel Vargas,,10.43333,-84.73333000000001,"El Castillo, Monteverde Vertiente Norte",1988.0,1,1,1,,WGS84,2020,William A. Haber|Erick Bello C.
9476,PRESERVED_SPECIMEN,Randia brenesii,512434,GBIF,Grayum 9793,Manuel Vargas,,10.63,-83.75,"Ref. Nac. Barra del Colorado Forests and pastures between Río Chirripocito and Río Sardina (""Sardinal"" on Chirripó Atlántico quadrangle).",1990.0,1,1,1,,WGS84,2020,Michael H. Grayum
9530,PRESERVED_SPECIMEN,Randia brenesii,511513,GBIF,Gómez-Laurito 11809,Manuel Vargas,,10.21,-84.61,Reserva Forestal San Ramón Campamento Río San Lorencito,1989.0,1,1,1,,WGS84,2020,Jorge Gómez-Laurito|Víctor Mora
11532,PRESERVED_SPECIMEN,Randia brenesii,2418567,GBIF,Rodríguez González 5022,Manuel Vargas,,10.42222,-84.69444,"Parque Nacional Arenal, cuenca del San Carlos, sendero al Cerro Chato, entrando por Lodge Arenal",1999.0,1,1,1,,WGS84,2020,Alexánder Rodríguez|Víctor H. Ramírez
11799,PRESERVED_SPECIMEN,Randia brenesii,2373427,GBIF,Carrasquilla 1339,Manuel Vargas,,9.302778,-82.541667,"Sito de presa, Campamento del IRHE, río Changuinola.",1980.0,1,1,1,,WGS84,2020,Luis G. Carrasquilla|Rodolfo Mendoza
11804,PRESERVED_SPECIMEN,Randia brenesii,2372025,GBIF,Aguilar 1325,Manuel Vargas,,9.305,-79.44388000000001,"Transecto en Río Limpio, Parque Nacional Chagres. 9º18'17.36"" N 79º26'37.79"" W.",1999.0,1,1,1,,WGS84,2020,Salomón Aguilar|A. Somoza|José Á. Villarreal-Quintanilla|I. Tejeda|D. Luque|N. Daguerre
11814,PRESERVED_SPECIMEN,Randia brenesii,2369300,GBIF,Zamora Villalobos 621,Manuel Vargas,,10.066667,-83.9875,"Parque Nacional Braulio Carrillo, sendero hacia la Quebrada Zurquí.",1984.0,1,1,1,,WGS84,2020,Nelson Zamora|Pablo E. Sánchez V.|Sandra Lobo E.
11815,PRESERVED_SPECIMEN,Randia brenesii,2368618,GBIF,Mora Castro 322,Manuel Vargas,,9.990269999999999,-83.44166,Cantón de Matina. ZP Pacuare. Cuenca del Matina. Sendero Topoyiyo,1999.0,1,1,1,,WGS84,2020,Edgar Mora Castro
11820,PRESERVED_SPECIMEN,Randia brenesii,2367731,GBIF,Haber 565,Manuel Vargas,,10.3125,-84.79861,"Monteverde Reserve, in treefall in forest near divide",1981.0,1,1,1,,WGS84,2020,William A. Haber
11821,PRESERVED_SPECIMEN,Randia brenesii,2368023,GBIF,Herrera Chacón 8967,Manuel Vargas,,10.26666,-84.66666,La Pitahaya. Arancibia. Corazón de Jesus. Cabecera quebrada Las Vueltas,1996.0,1,1,1,,WGS84,2020,Gerardo Herrera Ch.|Patrick Kuss|Olger Badilla|William Badilla
11822,PRESERVED_SPECIMEN,Randia brenesii,2368322,GBIF,Haber 340,Manuel Vargas,,10.3175,-84.80666,"Monteverde Reserve, Brillante refugio",1979.0,1,1,1,,WGS84,2020,William A. Haber
11825,PRESERVED_SPECIMEN,Randia brenesii,2367733,GBIF,Mora Castro 1039,Manuel Vargas,,9.98472,-83.39721999999999,"PN Barbilla. Cuenca delMatina. Sendero Las Pitas, Quebrada El Dulce",2000.0,1,1,1,,WGS84,2020,Edgar Mora Castro
11829,PRESERVED_SPECIMEN,Randia brenesii,2366866,GBIF,Burger 7305,Manuel Vargas,,8.7,-83.51666,"Moist forest in valley-bottoms, forest with open under story on steep slopes and ridges, and areas of secondary vegetation north and west of the air field, about 5km west of Rincón de Osa, Osa Península",1970.0,1,1,1,,WGS84,2020,William C. Burger|Ronald L. Liesner
11830,PRESERVED_SPECIMEN,Randia brenesii,2367147,GBIF,Gómez Pignataro 23629,Manuel Vargas,,10.008333,-83.486944,"Río Danto [Río Dantas]. Camino por Las Brisas, Pacuarito.",1985.0,1,1,1,,WGS84,2020,Luis Diego Gómez P.|Gerardo Herrera Ch.
11831,PRESERVED_SPECIMEN,Randia brenesii,2367146,GBIF,Russell 958,Manuel Vargas,,10.43,-84.68,"Arenal Volcano, south slope of Cerro Chato, steep slope of humid rainforest.",1989.0,1,1,1,,WGS84,2020,George F. Russell|et al.
11836,PRESERVED_SPECIMEN,Randia brenesii,2365837,GBIF,Chacón Gamboa 1605,Manuel Vargas,,10.14,-83.95,Estación Carrillo de 700 a 450 m de la Fila al Cañon del Río Sucio.,1983.0,1,1,1,,WGS84,2020,Isidro A. Chacón G.|Gerardo Herrera Ch.
14254,PRESERVED_SPECIMEN,Randia brenesii,1577084,GBIF,Duke 16096,Manuel Vargas,,8.69,-83.5,tropical wet fores along dry stream bed paralleling airport at Rincón. Ann. Rainfall ca. 180 inches,1969.0,1,1,1,,WGS84,2020,James A. Duke
14663,PRESERVED_SPECIMEN,Randia brenesii,1416384,GBIF,Dryer 1323,Manuel Vargas,,9.47,-82.93,Al lado de carril en bosque maduro--Peñas Blancas,1977.0,1,1,1,,WGS84,2020,Valerie J. Dryer
14889,PRESERVED_SPECIMEN,Randia brenesii,1332916,GBIF,Rueda 9633,Manuel Vargas,,11.01666,-84.2,"Municipio el Castillo, Reserva Indio-Maiz; Cerro el Diablo.",1998.0,1,1,1,,WGS84,2020,R. M. Rueda|I. Coronado G.|F. Flores|O. Caballero
14899,PRESERVED_SPECIMEN,Randia brenesii,1329510,GBIF,Rueda 9403,Manuel Vargas,,10.91666,-84.28333,"Municipio el Castillo, Reserva biológica ""Indio-Maiz"", Caño el Sarnoso",1998.0,1,1,1,,WGS84,2020,R. M. Rueda|I. Coronado G.|F. Flores|W. Velásquez|O. Caballero
14999,PRESERVED_SPECIMEN,Randia brenesii,1290884,GBIF,Rueda 8159,Manuel Vargas,,10.966660000000001,-84.33055,Municipio del Castillo. Estación Biológica Bartola a 3 kilometro de le desembocodura.,1998.0,1,1,1,,WGS84,2020,R. M. Rueda|I. Coronado G.|W. Velásquez
15314,PRESERVED_SPECIMEN,Randia brenesii,1180045,GBIF,Rueda 5589,Manuel Vargas,,11.01666,-84.2,"Reserva Indio-Maíz, Municipio de el Castillo, Cerro el Diablo.",1997.0,1,1,1,,WGS84,2020,R. M. Rueda|I. Coronado G.|O. Aráuz|F. Flores
15315,PRESERVED_SPECIMEN,Randia brenesii,1180026,GBIF,Rueda 5577,Manuel Vargas,,11.01666,-84.2,"Reserva Indio-Maíz, Municipio de el Castillo, Cerro el Diablo.",1997.0,1,1,1,,WGS84,2020,R. M. Rueda|I. Coronado G.|O. Aráuz|F. Flores
15321,PRESERVED_SPECIMEN,Randia brenesii,1179820,GBIF,Rueda 5795,Manuel Vargas,,11.1,-84.23333000000001,"Reserva Indio-Maíz, Municipio de el Castillo, a lo largo del Caño Chontaleño.",1997.0,1,1,1,,WGS84,2020,R. M. Rueda|I. Coronado G.|O. Aráuz|F. Flores
15335,PRESERVED_SPECIMEN,Randia brenesii,1179374,GBIF,Rueda 5305,Manuel Vargas,,11.01666,-84.23333000000001,"Reserva Indio-Maíz, Municipio de el Castillo, a 8 km de la cabecera del Río Bartola, en dirección hacia el Cerro el Diablo.",1997.0,1,1,1,,WGS84,2020,R. M. Rueda|I. Coronado G.|O. Aráuz|F. Flores
16159,PRESERVED_SPECIMEN,Randia brenesii,100499512,GBIF,Rodríguez González 1145,Manuel Vargas,,10.215278,-84.58889,No protegida. Cuenca del San Carlos. San Ramón. Colonia Palmareña. R.B. Manuel Brenes. Estación San Lorenzo.,1996.0,1,1,1,,WGS84,2020,Alexánder Rodríguez
17213,PRESERVED_SPECIMEN,Randia brenesii,4372469,GBIF,,Manuel Vargas,,8.678333,-83.528611,"Reserva Forestal Golfo Dulce. Rincón, camino a Rancho Quemado, cruce a Baneguitas bosques alrededor.",2013.0,1,1,1,,WGS84,2020,Nelson A. Zamora Villalobos; Reinaldo Aguilar ; Guillermo Villalobos ; Soo-Yong Kim ; D. Solorzano
17216,PRESERVED_SPECIMEN,Randia brenesii,4372468,GBIF,,Manuel Vargas,,8.678333,-83.528611,"Reserva Forestal Golfo Dulce. Rincón, camino a Rancho Quemado, cruce a Baneguitas bosques alrededor.",2013.0,1,1,1,,WGS84,2020,Nelson A. Zamora Villalobos; Reinaldo Aguilar ; Guillermo Villalobos ; Soo-Yong Kim ; D. Solorzano
17218,PRESERVED_SPECIMEN,Randia brenesii,4372470,GBIF,,Manuel Vargas,,8.678333,-83.528611,"Reserva Forestal Golfo Dulce. Rincón, camino a Rancho Quemado, cruce a Baneguitas bosques alrededor.",2013.0,1,1,1,,WGS84,2020,Nelson A. Zamora Villalobos; Reinaldo Aguilar ; Guillermo Villalobos ; Soo-Yong Kim ; D. Solorzano
17930,PRESERVED_SPECIMEN,Randia brenesii,4194888,GBIF,,Manuel Vargas,,10.191111,-83.857778,Bosque Lluvioso. Sendero Central.,2005.0,1,1,1,,WGS84,2020,Luis Diego Vargas; Guillermo Villalobos
18840,PRESERVED_SPECIMEN,Randia brenesii,4078327,GBIF,,Manuel Vargas,,10.146158,-83.93639300000001,Transecto Irazú - Braulio Carrillo. P. N. Braulio Carrillo.,2004.0,1,1,1,,WGS84,2020,Evelio Alfaro; Jose González
18841,PRESERVED_SPECIMEN,Randia brenesii,4078328,GBIF,,Manuel Vargas,,10.146158,-83.93639300000001,Transecto Irazú - Braulio Carrillo. P. N. Braulio Carrillo.,2004.0,1,1,1,,WGS84,2020,Evelio Alfaro; Jose González
20505,PRESERVED_SPECIMEN,Randia brenesii,3437015,GBIF,,Manuel Vargas,,10.441868,-84.69137099999999,Cerro Chato,2000.0,1,1,1,,WGS84,2020,Alexánder Francisco Rodríguez González; Victor Ramírez ; Gerardo Soto
20540,PRESERVED_SPECIMEN,Randia brenesii,3428392,GBIF,,Manuel Vargas,,10.011111,-83.383333,Colonia Puriscaleña.,2000.0,1,1,1,,WGS84,2020,Alexánder Francisco Rodríguez González; Edgar Mora ; Geovanny Sancho ; Gerardo Soto
20541,PRESERVED_SPECIMEN,Randia brenesii,3428393,GBIF,,Manuel Vargas,,10.011111,-83.383333,Colonia Puriscaleña.,2000.0,1,1,1,,WGS84,2020,Alexánder Francisco Rodríguez González; Edgar Mora ; Geovanny Sancho ; Gerardo Soto
20951,PRESERVED_SPECIMEN,Randia brenesii,3173172,GBIF,,Manuel Vargas,,10.422222,-84.69444399999999,"La Fortuna, 3 Km sur Cerro Chato, junto al Rio Fortuna.",1999.0,1,1,1,,WGS84,2020,Alexánder Francisco Rodríguez González; Victor Ramírez
20952,PRESERVED_SPECIMEN,Randia brenesii,3173171,GBIF,,Manuel Vargas,,10.422222,-84.69444399999999,"La Fortuna, 3 Km sur Cerro Chato, junto al Rio Fortuna.",1999.0,1,1,1,,WGS84,2020,Alexánder Francisco Rodríguez González; Victor Ramírez
21038,PRESERVED_SPECIMEN,Randia brenesii,3110246,GBIF,,Manuel Vargas,,10.422222,-84.69444399999999,"La Fortuna, 3 Km sur Cerro Chato, junto al Rio Fortuna.",1999.0,1,1,1,,WGS84,2020,Alexánder Francisco Rodríguez González; Victor Ramírez
21041,PRESERVED_SPECIMEN,Randia brenesii,3110247,GBIF,,Manuel Vargas,,10.422222,-84.69444399999999,"La Fortuna, 3 Km sur Cerro Chato, junto al Rio Fortuna.",1999.0,1,1,1,,WGS84,2020,Alexánder Francisco Rodríguez González; Victor Ramírez
21069,PRESERVED_SPECIMEN,Randia brenesii,3108443,GBIF,,Manuel Vargas,,9.984722,-83.397222,"Sector Colonia Puriscaleña, Sendero Las Pitas, Quebrada El Dulce.",2000.0,1,1,1,,WGS84,2020,Edgar Mora
21070,PRESERVED_SPECIMEN,Randia brenesii,3108444,GBIF,,Manuel Vargas,,9.984722,-83.397222,"Sector Colonia Puriscaleña, Sendero Las Pitas, Quebrada El Dulce.",2000.0,1,1,1,,WGS84,2020,Edgar Mora
21071,PRESERVED_SPECIMEN,Randia brenesii,3108445,GBIF,,Manuel Vargas,,9.984722,-83.397222,"Sector Colonia Puriscaleña, Sendero Las Pitas, Quebrada El Dulce.",2000.0,1,1,1,,WGS84,2020,Edgar Mora
21329,PRESERVED_SPECIMEN,Randia brenesii,2916948,GBIF,,Manuel Vargas,,10.433333,-84.733333,"El Castillo, junto al Lago Arenal. Area Monteverde. Vertiente Norte.",1988.0,1,1,1,,WGS84,2020,William Haber
21366,PRESERVED_SPECIMEN,Randia brenesii,2915636,GBIF,,Manuel Vargas,,10.216667,-84.616667,Campamento Rio San Lorencito.,1989.0,1,1,1,,WGS84,2020,Jorge Gómez Laurito
21375,PRESERVED_SPECIMEN,Randia brenesii,2915152,GBIF,,Manuel Vargas,,10.633333,-83.75,Forests and pastures between Rio Chirripocito and Rio Sardina ( Sardinal  on Chirripo Atlantico quadrangle).,1990.0,1,1,1,,WGS84,2020,Michael H. Grayum
21378,PRESERVED_SPECIMEN,Randia brenesii,2914578,GBIF,,Manuel Vargas,,10.633333,-83.75,Forests and pastures between Rio Chirripocito and Rio Sardina ( Sardinal  on Chirripo Atlantico quadrangle).,1988.0,1,1,1,,WGS84,2020,Michael H. Grayum
21431,PRESERVED_SPECIMEN,Randia brenesii,2909512,GBIF,,Manuel Vargas,,10.332778,-84.078889,Puesto El Ceibo. Gently sloping area just above the steep rim of the Rio Peje gorge on the west side. Along side path that goes from guard house to water   --,1992.0,1,1,1,,WGS84,2020,Brad Boyle
21454,PRESERVED_SPECIMEN,Randia brenesii,2907222,GBIF,,Manuel Vargas,,10.383333,-84.7,"Rio Penas Blancas, Quebrada Gata, Los Perez.",1990.0,1,1,1,,WGS84,2020,Erick Bello
21630,PRESERVED_SPECIMEN,Randia brenesii,2920952,GBIF,,Manuel Vargas,,10.683333,-85.005556,"El Pilon, subiendo por la margen derecha del Rio El Roble hasta el Volcan Tenorio Bijagua.",1988.0,1,1,1,,WGS84,2020,Gerardo Herrera
21726,PRESERVED_SPECIMEN,Randia brenesii,2917609,GBIF,,Manuel Vargas,,10.283333,-84.783334,"Sendero Brillante, division continental.",1989.0,1,1,1,,WGS84,2020,William Haber
21857,PRESERVED_SPECIMEN,Randia brenesii,2834694,GBIF,,Manuel Vargas,,9.9875,-83.472222,Valle Escondido.,1999.0,1,1,1,,WGS84,2020,Edgar Mora
21863,PRESERVED_SPECIMEN,Randia brenesii,2834263,GBIF,,Manuel Vargas,,9.990278,-83.44166700000001,Sendero Topoyiyo.,1999.0,1,1,1,,WGS84,2020,Edgar Mora
21864,PRESERVED_SPECIMEN,Randia brenesii,2834262,GBIF,,Manuel Vargas,,9.990278,-83.44166700000001,Sendero Topoyiyo.,1999.0,1,1,1,,WGS84,2020,Edgar Mora
21865,PRESERVED_SPECIMEN,Randia brenesii,2834265,GBIF,,Manuel Vargas,,9.990278,-83.44166700000001,Sendero Topoyiyo.,1999.0,1,1,1,,WGS84,2020,Edgar Mora
21866,PRESERVED_SPECIMEN,Randia brenesii,2834266,GBIF,,Manuel Vargas,,9.990278,-83.44166700000001,Sendero Topoyiyo.,1999.0,1,1,1,,WGS84,2020,Edgar Mora
21867,PRESERVED_SPECIMEN,Randia brenesii,2834264,GBIF,,Manuel Vargas,,9.990278,-83.44166700000001,Sendero Topoyiyo.,1999.0,1,1,1,,WGS84,2020,Edgar Mora
21882,PRESERVED_SPECIMEN,Randia brenesii,2832661,GBIF,,Manuel Vargas,,9.973333,-83.450556,Sendero que lleva a Rio Danta.,1998.0,1,1,1,,WGS84,2020,Alexánder Francisco Rodríguez González; Luis Diego Vargas
22597,PRESERVED_SPECIMEN,Randia brenesii,1607172,GBIF,,Manuel Vargas,,10.65,-84.18333299999999,Pital. Yucatan. Finca de Carlos Loria Murillo.,1994.0,1,1,1,,WGS84,2020,Alexánder Francisco Rodríguez González
22992,PRESERVED_SPECIMEN,Randia brenesii,1591834,GBIF,,Manuel Vargas,,10.643889,-83.736112,Sardinas.,1995.0,1,1,1,,WGS84,2020,F. Araya
23211,PRESERVED_SPECIMEN,Randia brenesii,1575313,GBIF,,Manuel Vargas,,8.825,-83.195833,"Rio Piedras Blancas, 2 Km al Norte, alrededores de Cerro Anguciana.",1993.0,1,1,1,,WGS84,2020,Reinaldo Aguilar
23223,PRESERVED_SPECIMEN,Randia brenesii,1574000,GBIF,,Manuel Vargas,,8.7,-83.51666800000001,Aguabuena Oeste.,1993.0,1,1,1,,WGS84,2020,Reinaldo Aguilar
23448,PRESERVED_SPECIMEN,Randia brenesii,1566143,GBIF,,Manuel Vargas,,10.202778,-84.602778,"Los Angeles, Colonia Palmarena, cuenca media de Rio San Lorenzo, camino a la mina de Los Perdidos.",1991.0,1,1,1,,WGS84,2020,Gerardo Herrera
23481,PRESERVED_SPECIMEN,Randia brenesii,1565172,GBIF,,Manuel Vargas,,10.266667,-84.783333,"Monteverde, San Luis Valley, Finca El Buen Amigo. 4 km SSE of Monteverde.",1991.0,1,1,1,,WGS84,2020,Erick Bello
23712,PRESERVED_SPECIMEN,Randia brenesii,1554444,GBIF,,Manuel Vargas,,8.675,-83.522222,Quebrada Banegas. Aguabuena.,1991.0,1,1,1,,WGS84,2020,Reinaldo Aguilar
23713,PRESERVED_SPECIMEN,Randia brenesii,1554446,GBIF,,Manuel Vargas,,10.383333,-84.7,"Valley of Rio Agua Gata. Atlantic slope, Road from Lagarto at Inter-American",1991.0,1,1,1,,WGS84,2020,William Haber
23716,PRESERVED_SPECIMEN,Randia brenesii,1554441,GBIF,,Manuel Vargas,,8.690278,-83.583333,Bosque de Grupo Conservacion. Fila al Oeste de Rancho Quemado.,1991.0,1,1,1,,WGS84,2020,Juan Marin
23718,PRESERVED_SPECIMEN,Randia brenesii,1554445,GBIF,,Manuel Vargas,,8.7,-83.55,"Rancho Quemado, ca. 15 km W of Rincon; in bottom of valley along Rio Riyito near bridge and in forest along road on ridge above valley.",1988.0,1,1,1,,WGS84,2020,Barry Hammel
24120,PRESERVED_SPECIMEN,Randia brenesii,1522947,GBIF,,Manuel Vargas,,10.215278,-84.588889,Sendero el Poligono.,1996.0,1,1,1,,WGS84,2020,Alexánder Francisco Rodríguez González
24125,PRESERVED_SPECIMEN,Randia brenesii,1522948,GBIF,,Manuel Vargas,,10.215278,-84.588889,Sendero el Poligono.,1996.0,1,1,1,,WGS84,2020,Alexánder Francisco Rodríguez González
24126,PRESERVED_SPECIMEN,Randia brenesii,1522945,GBIF,,Manuel Vargas,,10.215278,-84.588889,Sendero el Poligono.,1996.0,1,1,1,,WGS84,2020,Alexánder Francisco Rodríguez González
24127,PRESERVED_SPECIMEN,Randia brenesii,1522946,GBIF,,Manuel Vargas,,10.215278,-84.588889,Sendero el Poligono.,1996.0,1,1,1,,WGS84,2020,Alexánder Francisco Rodríguez González
24269,PRESERVED_SPECIMEN,Randia brenesii,V0070738F,GBIF,15048,Manuel Vargas,,10.0114,-83.9519,,1932.0,1,1,1,,WGS84,2020,A. M. Brenes
24288,PRESERVED_SPECIMEN,Randia brenesii,,GBIF,1323,Manuel Vargas,,10.5,-84.5,,1977.0,1,1,1,,WGS84,2020,V. J. Dryer
24302,PRESERVED_SPECIMEN,Randia brenesii,,GBIF,1325,Manuel Vargas,,9.1667,-80.0,,1999.0,1,1,1,,WGS84,2020,S. Aguilar
24783,PRESERVED_SPECIMEN,Randia brenesii,,GBIF,14529,Manuel Vargas,,8.8333,-82.1667,,1993.0,1,1,1,,WGS84,2020,R. B. Foster
24836,PRESERVED_SPECIMEN,Randia brenesii,,GBIF,4059,Manuel Vargas,,10.0,-84.8333,,1984.0,1,1,1,,WGS84,2020,M. H. Grayum
24930,PRESERVED_SPECIMEN,Randia brenesii,V0292406F,GBIF,,Manuel Vargas,,3.8811,-72.8667,,,1,1,1,,WGS84,2020,
25134,PRESERVED_SPECIMEN,Randia brenesii,V0292405F,GBIF,,Manuel Vargas,,3.8811,-72.8667,,,1,1,1,,WGS84,2020,
27308,PRESERVED_SPECIMEN,Randia brenesii,234890,GBIF,,Manuel Vargas,,9.98,-83.39,P. N. Barbilla Sendero Las Pitas. Quebrada El Dulce.,2000.0,1,1,1,,WGS84,2020,"Mora, Edgar"
27317,PRESERVED_SPECIMEN,Randia brenesii,208033,GBIF,,Manuel Vargas,,10.64,-83.73,R.V.S. Barra del Colorado Llanura de Tortuguero. Sardinas.,1995.0,1,1,1,,WGS84,2020,"Araya, Flor"
27319,PRESERVED_SPECIMEN,Randia brenesii,203514,GBIF,,Manuel Vargas,,10.0,-83.48,Las Brisas de Pacuarito. Sector entre el camino principal y la margen izquierda de la quebrada azul.,1995.0,1,1,1,,WGS84,2020,"Herrera, Gerardo"
27320,PRESERVED_SPECIMEN,Randia brenesii,202513,GBIF,,Manuel Vargas,,8.82,-83.19,"Fila Costeña. Rìo Piedras Blancas. 2 km al Norte, alrededores de Cerro Anguciana.",1993.0,1,1,1,,WGS84,2020,"Aguilar, Reinaldo"
27322,PRESERVED_SPECIMEN,Randia brenesii,196975,GBIF,,Manuel Vargas,,10.26,-84.68,Arancibia. Corazòn de Jesùs. Cabecera de quebrada Vueltas.,1996.0,1,1,1,,WGS84,2020,"Herrera, Gerardo"
27325,PRESERVED_SPECIMEN,Randia brenesii,183487,GBIF,,Manuel Vargas,,8.7,-83.51,R. F. Golfo Dulce Penìnsula de Osa. Aguabuena Oeste.,1993.0,1,1,1,,WGS84,2020,"Aguilar, Reinaldo"
27327,PRESERVED_SPECIMEN,Randia brenesii,177249,GBIF,,Manuel Vargas,,8.7,-83.5,"Osa Penìnsula. Aguabuena, 3 km W of Rincòn. One-hectare permanent sample plot 800 m N of the house of Henry Monge in well drained, moeately sloping terrain. Tall forest along timber road, left after selective logging March 1992. Characteristic species:",1993.0,1,1,1,,WGS84,2020,"Thomsen, Karsten"
27328,PRESERVED_SPECIMEN,Randia brenesii,175156,GBIF,,Manuel Vargas,,8.71,-83.51,"Osa Penìnsula. Aguabuena, 3.5 km W of Rincòn. Along trail leading north from the house of Don Quecho, W of Boscosa station. Tall undisturbed forest in elevated, welldrained terrain.",1993.0,1,1,1,,WGS84,2020,"Thomsen, Karsten"
27329,PRESERVED_SPECIMEN,Randia brenesii,172938,GBIF,,Manuel Vargas,,10.33,-84.07,"P.N. Braulio Carrillo Puesto El Ceibo. Gently sloping area just above the steep rim of the Rìo Peje gorge on the west side.Along side path that goes from guard house to water supply intake, about 15 minutes uphill. Primary premontane wet forest. Transect",,1,1,1,,WGS84,2020,"Boyle, Brad"
27330,PRESERVED_SPECIMEN,Randia brenesii,170286,GBIF,,Manuel Vargas,,8.67,-83.52,R. F. Golfo Dulce Rincòn de Osa. Quebrada Bangas.,1991.0,1,1,1,,WGS84,2020,"Aguilar, Reinaldo"
27331,PRESERVED_SPECIMEN,Randia brenesii,170279,GBIF,,Manuel Vargas,,10.38,-84.7,"Bosque Eterno de los Niños. Rìo Peñas Blancas, quebrada Gata, Los Pèrez.",1990.0,1,1,1,,WGS84,2020,"Bello, Erick"
27332,PRESERVED_SPECIMEN,Randia brenesii,169675,GBIF,,Manuel Vargas,,10.7,-85.04,El Retiro. Àrea que circunda la Laguna.,1993.0,1,1,1,,WGS84,2020,"Herrera, Gerardo"
27333,PRESERVED_SPECIMEN,Randia brenesii,169635,GBIF,,Manuel Vargas,,10.44,-84.69,"Finca El Jilguero. Cumbre de Volcàn Chato, bajando por el sector de las Chorreras.",1992.0,1,1,1,,WGS84,2020,"Herrera, Gerardo"
27336,PRESERVED_SPECIMEN,Randia brenesii,165992,GBIF,,Manuel Vargas,,10.38,-84.7,"Bosque Eterno de los Niños. Valley of Agua Gata.Atlantic slope, 13 km NE of Monteverde.",1991.0,1,1,1,,WGS84,2020,"Haber, William"
27337,PRESERVED_SPECIMEN,Randia brenesii,165255,GBIF,,Manuel Vargas,,8.69,-83.58,Bosque de Grupo de Conservaciòn. Fila al Oeste de Rancho Quemado.,1991.0,1,1,1,,WGS84,2020,"Marín, Juan"
