,BasisOfRec,Binomial,CatalogNo,Citation,CollectID,Compiler,Data_sens,Dec_Lat,Dec_Long,Dist_comm,Event_Year,Origin,Presence,Seasonal,Sens_comm,SpatialRef,YrCompiled,recordedBy
27150,PRESERVED_SPECIMEN,Rudgea raveniana,171710,GBIF,,Manuel Vargas,,8.7,-83.56,Camino a la toma de agua. Rancho Quemado. Rincón. Bosque primario.,,1,1,1,,WGS84,2020,"Quesada, Javier Francisco"
27151,PRESERVED_SPECIMEN,Rudgea raveniana,171708,GBIF,,Manuel Vargas,,8.7,-83.56,Camino a la toma de agua. Rancho Quemado. Rincón. Bosque primario.,,1,1,1,,WGS84,2020,"Quesada, Javier Francisco"
27154,PRESERVED_SPECIMEN,Rudgea raveniana,167357,GBIF,,Manuel Vargas,,8.73,-83.61,Boca  Ganado. En Fila  Ganado.,1993.0,1,1,1,,WGS84,2020,"Vargas, Gustavo"
27155,PRESERVED_SPECIMEN,Rudgea raveniana,167356,GBIF,,Manuel Vargas,,8.73,-83.61,Boca de Ganado. En Fila Ganado.,1993.0,1,1,1,,WGS84,2020,"Vargas, Gustavo"
27156,PRESERVED_SPECIMEN,Rudgea raveniana,166103,GBIF,,Manuel Vargas,,8.69,-83.6,"Rancho quemado, Fila División, entre Rancho Quemado y junta de quebrada.",1991.0,1,1,1,,WGS84,2020,"Marín, Juan"
27157,PRESERVED_SPECIMEN,Rudgea raveniana,165194,GBIF,,Manuel Vargas,,8.71,-83.6,R.F. Golfo Dulce Camino nuevo entre Rancho Quemado y Drake. Bosque primario. Coordenadas aproximadas.,1991.0,1,1,1,,WGS84,2020,"Hammel, Barry E."
27159,PRESERVED_SPECIMEN,Rudgea raveniana,163853,GBIF,,Manuel Vargas,,8.7,-83.52,R.F. Golfo Dulce Aguabuena. Sector oeste.,1991.0,1,1,1,,WGS84,2020,"Aguilar, Reinaldo"
27160,PRESERVED_SPECIMEN,Rudgea raveniana,163418,GBIF,,Manuel Vargas,,8.57,-83.57,Fila Estero Guerra.,1991.0,1,1,1,,WGS84,2020,"Marín, Juan"
27162,PRESERVED_SPECIMEN,Rudgea raveniana,163071,GBIF,,Manuel Vargas,,8.7,-83.51,"Moist forest in valley-bottoms, forest with open under story on steep slopes and ridges, and ares of secondary vegetation N and W of the air field. W of Rincón.",1970.0,1,1,1,,WGS84,2020,"Burger, William"
27163,PRESERVED_SPECIMEN,Rudgea raveniana,162860,GBIF,,Manuel Vargas,,9.48,-84.05,"Hilly slopes above the río Naranjo, near Londres and Villa Nueva. Evergreen rainforest formations on the seasonally dry. Pacific slope.",1988.0,1,1,1,,WGS84,2020,"Burger, William"
27164,PRESERVED_SPECIMEN,Rudgea raveniana,159389,GBIF,,Manuel Vargas,,8.45,-83.55,P.N. Corcovado El Tigre/Cerro Mueller.,1988.0,1,1,1,,WGS84,2020,"Kernan, C."
27169,PRESERVED_SPECIMEN,Rudgea raveniana,143081,GBIF,,Manuel Vargas,,8.7,-83.51,"Moist forest in valley bottoms, forest with open understory  on steep slopes and ridges, and areas of secondary vegetation north and west of the air field at 50-200 m, altitude,about 5 km  west of Rincón de Osa. Osa Península.",1970.0,1,1,1,,WGS84,2020,"Burger, William"
27178,PRESERVED_SPECIMEN,Rudgea raveniana,126253,GBIF,,Manuel Vargas,,9.48,-84.05,"Faldas del Cerro Nara, ca Esquipulas, límite Quepos (Puntarenas) y Tarrazú.",1987.0,1,1,1,,WGS84,2020,"Gómez Laurito, Jorge"
27179,PRESERVED_SPECIMEN,Rudgea raveniana,123832,GBIF,,Manuel Vargas,,8.65,-83.53,"Osa Península, in forest  wet of Rincón; ca. 9 k m west of Rincón  on road to Rancho Quemado.",1986.0,1,1,1,,WGS84,2020,"Hammel, Barry E."
27180,PRESERVED_SPECIMEN,Rudgea raveniana,119670,GBIF,,Manuel Vargas,,8.68,-83.54,"Along road between Rincon de Osa and Rancho Quemado, ca.  10 km W of main Rincón-Puerto Jimenez Road.",1985.0,1,1,1,,WGS84,2020,"Croat, Thomas B."
29101,UNKNOWN,Rudgea raveniana,100080668,GBIF,,Manuel Vargas,,8.68333,-83.2167,"La Gamba, near km 37",1994.0,1,1,1,,WGS84,2020,"Huber Werner, Weissenhofer Anton"
29102,UNKNOWN,Rudgea raveniana,100080665,GBIF,,Manuel Vargas,,8.68333,-83.2167,"""Bosque de los Austriacos"" on the way of the Fila Quebrada Negra",1997.0,1,1,1,,WGS84,2020,"Huber Werner, Weissenhofer Anton"
