,BasisOfRec,Binomial,CatalogNo,Citation,CollectID,Compiler,Data_sens,Dec_Lat,Dec_Long,Dist_comm,Event_Year,Origin,Presence,Seasonal,Sens_comm,SpatialRef,YrCompiled,recordedBy
137,HUMAN_OBSERVATION,Symplocos serrulata,54900392,GBIF,,Manuel Vargas,,6.217442,-75.497522,,2020.0,1,1,1,,WGS84,2020,Genesis
2057,PRESERVED_SPECIMEN,Symplocos serrulata,U.1746383,GBIF,"Stevens, WD; Krukoff, BA  5990 ",Manuel Vargas,,13.033333,-85.916667,Departmento de Jinotega: ca. 1.5 km from Hwy 3 on road to Aranjuez.,1978.0,1,1,1,,WGS84,2020,Stevens WD; Krukoff BA
2307,PRESERVED_SPECIMEN,Symplocos serrulata,101155596,GBIF,González Brenes 6294,Manuel Vargas,,9.62312,-83.862319,"Copey, RB Las Vueltas. Orillas de camino y bordes de bosque (paramo-robledal).",2017.0,1,1,1,,WGS84,2020,Frank González|T. Alfaro
2599,PRESERVED_SPECIMEN,Symplocos serrulata,ASU0050520,GBIF,8946,Manuel Vargas,,8.66667,-81.75,"Prov. Chiriqui-Bocas del Toro boundary, Cerro Colorado area.",1989.0,1,1,1,,WGS84,2020,"G. de Nevers; Frank Almeda, Gordon McPherson"
3136,PRESERVED_SPECIMEN,Symplocos serrulata,2108624,GBIF,20325,Manuel Vargas,,2.67,-76.57,"Cordillera Central. Finca El Salado, Río Machete near its confluence with Río Piendamo, 25 km. n. of Popayán, Dept. del Cauca.",1943.0,1,1,1,,WGS84,2020,F. R. Fosberg
3581,PRESERVED_SPECIMEN,Symplocos serrulata,UTEP:Herb:37996,GBIF,9344,Manuel Vargas,,8.833333,-82.583333,"near Bajo Grande, on road from Cerro Pinta Village to Boquete",1986.0,1,1,1,,WGS84,2020,Collector(s): Gordon D. McPherson
3624,PRESERVED_SPECIMEN,Symplocos serrulata,MA-01-00762842,GBIF,3280,Manuel Vargas,,10.1742,-84.1694,"Alajuela: Alajuela. No protegida. Cuenca del Sarapiquí. Posada Volcán Poás, Viento fresco, Vara Blanca",2003.0,1,1,1,,WGS84,2020,R. Kriebel & D. Solano
3629,PRESERVED_SPECIMEN,Symplocos serrulata,MA-01-00761093,GBIF,2235,Manuel Vargas,,9.0247,-82.9525,Puntarenas: Coto Brus. Z.P. Las Tablas. Cuenca Térraba-Sierpe. Colectada alrededor de la estación,2000.0,1,1,1,,WGS84,2020,L. Acosta & V. Ramírez
3673,PRESERVED_SPECIMEN,Symplocos serrulata,MA-01-00735065,GBIF,2235,Manuel Vargas,,9.0247,-82.9525,"Puntarenas: Coto Brus. Z.P. Las Tablas. Cuenca Térraba-Sierpe, alrededor de la estación",2000.0,1,1,1,,WGS84,2020,L. Acosta & al.
3736,PRESERVED_SPECIMEN,Symplocos serrulata,563771,GBIF,495,Manuel Vargas,,6.089167,-73.123889,Reserva Biológica Cachalú.,2008.0,1,1,1,,WGS84,2020,A. Ávila | S. Angel | M. Reina | R. Cortes
3742,PRESERVED_SPECIMEN,Symplocos serrulata,597369,GBIF,29092,Manuel Vargas,,9.2,-82.983333,"Cordillera de Talamanca, Atlantic slope, north slope of the unnamed cordillera between the Río Terbi and the Río Siní",1984.0,1,1,1,,WGS84,2020,"Davidse, G.; Herrera Ch., G."
3743,PRESERVED_SPECIMEN,Symplocos serrulata,597366,GBIF,25750,Manuel Vargas,,9.179167,-83.05833299999999,"Cordillera de Talamanca, headwaters of the unnamed western branch of the Río Teribe, between the Río Sini and the intercontinental divide at Cerro Bekom",1984.0,1,1,1,,WGS84,2020,"Davidse, G.; Herrera Ch., G.; Warner, R. H."
3744,PRESERVED_SPECIMEN,Symplocos serrulata,597362,GBIF,8335,Manuel Vargas,,8.816667,-82.4,Prov. Chiriquí:  Along trail to Cerro Pate Macho1850,1986.0,1,1,1,,WGS84,2020,"Richardson, Mick; Merello, M."
3745,PRESERVED_SPECIMEN,Symplocos serrulata,597363,GBIF,15943,Manuel Vargas,,8.9,-82.583333,"NW of Cerro Punta, at INRENARE station in Parque Amistad; trail below station",1992.0,1,1,1,,WGS84,2020,"McPherson, Gordon; Richardson, Mick"
3747,PRESERVED_SPECIMEN,Symplocos serrulata,597373,GBIF,24729,Manuel Vargas,,9.566667,-83.666667,"PROV. SAN JOSE-CARTAGO.  Cordillera de Talamanca, upper slopes, western ridge of Cerros Cuericí",1983.0,1,1,1,,WGS84,2020,"Davidse, Gerrit"
3748,PRESERVED_SPECIMEN,Symplocos serrulata,597374,GBIF,24729,Manuel Vargas,,9.566667,-83.666667,"PROV. SAN JOSE-CARTAGO.  Cordillera de Talamanca, upper slopes, western ridge of Cerros Cuericí",1983.0,1,1,1,,WGS84,2020,"Davidse, Gerrit"
3749,PRESERVED_SPECIMEN,Symplocos serrulata,597367,GBIF,25745,Manuel Vargas,,9.179167,-83.05833299999999,"Cordillera de Talamanca, headwaters of the unnamed western branch of the Río Teribe, between the Río Sini and the intercontinental divide at Cerro Bekom",1984.0,1,1,1,,WGS84,2020,"Davidse, G.; Herrera Ch., G.; Warner, R. H."
3750,PRESERVED_SPECIMEN,Symplocos serrulata,597368,GBIF,28623,Manuel Vargas,,9.133333,-82.966667,"Cordillera de Talamanca, Atlantic slope, Valle de Silencio, area just N of Cerro Hoffman, 4 1/2 airline km W of the Costa Rica-Panamanian border",1984.0,1,1,1,,WGS84,2020,"Davidse, G.; Herrera Ch., G.; Grayum, M. H."
3751,PRESERVED_SPECIMEN,Symplocos serrulata,597358,GBIF,8946,Manuel Vargas,,8.666667,-81.75,"Prov. Chiriqui-Bocas del Toro boundary, Cerro Colorado area",1989.0,1,1,1,,WGS84,2020,"De Nevers, G.; Almeda, Frank; McPherson, Gordon"
3752,PRESERVED_SPECIMEN,Symplocos serrulata,597365,GBIF,25194,Manuel Vargas,,9.083333,-82.841667,"Cordillera de Talamanca, headwaters of the Río Culubre, 6 airline km NW of the peak of Cerro Echandi on the Costa Rican-Panamanian international border",1984.0,1,1,1,,WGS84,2020,"Davidse, G.; Gómez, L. D.; Herrera C., G.; Chacón, R.; Chacón, I.; Chacón, A."
3753,PRESERVED_SPECIMEN,Symplocos serrulata,597361,GBIF,11345,Manuel Vargas,,8.833333,-82.5,"Prov. Chiriquí:  On path up northern slopeof Volcan Baru, starting along impassable road fomerly linking Boquete and Cerro Punta",1987.0,1,1,1,,WGS84,2020,"McPherson, Gordon"
3754,PRESERVED_SPECIMEN,Symplocos serrulata,597371,GBIF,25,Manuel Vargas,,10.133333,-84.119444,Parque Nac. Braulio Carrillo Estación Barva,1990.0,1,1,1,,WGS84,2020,"Fernández, Alvaro"
3755,PRESERVED_SPECIMEN,Symplocos serrulata,597359,GBIF,1295,Manuel Vargas,,8.833333,-82.5,Prov. de CHIRIQUI.  Volcán Baru east slope on road from Boquete. 9 km W of Boquete (air distance),1983.0,1,1,1,,WGS84,2020,"Stein, Bruce A."
3756,PRESERVED_SPECIMEN,Symplocos serrulata,597360,GBIF,9344,Manuel Vargas,,8.833333,-82.583333,"Prov. Chiriquí:  Along road from Cerro Punta village towards Boquete, near place called Bajo Grande",1986.0,1,1,1,,WGS84,2020,"McPherson, Gordon"
3757,PRESERVED_SPECIMEN,Symplocos serrulata,597049,GBIF,797,Manuel Vargas,,10.129167,-84.12083299999999,"Parque Nal. Braulio Carrillo Upper Volcán Barva, Pacific slope, near divide.  At edge of main trail from guard house to Laguna Barva",1992.0,1,1,1,,WGS84,2020,"Boyle, Brad"
3758,PRESERVED_SPECIMEN,Symplocos serrulata,597050,GBIF,43,Manuel Vargas,,10.122222,-84.1,Parque Nal. Braulio Carrillo Volcán Barva,1989.0,1,1,1,,WGS84,2020,"Rivera, Gerardo"
3760,PRESERVED_SPECIMEN,Symplocos serrulata,597048,GBIF,805,Manuel Vargas,,10.138333,-84.109167,"Parque Nal. Braulio Carrillo Upper Volcán Barva, Atlantic Slope.  Ca. 0.5 km below (to N of) main trail to Lag. Barva, descending via old ""Sendero del Transecto"" then traversing 250 m directly east.  Treeplot 2750-3",1992.0,1,1,1,,WGS84,2020,"Boyle, Brad"
4134,PRESERVED_SPECIMEN,Symplocos serrulata,350746,GBIF,1560,Manuel Vargas,,4.915252,-74.29026,"San Francisco, Vrda. Sabaneta. Alt. 2550 m.",,1,1,1,,WGS84,2020,Herbario Nacional Colombiano
5644,PRESERVED_SPECIMEN,Symplocos serrulata,284719,GBIF,4240,Manuel Vargas,,2.16,-76.181667,Arriba de finca Palmira.,1984.0,1,1,1,,WGS84,2020,G. Lozano C
5911,PRESERVED_SPECIMEN,Symplocos serrulata,V0361735F,GBIF,,Manuel Vargas,,3.8811,-72.8667,,,1,1,1,,WGS84,2020,A. J. A. Bonpland
5959,PRESERVED_SPECIMEN,Symplocos serrulata,FMB-80210,GBIF,VMR 153,Manuel Vargas,,2.213083,-75.947417,"Vereda El Progreso, finca Palmira, antigua finca San Pedro, límites con la finca La Floresta",2005.0,1,1,1,,WGS84,2020,"Rico, Viviana | Silva, Gustavo"
5964,PRESERVED_SPECIMEN,Symplocos serrulata,FMB-76009,GBIF,2533,Manuel Vargas,,5.158056,-76.016667,Apia,2004.0,1,1,1,,WGS84,2020,"Prieto, Adriana | Robles, Aura | Ríos, C. | Londoño, D. | Arroyabe, N. | Gómez, M."
5975,PRESERVED_SPECIMEN,Symplocos serrulata,FMB-63165,GBIF,JM 1625,Manuel Vargas,,4.705278,-75.64416700000001,"Vereda Cruces, finca El Paraíso",2002.0,1,1,1,,WGS84,2020,"Mendoza, J. | Leonardo, F."
6085,PRESERVED_SPECIMEN,Symplocos serrulata,V0437516F,GBIF,425,Manuel Vargas,,3.8811,-72.8667,,,1,1,1,,WGS84,2020,B. T. Lehmann
6086,PRESERVED_SPECIMEN,Symplocos serrulata,V0437513F,GBIF,18244,Manuel Vargas,,3.8811,-72.8667,,1944.0,1,1,1,,WGS84,2020,J. Cuatrecasas
6087,PRESERVED_SPECIMEN,Symplocos serrulata,V0437514F,GBIF,8527,Manuel Vargas,,3.8811,-72.8667,,,1,1,1,,WGS84,2020,F. C. Lehmann
6088,PRESERVED_SPECIMEN,Symplocos serrulata,V0437512F,GBIF,18244,Manuel Vargas,,3.8811,-72.8667,,1944.0,1,1,1,,WGS84,2020,J. Cuatrecasas
6089,PRESERVED_SPECIMEN,Symplocos serrulata,V0437515F,GBIF,6631,Manuel Vargas,,3.8811,-72.8667,,,1,1,1,,WGS84,2020,F. C. Lehmann
6090,PRESERVED_SPECIMEN,Symplocos serrulata,V0437511F,GBIF,8660,Manuel Vargas,,3.8811,-72.8667,,1940.0,1,1,1,,WGS84,2020,J. Cuatrecasas
6798,PRESERVED_SPECIMEN,Symplocos serrulata,UDBC034149,GBIF,390,Manuel Vargas,,5.080444,-74.548778,"""Vereda Chipautá, Sector Madrid. Recreo San Miguel""",2014.0,1,1,1,,WGS84,2020,"""Varón, J. | Suárez, S. | Don Joselin"""
6799,PRESERVED_SPECIMEN,Symplocos serrulata,UDBC034154,GBIF,390,Manuel Vargas,,5.080444,-74.548778,"""Vereda Chipautá, Sector Madrid. Recreo San Miguel""",2014.0,1,1,1,,WGS84,2020,"""Varón, J. | Suárez, S. | Don Joselin"""
6811,PRESERVED_SPECIMEN,Symplocos serrulata,7529,GBIF,,Manuel Vargas,,7.381419999999999,-72.940149,,2013.0,1,1,1,,WGS84,2020,T. Hinestroza | otros
7346,PRESERVED_SPECIMEN,Symplocos serrulata,983091,GBIF,González Ramírez 618,Manuel Vargas,,9.52,-83.59,"Parque Nacional Chirripó, Cordillera de Talamanca, Finca San Carlos, entre la cabeceras de las quebradas Blanco y Barranca",1995.0,1,1,1,,WGS84,2020,José Á. González R.
7403,PRESERVED_SPECIMEN,Symplocos serrulata,957095,GBIF,Gómez Pignataro 22658,Manuel Vargas,,9.102778,-82.8775,"Approx. 2 km SW of Itamut camp, Fábrega.",1984.0,1,1,1,,WGS84,2020,Luis Diego Gómez P.|Isidro A. Chacón G.|Gerrit Davidse|Gerardo Herrera Ch.
7555,PRESERVED_SPECIMEN,Symplocos serrulata,905195,GBIF,Herrera Chacón 5944,Manuel Vargas,,9.35,-83.22,P.N. Cordillera de Talamanca; Cordillera de Talamanca. 300 m antes de unión Quebrada Kuisa con R. Lori. Entre Ujarrás-San José Cabécar.,1993.0,1,1,1,,WGS84,2020,Gerardo Herrera Ch.
7558,PRESERVED_SPECIMEN,Symplocos serrulata,905119,GBIF,Ramírez Villalobos 136,Manuel Vargas,,9.84,-84.12,Z.P. Cerros de Escazú; Cerros Escazú-La Carpintera. Cedral y Alto Hierbabuena.,1993.0,1,1,1,,WGS84,2020,Víctor H. Ramírez|J. F. Morales
7901,PRESERVED_SPECIMEN,Symplocos serrulata,891308,GBIF,Boyle 3196,Manuel Vargas,,10.176389,-84.111111,"Parque Nacional Braulio Carrillo, Cordillera Central, Sendero del Transecto, on ridge between second and third creek crossing below refugio at 2070 m.",1992.0,1,1,1,,WGS84,2020,Brad Boyle|Peter Hibbs
8034,PRESERVED_SPECIMEN,Symplocos serrulata,788888,GBIF,Cogollo Pacheco 7271,Manuel Vargas,,6.533333,-76.31666700000001,"Vereda Calles.  Parque Nacional Natural ""Las Orquídeas"".  Margen derecha del Río Calles, en el filo NW de la Cabaña de Calles.  bp-PM. Parcela G, Subparcela G-24. Colectado con A. Duque, F. Giraldo, W. Rodriguez & E. Alvarez",1993.0,1,1,1,,WGS84,2020,Álvaro Cogollo P.|et al.
9635,PRESERVED_SPECIMEN,Symplocos serrulata,411986,GBIF,Morales Quirós 84,Manuel Vargas,,9.84,-84.14,Z. P. Cerros de Escazú. Cedral. Cerro Rabo de Mico. Bosque secundario.,1991.0,1,1,1,,WGS84,2020,J. F. Morales
9638,PRESERVED_SPECIMEN,Symplocos serrulata,411955,GBIF,Morales Quirós 156,Manuel Vargas,,9.84,-84.14,Z. P. Cerros de Escazú. Cedral. Bosque primario y secundario en la falda norte del cerro Rabo de Mico. Cuenca del río Poás.,1991.0,1,1,1,,WGS84,2020,J. F. Morales
9640,PRESERVED_SPECIMEN,Symplocos serrulata,411914,GBIF,McPherson 8335,Manuel Vargas,,8.81666,-82.4,"Along trail to Cerro Pate Macho, c. 8º49'N, 82º24'W. Forest slope 1850 m.",1986.0,1,1,1,,WGS84,2020,Gordon McPherson|Mary Merello
9642,PRESERVED_SPECIMEN,Symplocos serrulata,411904,GBIF,McPherson 15943,Manuel Vargas,,8.9,-82.583333,"NW of Cerro Punta, at INRENARE station in Parque Amistad; trail below station; forested slopes; collected with Mick Richardson.",1992.0,1,1,1,,WGS84,2020,Gordon McPherson
9644,PRESERVED_SPECIMEN,Symplocos serrulata,411903,GBIF,McPherson 13423,Manuel Vargas,,6.6666669999999995,-76.333333,"Region of Murrí, ca. 13 road-km from Nutibara; forest edge NW of road; collected with F.J. Roldán and I. Castaño.",1988.0,1,1,1,,WGS84,2020,Gordon McPherson
9645,PRESERVED_SPECIMEN,Symplocos serrulata,411894,GBIF,McPherson 11345,Manuel Vargas,,8.83333,-82.5,"On path up northern slope of Volcan Baru, starting along impassable road formerly linking Boquete and Cerro Punta.",1987.0,1,1,1,,WGS84,2020,Gordon McPherson
9646,PRESERVED_SPECIMEN,Symplocos serrulata,411865,GBIF,Hernández Esquivel 9036,Manuel Vargas,,9.558333,-83.711111,Villa Mills,1990.0,1,1,1,,WGS84,2020,Daniel Hernández
9647,PRESERVED_SPECIMEN,Symplocos serrulata,411885,GBIF,Haber 3036,Manuel Vargas,,10.333333,-84.833333,"Monteverde, Upper Rio Negro valley 10º20'N, 84º50'W",1985.0,1,1,1,,WGS84,2020,William A. Haber|Erick Bello C.
9648,PRESERVED_SPECIMEN,Symplocos serrulata,411824,GBIF,Fernández Zúñiga 25,Manuel Vargas,,10.13,-84.11,Parque Nac. Braulio Carrillo Estación Barva.,1990.0,1,1,1,,WGS84,2020,Álvaro Fernández
9650,PRESERVED_SPECIMEN,Symplocos serrulata,411764,GBIF,McPherson 9344,Manuel Vargas,,8.83333,-82.58333,"Along road from Cerro Punta village towards Boquete, near place called Bajo Grande, c. 8º50'N, 82º35'W. Forest c. 2100 m.",1986.0,1,1,1,,WGS84,2020,Gordon McPherson
9651,PRESERVED_SPECIMEN,Symplocos serrulata,411741,GBIF,Boyle 805,Manuel Vargas,,10.13833,-84.10916,"Parque Nacional Braulio Carrillo, upper Volcán Barva, Atlantic slope, ca. 0.5 km below (to north of) main trail to Laguna Barva, descending vía old ""Sendero del Transecto"" then traversing 250 m directly east, Treeplot 2750-3",1992.0,1,1,1,,WGS84,2020,Brad Boyle
9652,PRESERVED_SPECIMEN,Symplocos serrulata,411730,GBIF,Boyle 797,Manuel Vargas,,10.12916,-84.12083,"Parque Nacional Braulio Carrillo, upper Volcán Barva, Pacific slope, near divide, at edge of main trail from guard house to Laguna Barva",1992.0,1,1,1,,WGS84,2020,Brad Boyle
9654,PRESERVED_SPECIMEN,Symplocos serrulata,411718,GBIF,Cogollo Pacheco 7201,Manuel Vargas,,6.533333,-76.31666700000001,"Vereda Calles.  Parque Nacional Natural ""Las Orquídeas"".  Margen derecha del Río Calles, en el filo NW de la Cabaña de Calles.  bp-PM. Parcela G, subparcela G-22. Colectado con A. Duque, F. Giraldo, W. Rodriguez & J. Velez.",1993.0,1,1,1,,WGS84,2020,Álvaro Cogollo P.|et al.
9655,PRESERVED_SPECIMEN,Symplocos serrulata,411703,GBIF,Varela Cordero 93,Manuel Vargas,,10.122778,-84.12083299999999,"Parque Nacional  Braulio Carrillo, Cordillera Central. Estación Barva.",1990.0,1,1,1,,WGS84,2020,Gerardo Varela
9656,PRESERVED_SPECIMEN,Symplocos serrulata,411729,GBIF,Boyle 1159,Manuel Vargas,,10.20833,-84.11583,"Finca Montreal, off trail just east of Río San Fernando, immediately adjacent to Parque Nacional Braulio Carrillo, Primary Montane Wet Forest",1992.0,1,1,1,,WGS84,2020,Brad Boyle|Alice Boyle|H. Nelson
9661,PRESERVED_SPECIMEN,Symplocos serrulata,411598,GBIF,Churchill 5089,Manuel Vargas,,8.78333,-82.53333,"Volcán Barú. Dirt road going up E slope. Alt. 2500-3000 m. 8º47'N, 82º32'W.",1984.0,1,1,1,,WGS84,2020,H. W. Churchill|Job Kuijt
9662,PRESERVED_SPECIMEN,Symplocos serrulata,411581,GBIF,Davidse 29092,Manuel Vargas,,9.2,-82.98333000000001,"Cordillera de Talamanca, Atlantic slope, north slope of the unnamed cordillera between the Río Terbi and the Río Siní",1984.0,1,1,1,,WGS84,2020,Gerrit Davidse|Gerardo Herrera Ch.
9663,PRESERVED_SPECIMEN,Symplocos serrulata,411611,GBIF,Rivera Elizondo 43,Manuel Vargas,,10.122222,-84.1,"Parque Nac. Braulio Carrillo, Volcán Barba.",1989.0,1,1,1,,WGS84,2020,Gerardo Rivera
9664,PRESERVED_SPECIMEN,Symplocos serrulata,411571,GBIF,Davidse 28623,Manuel Vargas,,9.133333,-82.966667,"Cordillera de Talamanca, Atlantic slope, Valle de Silencio, area just N of Cerro Hoffman, 4 1/2 airline km W of the Costa Rican-Panamanian border.",1984.0,1,1,1,,WGS84,2020,Gerrit Davidse|Gerardo Herrera Ch.|Michael H. Grayum
9666,PRESERVED_SPECIMEN,Symplocos serrulata,411522,GBIF,Davidse 25745,Manuel Vargas,,9.179167,-83.05833299999999,"Cordillera de Talamanca, head- waters of the unnamed western branch of the Río Teribe, between the Río Sini and the continental divide at Cerro Bekom.",1984.0,1,1,1,,WGS84,2020,Gerrit Davidse|Gerardo Herrera Ch.|Richard H. Warner
9668,PRESERVED_SPECIMEN,Symplocos serrulata,411532,GBIF,Davidse 25750,Manuel Vargas,,9.179167,-83.05833299999999,"Cordillera de Talamanca, head- waters of the unnamed western branch of the Río Teribe, between the Río Sini and the continental divide at Cerro Bekom.",1984.0,1,1,1,,WGS84,2020,Gerrit Davidse|Gerardo Herrera Ch.|Richard H. Warner
9669,PRESERVED_SPECIMEN,Symplocos serrulata,411494,GBIF,Davidse 24729,Manuel Vargas,,9.566667,-83.666667,"San José-Cartago, Cordillera de Talamanca, upper slopes, western ridge of Cerros Cuericí, trail along ridge.",1983.0,1,1,1,,WGS84,2020,Gerrit Davidse
9670,PRESERVED_SPECIMEN,Symplocos serrulata,411502,GBIF,Davidse 25194,Manuel Vargas,,9.083333,-82.841667,"Cordillera de Talamanca, headwaters of the Río Culubre, 6 airline km NW of the peak of Cerro Echandi on the Costa Rican-Panamanian international border.",1984.0,1,1,1,,WGS84,2020,Gerrit Davidse|Luis Diego Gómez P.|Gerardo Herrera Ch.|Rafael Chacón|Isidro A. Chacón G.|Abelardo Chacón
10538,PRESERVED_SPECIMEN,Symplocos serrulata,2993474,GBIF,Utley 2514A,Manuel Vargas,,9.84583,-84.12444,Cerro Daser (between 2220 m and peak-2318 m),1975.0,1,1,1,,WGS84,2020,John F. Utley|K. Burt-Utley
11117,PRESERVED_SPECIMEN,Symplocos serrulata,2783835,GBIF,Acosta Vargas 321,Manuel Vargas,,10.12,-84.11,"Parque Nacional Braulio Carrillo, Cuenca del Tárcoles, Volcán Barva, alrededores de la Estación",2000.0,1,1,1,,WGS84,2020,Luis Acosta|Víctor H. Ramírez
11573,PRESERVED_SPECIMEN,Symplocos serrulata,2400678,GBIF,Hartshorn 1761,Manuel Vargas,,10.125,-84.11555,"In pasture along road to Volcán Barba, 1.5 km north of Sacramento",1975.0,1,1,1,,WGS84,2020,Gary S. Hartshorn
13426,PRESERVED_SPECIMEN,Symplocos serrulata,195726,GBIF,Stein 1295,Manuel Vargas,,8.83333,-82.5,"Volcán Baru east slope on road from Boquete. 9 km W of Boquete (air distance). Oak woodland. Elev. 2400 m. 82º30'W, 8º50'N.",1983.0,1,1,1,,WGS84,2020,Bruce A. Stein
13427,PRESERVED_SPECIMEN,Symplocos serrulata,1956421,GBIF,Lao 346,Manuel Vargas,,8.85,-82.56666,Cerro Punta,1971.0,1,1,1,,WGS84,2020,E.A. Lao
13428,PRESERVED_SPECIMEN,Symplocos serrulata,1956355,GBIF,D'Arcy 13120,Manuel Vargas,,8.783333,-82.5,Ridgetop above Alto Boquete.,1979.0,1,1,1,,WGS84,2020,William G. D'Arcy|Barry E. Hammel|E.C. Hill|S. Schwartz|O. Wolcott|H. Wolcott
13429,PRESERVED_SPECIMEN,Symplocos serrulata,1956353,GBIF,Blum 2416,Manuel Vargas,,8.885,-82.58333,Cerro Punta,1966.0,1,1,1,,WGS84,2020,Kurt E. Blum|S. Olson|R. Rasmussen
13430,PRESERVED_SPECIMEN,Symplocos serrulata,1956484,GBIF,Poveda Álvarez 400,Manuel Vargas,,9.73,-83.95,"Al Empalme Intern, Sur",1972.0,1,1,1,,WGS84,2020,Luis J. Poveda Álvarez
13432,PRESERVED_SPECIMEN,Symplocos serrulata,1956001,GBIF,Chavarría Díaz 17,Manuel Vargas,,9.64333,-83.92027,La Cima de Copey de Santa Maria de Dota,1985.0,1,1,1,,WGS84,2020,María Marta Chavarría|Gerardo Herrera Ch.
13434,PRESERVED_SPECIMEN,Symplocos serrulata,1956000,GBIF,Brade 2018,Manuel Vargas,,9.983333,-83.85,Volcán Irazú; Westhang.,1908.0,1,1,1,,WGS84,2020,Alexander C. Brade
14257,PRESERVED_SPECIMEN,Symplocos serrulata,1573537,GBIF,Stork 2311,Manuel Vargas,,9.83,-84.01,La Chouta,1928.0,1,1,1,,WGS84,2020,Harvey E. Stork
14259,PRESERVED_SPECIMEN,Symplocos serrulata,1573545,GBIF,Alfaro Vindas 1363,Manuel Vargas,,9.0,-82.82,"Zona Protectora Las Tablas, Cuenca Térraba-Sierpe, Sendero a Cerro Echandi",1997.0,1,1,1,,WGS84,2020,Evelio Alfaro
14261,PRESERVED_SPECIMEN,Symplocos serrulata,1572800,GBIF,Stork 1587,Manuel Vargas,,9.64,-83.91,El Copey,1928.0,1,1,1,,WGS84,2020,Harvey E. Stork
14263,PRESERVED_SPECIMEN,Symplocos serrulata,1572791,GBIF,Fernández Zúñiga 25,Manuel Vargas,,10.13,-84.11,Parque Nac. Braulio Carrilo,1990.0,1,1,1,,WGS84,2020,Álvaro Fernández
14265,PRESERVED_SPECIMEN,Symplocos serrulata,1572777,GBIF,Quesada Quesada 1951,Manuel Vargas,,9.12,-82.96,"P.N. La Amistad. Tararia. Jardin, Valle del Silencio",1997.0,1,1,1,,WGS84,2020,F. J. Quesada
14307,PRESERVED_SPECIMEN,Symplocos serrulata,1540531,GBIF,de Nevers 8946,Manuel Vargas,,8.517222,-81.794167,"Prov. Chiriquí-Bocas del Toro boundary, Cerro Colorado area.  [Coordinates on original label: 08º40'N, 081º45'W]",1989.0,1,1,1,,WGS84,2020,Greg C. de Nevers|Frank Almeda|Gordon McPherson
14408,PRESERVED_SPECIMEN,Symplocos serrulata,1492197,GBIF,Hartshorn 1605,Manuel Vargas,,10.1,-84.12,"In pasture, along road to Volcán Barba, 1.5 km north of Sacramento",1974.0,1,1,1,,WGS84,2020,Gary S. Hartshorn
14411,PRESERVED_SPECIMEN,Symplocos serrulata,1492180,GBIF,Wilbur 10918,Manuel Vargas,,8.86,-82.566389,Edge of forested slope above Cerro Punta toward Bajo Grande in Quebrada Bajo Grande.,1970.0,1,1,1,,WGS84,2020,"Robert L. Wilbur|Richard E. Weaver, Jr.|Robin B. Foster|Mireya D. Correa A."
14412,PRESERVED_SPECIMEN,Symplocos serrulata,1492182,GBIF,Zamora Villalobos 1317,Manuel Vargas,,9.55,-83.72,"La Georgina, Cerro de la Muerte, Cord. de Talamanca",1987.0,1,1,1,,WGS84,2020,Nelson Zamora
14508,PRESERVED_SPECIMEN,Symplocos serrulata,1460696,GBIF,Bawa 390,Manuel Vargas,,10.1,-84.1,"Slopes of Volcán Barba, premontane evergreen forest",1970.0,1,1,1,,WGS84,2020,K. S. Bawa
15013,PRESERVED_SPECIMEN,Symplocos serrulata,1288053,GBIF,Cufodontis 361,Manuel Vargas,,9.983333,-83.85,"Vulcanus Irazú, in declivio austro-occid. in jugo australi supra domum Guayabillos.",1930.0,1,1,1,,WGS84,2020,G. Cufodontis
15081,PRESERVED_SPECIMEN,Symplocos serrulata,1259525,GBIF,Aguilar Fernández 3875,Manuel Vargas,,9.51,-83.58,"Parque Internacional La Amistad, Cordillera de Talamanca, Sendero Herradura, que sube a fila Uran.",1995.0,1,1,1,,WGS84,2020,Reinaldo Aguilar|Ó. [Esquivel] Garrote
15203,PRESERVED_SPECIMEN,Symplocos serrulata,1213588,GBIF,Edwards 719,Manuel Vargas,,6.533333,-75.483333,"Road Entrerrios-Don Matia, 2 km from Vereda Rio Grande. Disturbed primary forest.",1994.0,1,1,1,,WGS84,2020,K.S .Edwards|Álvaro Cogollo P.
15829,PRESERVED_SPECIMEN,Symplocos serrulata,100582727,GBIF,Kriebel Haehner 3280,Manuel Vargas,,10.174445,-84.169444,"No protegida.  Cuenca del Sarapiquí.  Posada Volcán Poás, Viento Fresco, Vara Blanca.",2003.0,1,1,1,,WGS84,2020,Ricardo Kriebel|Daniel Solano
15887,PRESERVED_SPECIMEN,Symplocos serrulata,100559975,GBIF,Kriebel Haehner 3380,Manuel Vargas,,9.653889,-83.844444,"R.F. Río Macho. Cuenca del Reventazón. P.N. Tapantí, entre Salsipuedes y Loma del Indio.",2003.0,1,1,1,,WGS84,2020,Ricardo Kriebel|Evelio Alfaro|Milady Alfaro
15939,PRESERVED_SPECIMEN,Symplocos serrulata,100523955,GBIF,Acosta Vargas 3955,Manuel Vargas,,10.134833,-84.12078000000001,"P. N. Braulio Carrillo. estacion Barva. Sendero al Mirador, Vara Blanca.",2006.0,1,1,1,,WGS84,2020,Luis Acosta
16032,PRESERVED_SPECIMEN,Symplocos serrulata,100516948,GBIF,Boyle 7507,Manuel Vargas,,9.54941,-83.79952,"""Montane oak forest above Albergue de Monta?a Savegre. Los Robles trail, 0.5 km beyond end of 4x4 road. Tenth ha. transect Savegre-1. Specimen preserved in 70% alcohol. """,2005.0,1,1,1,,WGS84,2020,Brad Boyle
16188,PRESERVED_SPECIMEN,Symplocos serrulata,100492812,GBIF,Vargas Salazar 3210,Manuel Vargas,,10.170389,-84.23347,P. N. Volcan Poas.  Left road to entrance.,2008.0,1,1,1,,WGS84,2020,Luis Diego Vargas
16342,PRESERVED_SPECIMEN,Symplocos serrulata,100470154,GBIF,Almeda 3111,Manuel Vargas,,9.680556,-83.853889,Ca. 14 km SE of El Empalme.,1977.0,1,1,1,,WGS84,2020,Frank Almeda|et al.
16344,PRESERVED_SPECIMEN,Symplocos serrulata,100470156,GBIF,Almeda 3775,Manuel Vargas,,9.95,-83.8,Southeast facing slopes of Volcán Irazú about 7-8 km beyond the entrance to the Parque Nacional and about 5 km beyond the turnoff to Hacienda Coliblanco,1978.0,1,1,1,,WGS84,2020,Frank Almeda|K. Nakai
16839,PRESERVED_SPECIMEN,Symplocos serrulata,100161874,GBIF,Moraga López 396,Manuel Vargas,,9.120833,-82.965278,P.N. La Amistad. Tararia. Valle Silencio a jardines.,1996.0,1,1,1,,WGS84,2020,Marcos Moraga
16840,PRESERVED_SPECIMEN,Symplocos serrulata,100161871,GBIF,Alfaro Vindas 4651,Manuel Vargas,,9.133056,-82.964167,P.N. La Amistad. Tararia. Estación el Valle del silencio. Entre el Campamento y el Jardín.,2003.0,1,1,1,,WGS84,2020,Evelio Alfaro
16842,PRESERVED_SPECIMEN,Symplocos serrulata,100161862,GBIF,Alfaro Vindas 3805,Manuel Vargas,,9.013889,-82.81944399999999,"Z.P. Las Tablas. Cuenca Térraba-Sierpe. Sendero hacia Cerro Echandi, colectado en bosque.",2001.0,1,1,1,,WGS84,2020,Evelio Alfaro
16939,PRESERVED_SPECIMEN,Symplocos serrulata,4459646,GBIF,,Manuel Vargas,,9.140167,-83.066389,"Buenos Aires. Área de Conservación Amistad Pacífico, Potrero Grande, Estación Tres Colinas. Lindero de cortafuegos que conecta con el Sendero principal a Cerro Kamuk.",2015.0,1,1,1,,WGS84,2020,Nelson A. Zamora Villalobos; Soo-Yong Kim ; Jose Antonio Azofeifa Zuñiga ; Róger Gutiérrez
16940,PRESERVED_SPECIMEN,Symplocos serrulata,4459645,GBIF,,Manuel Vargas,,9.140167,-83.066389,"Buenos Aires. Área de Conservación Amistad Pacífico, Potrero Grande, Estación Tres Colinas. Lindero de cortafuegos que conecta con el Sendero principal a Cerro Kamuk.",2015.0,1,1,1,,WGS84,2020,Nelson A. Zamora Villalobos; Soo-Yong Kim ; Jose Antonio Azofeifa Zuñiga ; Róger Gutiérrez
